CODE;ENGLISH;FRENCH;GERMAN;POLISH;SPANISH;ITALIAN;SWEDISH;CZECH;HUNGARIAN;DUTCH;PORTUGUESE;RUSSIAN;FINNISH;x
EVTDESC19200_NEWS_LONG;His Majesty the King thereupon refused to receive the Ambassador again and had the latter informed by the Adjutant of the day that His Majesty had no further communication to make to the Ambassador’. This reads the dispatch to the French government, resulting in a diplomatic incident between France and $FROMCOUNTRY$-a perceived snubbing of the French ambassador, by the Prussian King, at the Monarch’s vacation resort at Bad Ems, Hesse-Nassau, Prussia. Rumours claim that the dispatch might have been purposely engineered by German officials to provoke a war.;;;;;;;;;;;;;x
EVTDESC19200_NEWS_MEDIUM;A diplomatic conflict has erupted between France and Germany following a perceived snubbing of the French ambassador, by the Prussian King, at the Monarch’s vacation resort at Bad Ems. Rumours claim this might have been purposely engineered to provoke a war.;;;;;;;;;;;;;x
EVTDESC19200_NEWS_SHORT;A diplomatic conflict has erupted between France and Germany following a perceived snubbing of the French ambassador, by the Prussian King, at the Monarch’s vacation resort at Bad Ems.;;;;;;;;;;;;;x
EVTDESC19300_NEWS_LONG;The people of France have presented to the American people a spectacular gift. An enormous copper statue, 151 ft. tall, depicting a woman carrying a torch, representing and named ‘Liberty Enlightening the World’. The design has been carried out by one Frederic Auguste Bartholdi, and a place has been set aside for the statue on an island in the New York harbour. The statue will henceforth be known, simply, as ‘The Statue of Liberty’.;;;;;;;;;;;;;x
EVTDESC19300_NEWS_MEDIUM;The people of France have presented to the American people a spectacular gift. An enormous copper statue depicting a woman carrying a torch, representing and named ‘Liberty Enlightening the World’. The statue will henceforth be known, simply, as ‘The Statue of Liberty’.;;;;;;;;;;;;;x
EVTDESC19300_NEWS_SHORT;The people of France have presented to the American people a spectacular gift. An enormous copper statue depicting a woman carrying a torch, known as ‘the Statue of Liberty’.;;;;;;;;;;;;;x
EVTDESC19310_NEWS_LONG;Peking-A sleeping giant appears to have awoken as members of diplomatic circles are in general agreement that the nation of China can now be counted among the Great Powers of the world. Chinese leaders attribute the rise in their fortunes to the fact their government enjoys the Mandate of Heaven. European leaders maintain it is because western ideas and customs were adopted in the Orient. Regardless of the cause, the potential of the Chinese leviathan is limitless, and the world would do well to take notice. We advise readers to watch with growing apprehension.;;Peking – Ein schlafender Riese scheint erwacht. Mitglieder diplomatischer Kreise sind sich einig, dass China nun zu den Großmächten der Welt zählt. Chinesische Anführer begründen dies mit dem Himmelsauftrag, den ihre Regierung erfüllt. Europäische Anführer sehen die Ursache eher in der Übernahme westlicher Ideen und Gebräuche im Orient. Egal warum, das Potential des chinesischen Leviathans ist grenzenlos und die Welt sollte dem Beachtung schenken. Wir empfehlen unseren Lesern, die weitere Entwicklung aufmerksam zu verfolgen.;;;;;;;;;;;x
EVTDESC19310_NEWS_MEDIUM;A sleeping giant has awoken as diplomatic circles are in agreement that China can be counted among the Great Powers of the world. Chinese leaders attribute the rise in their fortunes to the Mandate of Heaven, but Europeans say it is because western ideas were adopted.;;Ein schlafender Riese scheint erwacht. Diplomatische Kreise sind sich einig, dass China nun zu den Großmächten der Welt zählt. Chinesische Anführer begründen dies mit dem Himmelsauftrag ihrer Regierung, Europa jedoch sieht die Ursache eher in der Übernahme westlicher Ideen.;;;;;;;;;;;x
EVTDESC19310_NEWS_SHORT;Diplomatic circles agree that China can be counted among the Great Powers. Chinese leaders attribute their fortunes to the Mandate of Heaven. European leaders say western ideas are the cause.;;Diplomatische Kreise sind sich einig, dass China nun zu den Großmächten zählt. Anführer Chinas begründen dies mit dem Himmelsauftrag, Europa sieht die Ursache eher in den westlichen Ideen.;;;;;;;;;;;x
EVTDESC19320_NEWS_LONG;Tokyo, the land of the rising sun—the chickens appear to have come home to roost today as members of diplomatic circles are in general agreement that the nation of Japan can be counted among the great powers of the world. Since coming into contact with western influences some years ago, the industrious people of Japan have made sweeping advances in the fields of culture, industry and military prowess and can no longer be dismissed as backward savages. Geopolitical experts have expressed concerns that the new Japan could attempt expansion through Asia and beyond.;;Tokio, das Land der aufgehenden Sonne – Diplomaten sind sich einig, dass Japan nun zu den Großmächten der Welt zählt. Seit diese Nation vor Jahren mit westlichen Einflüssen in Kontakt kam, entwickelten die Japaner unglaubliche Fortschritte in Bereichen der Kultur, Industrie und des Militärwesens. Sie sind definitiv nicht mehr rückständige Wilde. Experten der Weltpolitik äußern Bedenken, dass das neue Japan die Ausdehnung nach Asien und darüber hinaus anstreben könnte.;;;;;;;;;;;x
EVTDESC19320_NEWS_MEDIUM;Diplomatic circles are in agreement that Japan can be counted among the great powers of the world. The industrious Japanese people have made sweeping advances in the fields of culture, industry and military and can now no longer be dismissed as filthy, backward savages.;;Diplomaten sind sich einig, dass Japan nun zu den Großmächten der Welt zählt. Die Japaner entwickelten unglaubliche Fortschritte in Bereichen der Kultur, Industrie und des Militärwesens. Sie sind definitiv keine rückständigen Wilden mehr.;;;;;;;;;;;x
EVTDESC19320_NEWS_SHORT;Diplomatic circles now agree that Japan can be counted among the great powers of the world. The Japanese people have made sweeping advances and can no longer be dismissed as backward savages.;;Diplomaten sind sich einig, dass Japan nun zu den Großmächten der Welt zählt. Die Japaner entwickelten unglaubliche Fortschritte und sind definitiv keine rückständigen Wilden mehr.;;;;;;;;;;;x
EVTDESC19355_NEWS_LONG;Geopolitical scholars held a symposium last week and came to broad agreement that rises in nationalist sentiment, military pride and new and fearsome weapons of war mean that future conflicts involving many great powers are likely to fall into an entirely new category called ‘great wars’. It is likely that greater territorial changes, humiliations and national liberations will feature, though outright annexations are still considered to be unlikely. Will man’s stubbornness, ingenuity and violent nature lead to the very destruction of the earth? Only time will tell.;;Geopolitische Gelehrte stimmten letzte Woche mehrheitl. überein, dass das Erstarken nationaler Stimmungen, milit. Stolzes und neuer, schrecklicher Kriegswaffen dazu führen werden, dass künftige Konflikte der Großmächte wahrscheinlich zur neuen Kategorie der 'Großen Kriege' führen können. Es wird erwartet, das größere Territorialänderungen, Beschämungen und nationale Befreiungen auftreten, auch wenn direkte Übernahmen unwahrscheinlich sind. Wird die Sturheit, der Erfindergeist und die Gewalttätigkeit der Menschheit zur Zerstörung der Erde führen? Die Zeit wird es zeigen.;;;;;;;;;;;x
EVTDESC19355_NEWS_MEDIUM;Geopolitical scholars held a symposium last week and came to broad agreement that new and fearsome weapons of war mean that future conflicts involving great powers are likely to fall into an entirely new category called great wars. Greater territorial changes seem likely now.;;Geopolitische Gelehrte stimmten letzte Woche mehrheitl. überein, dass neue Kriegswaffen dazu führen werden, dass künftige Konflikte der Großmächte wahrscheinlich zur neuen Kategorie der 'Großen Kriege' führen können. Größere Territorialänderungen werden wahrscheinlicher.;;;;;;;;;;;x
EVTDESC19355_NEWS_SHORT;Geopolitical scholars held a symposium last week and came to agreement that future conflicts involving many great powers are likely to fall into an entirely new category called ‘great wars’.;;Geopolitische Gelehrte stimmten letzte Woche mehrheitl. überein, dass künftige Konflikte der Großmächte zur neuen Kategorie der 'Großen Kriege' führen könnten.;;;;;;;;;;;x
EVTDESC19356_NEWS_LONG;It has become increasingly clear that we have entered a new era of unprecedented warfare. The conflicts of our time are no longer mere local issues, but instead reach every corner of the world. Considering the ever-increasing stakes and the terrifying impact of these hostilities on the nations involved, there is no longer any need for restrain.;;;;;;;;;;;;;x
EVTDESC19356_NEWS_MEDIUM;It has become increasingly clear that we have entered a new era of unprecedented warfare. The conflicts of our time are no longer mere local issues, but instead reach every corner of the world. Considering the ever-increasing stakes and the terrifying impact of these hostilities on the nations involved, there is no longer any need for restrain.;;;;;;;;;;;;;x
EVTDESC19356_NEWS_SHORT;It has become increasingly clear that we have entered a new era of unprecedented warfare.;;;;;;;;;;;;;x
EVTDESC19370_NEWS_LONG;$FROMCOUNTRY_ADJ$ soldiers marched into $CAPITAL$ today, accompanying the new $FROMCOUNTRY_ADJ$ governor who will be overseeing the operation of the $COUNTRY_ADJ$ puppet government. Already the $COUNTRY_ADJ$ people are up in arms over this imposition by a foreign power, though some are clearly questioning whether there is anything to be done. $COUNTRY$ did not submit willingly, after all, and if a rebellion breaks them free of $FROMCOUNTRY_ADJ$ control would $FROMCOUNTRY$ not simply invade once again?;;;;;;;;;;;;;x
EVTDESC19370_NEWS_MEDIUM;$FROMCOUNTRY_ADJ$ soldiers marched into $CAPITAL$ today, accompanying the new $FROMCOUNTRY_ADJ$ governor who will be overseeing the operation of the $COUNTRY_ADJ$ puppet government. Already the $COUNTRY_ADJ$ people are up in arms over this imposition by a foreign power.;;;;;;;;;;;;;x
EVTDESC19370_NEWS_SHORT;$FROMCOUNTRY_ADJ$ soldiers marched into $CAPITAL$ today, accompanying the new $FROMCOUNTRY_ADJ$ governor who will be overseeing the operation of the $COUNTRY_ADJ$ puppet government.;;;;;;;;;;;;;x
EVTDESC19500_NEWS_LONG;The smouldering remains of a Voortrekker wagon train were discovered by scouts near the Bushman river a few days ago. In the devastation left after what must obviously have been an attack, they have found the remains of several Afrikaner men, women and children. Spearheads left at the site tell a clear tale. It appears as if the Impis of the Zulu, to the South-east, are behind the massacre. A military intervention against the tribe might be necessary as a response to this new threat against the Voortrekker pioneers.;;Die rauchenden Überreste eines Voortrekker-Personenzuges wurden von Spähern vor einigen Tagen nahe des Bushman-Flusses entdeckt. Als Ergebnis dieses vermuteten Angriffs fanden sie die Leichen zahlreicher Männer, Frauen und Kinder der Afrikaans. Vorort gefundene Speerspitzen bestätigen den Verdacht, dass die Impis der Zulu aus dem Südosten hinter dem Massaker stecken. Eine Militäraktion gegen den Stamm scheint die einzig richtige Antwort auf diese neue Bedrohung der Voortrekker-Pioniere.;;;;;;;;;;;x
EVTDESC19500_NEWS_MEDIUM;The smouldering remains of a Voortrekker wagon train were discovered by scouts near the Bushman river a few days ago. They have found the remains of several Afrikaner men, women and children. Spearheads left at the site tell a clear tale. The Zulu are behind the massacre.;;Überreste eines Voortrekker-Personenzuges wurden von Spähern vor einigen Tagen nahe des Bushman-Flusses entdeckt. Sie fanden die Leichen zahlreicher Männer, Frauen und Kinder der Afrikaans. Gefundene Speerspitzen bestätigen den Verdacht, dass die Zulu hinter dem Massaker stecken.;;;;;;;;;;;x
EVTDESC19500_NEWS_SHORT;The smouldering remains of a Voortrekker wagon train were discovered by scouts near the Bushman river. Spearheads left at the site tell a clear tale. The Zulu are behind the massacre.;;Überreste eines Voortrekker-Zuges wurden von Spähern vor einigen Tagen am Bushman-Fluss entdeckt. Gefundene Speerspitzen bestätigen den Verdacht, dass die Zulu hinter dem Massaker stecken.;;;;;;;;;;;x
EVTDESC19501_NEWS_LONG;Migrants have been moving in large numbers through the colony on the Cape, on their way to the newly incorporated town of ‘Johannesburg’, on the edge of the Witwatersrand mountains, where a major gold rush is taking place. Local ancient river deltas hold unimaginable amounts of gold deposits, washed down from surrounding gold-rich greenstone belts to the north and west. The massive influx of foreign residents to the area is causing trouble along the borders, and this might become a threat to the independence of these fringe states.;;Einwanderer ziehen in Massen, auf ihrem Weg in die neue Stadt 'Johannesburg' am Rand der Witwatersrand-Berge, durch die Kolonie am Kap, wo das Goldfieber ausgebrochen ist. Die Flussdeltas der Region sind reich an unglaublichen Goldvorräten, die aus dem Norden und Westen des Grünsteingürtels herangewaschen wurden. Der enorme Zuwachs an Fremden sorgt für Probleme in den Grenzgebieten, was für die Randstaaten zum Problem werden kann.;;;;;;;;;;;x
EVTDESC19501_NEWS_MEDIUM;Migrants have been moving in large numbers on their way to the newly incorporated town of ‘Johannesburg’, in the Witwatersrand mountains, where a major gold rush is taking place. The massive influx of foreign residents might become a threat to the independence of the fringe states.;;Einwanderer ziehen in Massen in die neue Stadt 'Johannesburg' am Rand der Witwatersrand-Berge, wo das Goldfieber ausgebrochen ist. Der enorme Zuwachs an Fremden sorgt für Probleme in den Grenzgebieten, was für die Randstaaten zum Problem werden kann.;;;;;;;;;;;x
EVTDESC19501_NEWS_SHORT;Migrants have been moving in large numbers through the colony on the Cape, on their way to the newly incorporated town of ‘Johannesburg’, where a major gold rush is taking place.;;Einwanderer ziehen in Massen auf ihrem Weg in die neue Stadt 'Johannesburg' am Rand der Witwatersrand-Berge durch die Kolonie am Kap, wo das Goldfieber ausgebrochen ist.;;;;;;;;;;;x
EVTDESC20002_NEWS_LONG;Thousands of people flooded into $CAPITAL$’s central square, demanding an end to the $COUNTRY_ADJ$ dictatorship with a democratic constitution and universal suffrage. The $COUNTRY_ADJ$ army stood by, waiting for the orders to attack the crowds, but some in $COUNTRY$ are considering whether it might be better to accede to the public’s demands.;;;;;;;;;;;;;x
EVTDESC20002_NEWS_MEDIUM;Thousands of people flooded into $CAPITAL$’s central square, demanding an end to the $COUNTRY_ADJ$ dictatorship with a democratic constitution and universal suffrage.;;;;;;;;;;;;;x
EVTDESC20002_NEWS_SHORT;Thousands of people flooded into $CAPITAL$’s central square, demanding an end to the $COUNTRY_ADJ$ dictatorship with a democratic constitution and universal suffrage.;;;;;;;;;;;;;x
EVTDESC20006_NEWS_LONG;Today is a grim day for $COUNTRY$. The $COUNTRY_ADJ$ president has been shot dead in $CAPITAL$, the victim of an ambush plotted by radical liberals. The country has been thrown into mourning, though even now there is word that factions are manoeuvring to either find a successor to take the president’s place… or overthrow the $COUNTRY_ADJ$ dictatorship once and for all.;;;;;;;;;;;;;x
EVTDESC20006_NEWS_MEDIUM;Today is a grim day for $COUNTRY$. The $COUNTRY_ADJ$ president has been shot dead in $CAPITAL$, the victim of an ambush plotted by radicals. The country has been thrown into mourning, though even now factions are manoeuvring to find a successor to take the president’s place.;;;;;;;;;;;;;x
EVTDESC20006_NEWS_SHORT;The $COUNTRY_ADJ$ president has been shot dead in $CAPITAL$, the victim of an ambush plotted by radicals. Even now factions are manoeuvring to find a successor to take the president’s place.;;;;;;;;;;;;;x
EVTDESC201026_NEWS_LONG;Ruins in the jungle as far as the eye can reach. These remains are old-very old, as our archaeologists affirm. This huge city is one of the biggest places ever found in Yucatan, and it dates back to pre-classical times. El Mirador, one of the oldest and greatest settlements of the Mayan culture, was rediscovered by $COUNTRY_ADJ$ archaeologists. The prestigious finding has already given much international attention to the $COUNTRY_ADJ$ Excavation Office in $CAPITAL$ and will surely enhance further research in these fields.;;;;;;;;;;;;;x
EVTDESC201026_NEWS_MEDIUM;An $COUNTRY_ADJ$ excavation team has discovered an ancient site in Yucatan which appears to be El Mirador, one of the oldest and greatest settlements of the Mayan culture. The finding has given much international attention to the $COUNTRY_ADJ$ Excavation Office and will surely enhance further research.;;;;;;;;;;;;;x
EVTDESC201026_NEWS_SHORT;An $COUNTRY_ADJ$ excavation team has discovered the ancient Maya ruins of El Mirador in Yucatan. The finding has given much international attention and will enhance further research.;;;;;;;;;;;;;x
EVTDESC201036_NEWS_LONG;Scientific research and aerial photos leave no doubt: Babylon, once a myth and known in the west only as a decadent city mentioned in the Bible, is now a well-known place of modern archaeology. The most prestigious trove was the discovery by an $COUNTRY_ADJ$ archaeologist, who confirmed that even the legendary Tower of Babel is not a fable but has historical roots. The prestigious finding has already given much international attention to the $COUNTRY_ADJ$ Excavation Office in $CAPITAL$ and will surely enhance further research in these fields.;;;;;;;;;;;;;x
EVTDESC201036_NEWS_MEDIUM;An $COUNTRY_ADJ$ excavation team has discovered an ancient city in Mesopotamia which appears to be Babylon, one of the greatest cities of the ancient world. The finding has given much international attention to the $COUNTRY_ADJ$ Excavation Office and will surely enhance further research.;;;;;;;;;;;;;x
EVTDESC201036_NEWS_SHORT;An $COUNTRY_ADJ$ excavation team has discovered the ancient city of Babylon in Mesopotamia. The finding has given much international attention and will enhance further research.;;;;;;;;;;;;;x
EVTDESC203771_NEWS_LONG;European terrorist organizations have taken it upon themselves to destroy the symbol of American Liberty and have succeeded, today the statue of Liberty lies fallen and the world weeps.;;;;;;;;;;;;;x
EVTDESC203771_NEWS_MEDIUM;The Statue of Liberty has been destroyed by terrorists, leaving the whole world shocked and in fear.;;;;;;;;;;;;;x
EVTDESC203771_NEWS_SHORT;The Statue of Liberty has been destroyed by terrorists, leaving the whole world shocked and in fear.;;;;;;;;;;;;;x
EVTDESC211490_NEWS_LONG;Mythical Javanese dagger (kris). Beautifully decorated and said to be very old. Promises to infuse any owner with valour and courage! Blade shows some rust, but otherwise in perfect condition. Received in thanks from a Sultan for saving his sons’ life from the dangers of black magic. Reason for sale: blade is unlucky and does not take kind to me. Needs an adventurous new owner who is attuned to, and will take care of, it. Interested? Contact: Charles Knaud, Royal Palace, Jogjakarta, Java. Warning: improper care might result in blade trying to kill owner.;;;;;;;;;;;;;x
EVTDESC211490_NEWS_MEDIUM;Mythical Javanese dagger (kris). Beautifully decorated and very old. Promises to infuse owner with courage! Received in thanks for saving Sultans’ sons’ life. Blade needs owner who is attuned to, and willing take care of, it. Contact: Charles Knaud, Royal Palace, Jorjakarta, Java.;;;;;;;;;;;;;x
EVTDESC211490_NEWS_SHORT;Mythical Javanese dagger (kris). Received for saving some prince’s life from the common cold. Blade is a bit old and rusted, but otherwise beautifully decorated. Any price is acceptable.;;;;;;;;;;;;;x
EVTDESC21500_NEWS_LONG;The Tunguska explosion of 1908, which produced a devastating fireball in Siberia that destroyed forests and caused worldwide tremors, was the result of an asteroid or meteor, scientists believe. Witnesses located as far as tens of miles from the event report seeing the sky split in two parts and then filling with fire delivering unbearably high heat to their bodies, followed by repeated loud thumping sounds of multiple rocks hitting the ground. Fiery wind burned paths on the ground along the streets, the explosion was so bright it looked like a second Sun.;;Die Tunguska-Explosion von 1908, in der ein gewaltiger Feuerball in Sibirien Wälder zerstörte und die ganze Welt erschütterte, war laut Forschern das Ergebnis eines Asteroiden- oder Meteoreinschlags. Zeugen berichten, dass sie noch aus zehntausenden von Metern Entfernung den Himmel in Flammen aufgehen sahen und die Hitze unerträglich wurde, gefolgt vom lauten Donnerhall des Einschlags von Steinsbrocken. Feuerstürme verbrannten die Erde, die Explosion wirkte wie eine zweite Sonne.;;;;;;;;;;;x
EVTDESC21500_NEWS_MEDIUM;The Tunguska explosion of 1908, which produced a devastating fireball in Siberia destroying forests and causing worldwide tremors, was the result of an asteroid or meteor, scientists believe. The explosion was so bright it looked like a second Sun.;;Die Tunguska-Explosion von 1908, in der ein gewaltiger Feuerball in Sibirien Wälder zerstörte und die ganze Welt erschütterte, war laut Forschern das Ergebnis eines Asteroiden- oder Meteoreinschlags. Die Explosion wirkte wie eine zweite Sonne.;;;;;;;;;;;x
EVTDESC21500_NEWS_SHORT;The Tunguska explosion of 1908, which produced a devastating fireball in Siberia destroying forests and causing worldwide tremors, was the result of an asteroid or meteor, scientists believe.;;Die Tunguska-Explosion von 1908, in der ein riesiger Feuerball in Sibirien Wälder zerstörte und die Welt erschütterte, war laut Forschern das Ergebnis eines Asteroiden- oder Meteoreinschlags.;;;;;;;;;;;x
EVTDESC21510_NEWS_LONG;The eruption of the Krakatau volcano and the resultant tsunami left over 36500 dead in the Dutch East Indies, and the sound of the eruption was heard 3000 miles away at Rodrigues Island in the Indian Ocean. The explosion had a tremendous global impact, with the sky darkening worldwide for years afterwards, producing intensely red sunsets and other optical effects, as well as global average temperature dropping by more than a degree Celsius. Barographs across the world were registering the pressure from the explosion for five days.;;Der Ausbruch des Krakatau-Vulkans und der folgende Tsunami kosteten in Niederländisch-Ostindien mehr als 36500 Leben und wurde noch in 3000 Meilen Entfernung auf der Rodrigues-Insel im indischem Ozean gehört. Er hatte weltweite Auswirkungen und verdunkelte den Himmel auf Jahre, mit intensiv-roten Sonnenuntergängen und anderen Effekten. Die weltweite Temperatur fiel um mehr als 1 Grad Celsius. Barographen aus aller Welt zeichneten den Druck der Explosion fünf Tage lang auf.;;;;;;;;;;;x
EVTDESC21510_NEWS_MEDIUM;The eruption of the Krakatau volcano and the resultant tsunami left over 36500 dead in the Dutch East Indies, and the sound of the eruption was heard 3000 miles away at Rodrigues Island in the Indian Ocean. The explosion had a tremendous global impact.;;Der Ausbruch des Krakatau-Vulkans und der folgende Tsunami kosteten in Niederländisch-Ostindien mehr als 36500 Leben und wurde noch in 3000 Meilen Entfernung auf der Rodrigues-Insel im indischem Ozean gehört. Der Ausbruch hatte weltweite Auswirkungen.;;;;;;;;;;;x
EVTDESC21510_NEWS_SHORT;The eruption of the Krakatau volcano and the resultant tsunami left over 36500 dead in the Dutch East Indies, and the sound of the eruption was heard 3000 miles away at Rodrigues Island.;;Der Ausbruch des Krakatau-Vulkans und anschließende Tsunami kosteten in Niederländisch-Ostindien mehr als 36500 Leben und wurde in 3000 Meilen Entfernung auf der Rodrigues-Insel gehört.;;;;;;;;;;;x
EVTDESC21520_NEWS_LONG;A major earthquake has struck San Francisco, California, causing widespread devastation and the loss of thousands of lives. Tremors have been reported as far away inland as Nevada, and the fire that erupted as a result of the earthquake has left the city more or less levelled. Army units are hard at work bringing in supplies to the survivors, and we can rest assured that the quake will leave its mark on public memory for generations to come.;;Ein gewaltiges Erdbeben hat San Francisco, Kalifornien, erschüttert und gewaltige Zerstörungen mit mehreren tausend Toten verursacht. Die Erschütterungen waren noch in Nevada spürbar und Brände vernichteten große Teile der Stadt. Die Armee arbeitet hart an der Versorgung der Überlebenden und das Erdbebeben wird noch viele Generationen in Erinnerung bleiben.;;;;;;;;;;;x
EVTDESC21520_NEWS_MEDIUM;A major earthquake has struck San Francisco, California, today, causing widespread devastation and the loss of thousands of lives. Tremors have been reported as far away inland as Nevada, and the fires erupting as a result of the earthquake has left the city more or less levelled.;;Ein gewaltiges Erdbeben hat heute San Francisco, Kalifornien, erschüttert und gewaltige Zerstörungen mit mehreren tausend Toten verursacht. Die Erschütterungen waren noch in Nevada spürbar und Brände vernichteten große Teile der Stadt.;;;;;;;;;;;x
