CODE;ENGLISH;FRENCH;GERMAN;POLISH;SPANISH;ITALIAN;SWEDISH;CZECH;HUNGARIAN;DUTCH;PORTUGUESE;RUSSIAN;FINNISH;x
telephone_factory_desc;The earliest telephones had only one wire for both transmitting and receiving of audio, but the design was quickly replaced by the candlestick telephone. It featured a base with a vertical cylindrical neck extending upright for up to 10 inches in length. At the top of the stand was mounted a carbon microphone (transmitter) to speak into, and a switch hook extending sideways upon which an ear piece (receiver) was hung. In order to make or answer a telephone call, the user lifted the receiver off the switch hook, thereby activating an internal switch connecting the telephone to the telephone line.;;;;;;;;;;;;;x
terrorist_cells;Terrorist Cells;Cellules terroristes;Terroristenzellen;;Grupúsculos terroristas;;;;;;;;;x
terrorist_cells_desc;With less security personnel around in the province, terrorists have an easier time hiding and waiting for opportunities to strike.;Avec la réduction du personnel de sécurité de la province, les terroristes ont moins de mal à se cacher en attendant l'occasion de frapper.;Mit weniger Sicherheitspersonal in der Provinz können Terroristen leichter in ihren Verstecken auf Gelegenheiten zum Zuschlagen warten.;;Al disminuir el personal de seguridad en una provincia, los terroristas tienen más fácil esconderse y esperar una oportunidad para atacar.;;;;;;;;;x
trusts;Trusts;Cartels;Trusts;;Cárteles;;;;;;;;;x
trusts_desc;Less government investment into crime fighting results in a very unfair distribution of the wealth in a province. The rich would get even richer, while the poor would get poorer.;La baisse des investissements de l'État dans la lutte contre le crime se traduit par une répartition très injuste des richesses dans une province. Les riches deviennent encore plus riches et les pauvres encore plus pauvres.;Weniger Regierungsinvestitionen in die Verbrechensbekämpfung führt zu einer sehr ungerechten Verteilung des Reichtums in einer Provinz. Die Reichen wurden noch reicher, während die Armen immer ärmer wurden.;;A menor inversión del gobierno en la lucha contra la delincuencia, una distribución más injusta de la riqueza de una provincia. Los ricos se hacían más ricos... y los pobres, más pobres.;;;;;;;;;x
winery_desc;The wine-making process involves the fermentation of fruit, with natural yeast or not, as well as blending. The malolactic conversion happens after, which is a bacterial process which converts ‘crisp, green apple’ malic acid to ‘soft, creamy’ lactic acid softening the taste of the wine. The wine is sometimes transferred to oak barrels to mature for a period of weeks or months. The wine must be settled or clarified and adjustments made prior to bottling. The process produces wastewater, pomace, and lees that require collection, treatment, and disposal or beneficial use.;;;;;;;;;;;;;x
