CODE;ENGLISH;FRENCH;GERMAN;POLISH;SPANISH;ITALIAN;SWEDISH;CZECH;HUNGARIAN;DUTCH;PORTUGUESE;RUSSIAN;FINNISH;x
aeroplane_factory_desc;Most aircraft in the era are constructed from wood, using metal sockets to joint members, and making use of piano wire or stranded steel cable for bracing. Wooden construction typically involved several different types of timber, with careful use of different woods according to their mechanical properties and they were typically covered in a variety of fabrics including rubberized cotton and varnished silk. The first engine design to be widely used for powering aircraft was the Antoinette water-cooled V-8 engine, believed to be the very first V-form eight-cylinder internal combustion engine ever placed in production.;;;;;;;;;;;;;x
ammunition_factory_desc;Swaging, rather than casting, was the preferred manufacturing technique during the 19th century for ammunition. Swaged bullets are bullets manufactured by swaging room temperature metals into a die to form it into the shape of a bullet. The other common manufacturing method is casting, which uses molten metals poured into a mould. Disadvantages became evident as loadings shifted to smokeless powder in the late 19th century and manufacturers of high-velocity military ammunition modified their bullet swaging process to apply a thin sheet of stronger metal over the soft lead bullet.;;;;;;;;;;;;;x
anarchic_bomb_throwers;Anarchic Bomb Throwers;Lanceurs de bombes anarchistes;Anarchistische Bombenleger;;Bombas anarquistas;;;;;;;;;x
anarchic_bomb_throwers_desc;Less money for crime fighting results in lowered ability to respond to security threats like anarchist uprisings.;La baisse des dépenses consacrées à la lutte contre le crime se traduit par une moindre efficacité en termes de réponse aux atteintes à la sécurité comme les soulèvements d'anarchistes.;Weniger Geld für die Verbrechensbekämpfung führt zu einer verringerten Reaktionsfähigkeit auf Sicherheitsrisiken wie anarchistische Rebellionen.;;La poca inversión en la lucha contra la delincuencia comporta menor capacidad de responder a amenazas contra la seguridad, como los brotes anarquistas.;;;;;;;;;x
artillery_factory_desc;The first stage of artillery production is to create an exact model of the gun, mortar, or howitzer. This is built up upon a tapered wooden spindle, from eight to 12 feet in length and about two inches less than the model in diameter. The spindle is then set upon a wooden turning frame and covered with grease or soap to aid in its eventual removal from the mould. A coat of a lye mixture is spread over the interior surface to prevent the molten metal of the casting adhering to the walls of the mould. The mould is then taken to the casting pit to be annealed.;;;;;;;;;;;;;x
automobile_factory_desc;Early automobiles, known as ‘Horseless Carriages’, were simple vehicles with two or four stroke combustion engines capable of 2/3 horsepower (0.50 kW) at 250 rpm. Featuring an open crankcase and the use of a pushrod-operated poppet valve for exhaust, a large horizontal flywheel that stabilized the single-cylinder engine’s power output and an evaporative carburettor controlled by a sleeve valve to regulate power and engine speed. They were produced in small workshops but evolved fast, with the simple open metal frame soon giving way to chassis with glass windows.;;;;;;;;;;;;;x
barrel_factory;Tank Factory;Usine de chars;Geschützrohrfabrik;;;;;;;;;;;x
barrel_factory_desc;The tank is the 20th century realization of an ancient concept: that of providing troops with mobile protection and firepower and it was born of the need to break the domination of trenches, barbed wire, and machine guns over the battlefields. The internal combustion engine, armour plate, and the continuous track were key innovations leading to the invention of the modern tank. One of the earliest used designs was a rhomboid vehicle with a low canter of gravity and long track length, able to negotiate broken ground and cross trenches while the main armament was carried in sponsons on the hull sides.;;;;;;;;;;;;;x
canned_food_factory;Cannery;;;;;;;;;;;;;x
canned_food_factory_desc;The canning concept is based on experimental food preservation work in glass containers by the French inventor Nicolas Appert. The fabrication of most cans results in at least one ‘rim’, a narrow ring whose outside diameter is slightly larger than that of the rest of the can. The flat surfaces of rimmed cans are recessed from the edge of any rim (toward the middle of the can) by about the width of the rim: the inside diameter of a rim, adjacent to this recessed surface, is slightly smaller than the inside diameter of the rest of the can. Canned food is mainly used for military rations.;;;;;;;;;;;;;x
cement_factory_desc;In 1824 Joseph Aspdin, a British bricklayer turned builder, patented a chemical process for making Portland cement which was an important advance in the building trades. This process involves sintering a mixture of clay and limestone to about 1400 °C (2552 °F), then grinding it into a fine powder which is then mixed with water, sand, and gravel to produce concrete. Concrete is used to build factories, forts, shipyards, buildings, sewage systems and tunnels. Its use quickly became widespread in civil and military construction.;;;;;;;;;;;;;x
citizen_guard;Citizen Guard;Garde citoyenne;Bürgerwache;;Guardia ciudadana;;;;;;;;;x
citizen_guard_desc;Less money for crime fighting results in lowered ability to respond to security threats like battling street gangs.;La baisse des dépenses consacrées à la lutte contre le crime se traduit par une moindre efficacité en termes de réponse aux atteintes à la sécurité tels que les combats entre gangs.;Weniger Geld für die Verbrechensbekämpfung führt zu einer verringerten Reaktionsfähigkeit auf Sicherheitsrisiken wie Straßenbanden.;;La poca inversión en la lucha contra la delincuencia comporta menor capacidad de responder a amenazas, como las peleas de bandas callejeras.;;;;;;;;;x
clipper_shipyard_desc;Clippers are fast vessels with three masts and a square rig. They are generally narrow for their length, can carry limited bulk freight and have a large total sail area. Optimized for speed, they are too fine-lined to carry much cargo. Clippers typically carry extra sails such as skysails and moonrakers on the masts and studdingsails on booms extending out from the hull or yards, which required extra hands to handle them.;;;;;;;;;;;;;x
dye_factory;Synthetic Dyeworks;;;;;;;;;;;;;x
dye_factory_desc;Natural dye is only present in small amounts and its extraction is often inefficient, so they are usually expensive. In an experiment with a compound called aniline, one of the simplest chemical components of coal tar, one inventor discovered that an alcohol extracted purple colour, which readily dyed silk, and was much more stable in sunlight than any other purple dye in use. In the Synthetic Dyeworks dyes are mixed, synthesized in a reactor, filtered for impurities, dried out and then blended. Along the way many other additives, solvents and chemical compounds are used to instigate reactions.;;;;;;;;;;;;;x
electric_gear_factory_desc;The age of electricity began in 1882 when Thomas A. Edison introduced a system of electric lighting in New York City. Electric lighting quickly spread across the United States and was soon adopted in Europe. The electrical components industry was born, producing a variety of electric components for cars, telephones, gramophones, and industrial machinery in general as the electrification in the industry advanced. Electric gears are needed for a variety of things, among them automobiles, telephones, radios, and aeroplanes.;;;;;;;;;;;;;x
explosives_factory_desc;The explosives factory manufactures a variety of components for industrial and military use like nitroglycerin, dynamite and black powder. In the early 19th century black power was the main fabricated component, used to mine for minerals, break rocks, clear fields, and make roads. With the invention of dynamite, mines could be dug deeper and more quickly, and uneconomical deposits thus became profitable. Still, the main use of explosives was in the military industry: bombs, gunpowder, ordnances. For infantry, artillery or sappers, the use of explosives and gunpowder was central in the army.;;;;;;;;;;;;;x
fabric_factory;Textile Mill;;;;;;;;;;;;;x
fabric_factory_desc;Fabric is a tightly woven textile made in a textile mill which is, among other things, used to produce sails for ships as well as clothing. With the Cartwright Loom, the Spinning Mule and the Boulton & Watt steam engine, the pieces were in place to build a mechanized textile industry. From this point there were no new inventions, but a continuous improvement in technology as the mill-owner strove to reduce cost and improve quality. Developments in the transport infrastructure facilitated the import of raw materials and export of finished cloth, diminishing costs and increasing profits.;;;;;;;;;;;;;x
fertilizer_factory_desc;In this factory fertilizer is created out of guano, sulphur, or bone meal. The most common way to create fertilizer is the Birkeland-Eyde process. This process was used to fix atmospheric nitrogen (N2) into nitric acid (HNO3), one of several chemical processes generally referred to as nitrogen fixation. The resultant nitric acid was then used as a source of nitrate (NO3-) for the fertilizers. These fertilizers are used to increase the productivity of farms or the chemical components are further refined to make explosives.;;;;;;;;;;;;;x
fort;Fort;Fort;Fort;;;;;;;;;;;x
fort_short;Fort;fort;Fort;;;;;;;;;;;x
fuel_refinery;Oil Refinery;;;;;;;;;;;;;x
fuel_refinery_desc;An oil refinery is an industrial process plant where crude oil is processed and refined into more useful products such as petroleum naphtha, gasoline, diesel fuel, asphalt base, heating oil, kerosene, and liquefied petroleum gas. In the Refinery, crude oil is separated into fractions by fractional distillation. The fractions at the top of the fractionating column have lower boiling points than the fractions at the bottom. The heavy bottom fractions are often cracked into lighter, more useful products. All of the fractions are processed further in other refining units.;;;;;;;;;;;;;x
furniture_factory_desc;Well-off pops live in very comfortable houses, although their servants lived in cramped quarters, often in the attic. During the 19th century, for the first time in history furniture was mass-produced. That meant it was cheaper but unfortunately standards of design fell. In the early 19th century skilled workers usually lived in ‘through houses’ i.e. ones that were not joined to the backs of other houses while the general populace often lived in ‘back-to-backs’. These were houses of three (or sometimes only two) rooms, one of top of the other.;;;;;;;;;;;;;x
glass_factory_desc;A new method of producing glass, known as the cylinder process, was developed in Europe during the early 19th century. In 1832, this process was used by the Chance Brothers to create sheet glass. This advancement allowed for larger panes of glass to be created without interruption, thus freeing up the space planning in interiors as well as the fenestration of buildings. The other glass-making method is glassblowing which produces bottles and other containers. Glass is used for a variety of appliances like bottles, windows, bowls, vases, lamps, jars, vacuum tubes, and light bulbs.;;;;;;;;;;;;;x
good_healthcare_poorly_funded;Poorly Funded Healthcare;;;;;;;;;;;;;x
immigrator;Immigration Selector;;;;;;;;;;;;;x
immigrator_desc;Description goes here.;;;;;;;;;;;;;x
immoral_business;Immoral Business;Activité immorale;Unmoralische Geschäfte;;Negocios inmorales;;;;;;;;;x
immoral_business_desc;With rising crime rates and less government control, businessmen would become more and more centered on their own profits. This results in a higher risk of collapse for the entire system, as everybody strives for personal interests.;Avec la hausse du taux de criminalité et moins de contrôle du gouvernement, les hommes d'affaires seraient de plus en plus centrés sur leurs propres bénéfices. Il en résulte un risque accru d'effondrement de l'ensemble du système, comme tout le monde s'affaire pour ses intérêts personnels.;Mit steigenden Kriminalitätsraten und weniger Regierungskontrolle werden sich Geschäftsleute vermehrt auf ihre eigenen Profite konzentrieren. Dies führt zu einem höheren Zusammenbruchsrisiko für das gesamte System, da jeder seinen persönlichen Interessen nachgeht.;;Con el aumento de la tasa de criminalidad y el menor control gubernamental, los hombres de negocios se centraron más y más en su propio lucro. Esto comporta un gran riesgo de colapso de todo el sistema, ya que todo el mundo lucha sólo por su interés personal.;;;;;;;;;x
instigators;Political Instigators;;;;;;;;;;;;;x
instigators_desc;If the crime fighting institutions in a province became overstretched, instigators would run amok and eventually gather sufficient attention and support to cause an impact in the established order.;;;;;;;;;;;;;x
kleptocrats;Kleptocrats;;;;;;;;;;;;;x
kleptocrats_desc;Kleptocracy is a term applied to a government seen as having a particularly severe and systemic problem with officials or a ruling class (collectively, kleptocrats) taking advantage of corruption to extend their personal wealth and political power. Typically, this system involves the embezzlement of state funds at the expense of the wider population, sometimes without even the pretence of honest service. Lacking sufficient control institutions in a country where external oversight is impossible or does not exist can mean that the bureaucrats would become kleptocrats.;;;;;;;;;;;;;x
liquor_distillery_desc;The continuous still allowed the alcohol industry to reach new levels of productivity. The still consists of a first column (called the analyser) in a column still that has steam rising and wash descending through several levels. The second column (called the rectifier) carries the alcohol from the wash, where it circulates until it can condense at the required strength. It behaves like a series of single pot stills, formed in a long vertical tube. The tube is filled with either porous packing or bubble plates. The rising vapor, starts to condense in the cooler, higher level of the column.;;;;;;;;;;;;;x
lumber_mill;Sawmill;;;;;;;;;;;;;x
lumber_mill_desc;At the sawmill, the logs are cut into boards using equipment such as circular saws and bandsaws. This is called conversion. The first stage of conversion is a process called breaking down, which means rough sawing. The second stage is called resawing and refers to more accurate / precise cutting and finishing, such as planing and further machining. The introduction of steam power in the 19th century created many new possibilities for mills, with steam powered sawmills being far more mechanized and scrap lumber from the mill providing a ready fuel source for firing the boiler.;;;;;;;;;;;;;x
luxury_clothes_factory_desc;Garments made of a single piece of the finest silk, its unique colour acquired by repeated immersions in dyes whose shades were suggestive of moonlight or of the watery reflections of the Venetian lagoons, clothing embroiled with gold threads, handmade printed silk square scarves. The curvaceous S-Bend silhouette dominated fashion for women, the corset tightly laced at the waist which forced the hips back. Men wore tight-fitting, calf length frock coats and a waistcoat or vest. The vests were single-or double-breasted, with shawl or notched collars and accompanied by a crane or a hat.;;;;;;;;;;;;;x
luxury_furniture_factory_desc;Dark or gilded carved wood and richly patterned fabrics, intricate gold ornaments, cushions and fabric made out of silk, the finest or most exotic wood in the world used in furniture. Luxury furniture designers use and modify many styles taken from various time periods in history like Gothic, Tudor, Elizabethan, English Rococo, Neoclassical, and others. The Gothic and Rococo revival style are the most common styles to be seen in furniture during this time in history. Styles are mixed with the introduction of middle east and Asian influences in furniture, fittings, and interior decoration.;;;;;;;;;;;;;x
machine_parts_factory_desc;The Industrial Revolution received a further boost with the popularization of railways. For the machinery industry this brought all sorts of new work with new machinery for metallurgy, machine tools for metalworking and production of steam engines for trains. In addition, the emerging machine factories started making machines for production machines as textile machinery, compressors, agricultural machinery, and engines for ships. In time the market for the machine industry became wider, specialized products were manufactured for a greater national and often international market.;;;;;;;;;;;;;x
machine_politics;Machine Politics;Clientélisme;Politikmaschinerie;;Clientelismo;;;;;;;;;x
machine_politics_desc;The system of machine politics was in essence the bribery of mainly minorities by politicians using their influence. It was common to use the appointment for government jobs as a means of bribery within this system.;Le système du clientélisme se traduit, par essence, par la corruption des principales minorités par les politiciens usant de leur influence. Les nominations à des postes gouvernementaux sont des moyens de corruption.;Beim Politikmaschinerie-System ging es um Bestechungsgelder, die Politiker mit Hilfe ihres Einflusses hauptsächlich Minoritäten zukommen ließen. Innerhalb dieses Systems war es gang und gäbe, Regierungsjobs zu Bestechungszwecken auszunutzen.;;Era, en esencia, el soborno de minorías importantes por parte de políticos que utilizaban su influencia sobre ellas. En este sistema era común el soborno mediante la designación a dedo para cargos públicos.;;;;;;;;;x
mafia;Mafia;Mafia;Mafia;;Mafia;;;;;;;;;x
mafia_desc;If the crime fighting institutions in a province become overstretched, organized crime in form of a mafia would develop. Such organizations resulted in lowered productivity in the province.;Si les institutions de lutte contre le crime d'une province sont trop sollicitées, le crime organisé se transforme en mafia. Et la productivité de la province baisse.;Wenn die Institutionen zur Verbrechensbekämpfung in einer Provinz überlastet sind, entwickelt sich organisiertes Verbrechen in Form einer Mafia. Solche Organisationen verringern die Produktion in der Provinz.;;Si las fuerzas de seguridad de una provincia estaban al límite, solía aparecer la delincuencia organizada en forma de mafias. Tales organizaciones conllevaban una merma de la productividad de la provincia.;;;;;;;;;x
naval_base;Naval Base;Base navale;Marinestützpunkt;;;;;;;;;;;x
paper_mill_desc;The paper mill uses a Fourdrinier machine to make paper from vegetable fibres such as wood pulp. The machine is composed of a conveyor belt woven from bronze in the forming section, where a slurry of fibre (usually wood or other vegetable fibres) is drained to create a continuous paper web. After the forming section the wet web passes through a horizontal drainage area, referred to as the drainage table, thus creating a continuous production of Paper. Paper is used for books, newspapers, and other means of information.;;;;;;;;;;;;;x
province_selector;Province Selector;Usine de radios;Radiofabrik;;;;;;;;;;;x
province_selector_desc;Description goes here.;;;;;;;;;;;;;x
radio_factory_desc;AM radio uses amplitude modulation, in which the amplitude of the transmitted signal is made proportional to the sound amplitude captured (transduced) by the microphone, while the transmitted frequency remains unchanged. It can be a TRF receiver or a super heterodyne receiver, the latter typically using 6 triodes: a mixer, local oscillator, two IF and two audio amplifier stages, with an IF of 45 kHz. The radio case could be made of Bakelite or wood and the insides typically were made out of a variety of metals and vacuum tubes, with the occasional rubber to isolate.;;;;;;;;;;;;;x
railroad;Railroad;;;;;;;;;;;;;x
regular_clothes_factory;Clothes Factory;;;;;;;;;;;;;x
regular_clothes_factory_desc;During the industrial revolution, fabric production was mechanized with machines powered by waterwheels and steam-engines. Production shifted from small cottage-based production to mass production based on assembly line organization, with the sewing machine revolutionized clothes productions. The original machine was made of wood and uses a barbed needle which passes downward through the cloth to grab the thread and pull it up to form a loop to be locked by the next loop.;;;;;;;;;;;;;x
rotten_boroughs;Rotten Boroughs;Bourgs pourris;Rotten Boroughs;;Burgos podridos;;;;;;;;;x
rotten_boroughs_desc;The system of rotten boroughs was a system to create such small voting districts that a certain victory could be won through plain bribery.;Le système des bourgs pourris consiste à créer des circonscriptions électorales si petites qu'elles permettent une victoire certaine par le biais de la corruption.;Das System der Rotten Boroughs schaffte so kleine Wahldistrikte, dass Wahlsiege durch Bestechung gewonnen werden konnten.;;Con el sistema de burgos podridos se creaban distritos de votantes tan pequeños que se podía obtener una victoria mediante el soborno descarado.;;;;;;;;;x
small_arms_factory_desc;The basic equipment of the military, encompassing small arms such as muskets, rifled muskets, pistols, revolvers, and rifles. Rifled muskets, the most common firearm in the mid-19th century was wrought in iron, forged as one piece, annealed, and machined to the configuration of a threaded plug extending from one leg of an L-shaped tang. It was carburized for wear resistance, and finished in wood in the stock and barrel bands. Some of them were rifled while old musket models weren’t, and they typically came with a bayonet and a ramrod.;;;;;;;;;;;;;x
spoil_system;Spoil System;Système des dépouilles;Verdorbenes System;;Chupar del bote;;;;;;;;;x
spoil_system_desc;Lacking sufficient control institutions, politicians would eventually use their power and influence for their personal wealth and glory. This results in increased militancy of the whole population in the province.;À défaut d'institutions de contrôle suffisantes, les politiciens usent de leur pouvoir et de leur influence pour assurer leur fortune et leur gloire personnelle. Cela se traduit par un militantisme accru de toute la population de la province.;Ohne ausreichende Kontrollinstitutionen nutzten Politiker schließlich ihre Vorrechte und ihren Einfluss, um sich persönliche Vorteile in Form von Reichtum und Ruhm zu verschaffen. Dies führt zu erhöhter Militanz der gesamten Bevölkerung in der Provinz.;;Ante la falta de control de las instituciones, los políticos solían usar su poder e influencia en aras de su gloria y riqueza personal. Esto conlleva el aumento de la militancia de toda la población de una provincia.;;;;;;;;;x
steamer_shipyard_desc;The key innovation that made steamers viable is the change from the paddle-wheel to the screw-propeller for propulsion. Steam engines are designed with the power delivered at the bottom of the machinery, to give direct drive to the propeller shaft, where it passes to the stern tube through the hull. Since the motive power of screw propulsion is delivered along the shaft, a thrust bearing is needed to transfer that load without excessive friction.;;;;;;;;;;;;;x
steel_factory;Steel Mill;;;;;;;;;;;;;x
steel_factory_desc;Steel is an alloy of iron and other elements, primarily carbon, used in construction and other applications. When iron is smelted from its ore it contains more carbon than is desirable. To become steel, it must be reprocessed to reduce the carbon to the correct amount, at which point other elements can be added. Steel mills cast the raw iron into ingots which are stored until further refinement processes. The steel ingots are then heated in a soaking pit and hot rolled into slabs, blooms, or billets. Those are rolled into sheet metal, plates, bars, rods, wires, and structural steel, such as I-beams and rails.;;;;;;;;;;;;;x
synthetic_oil_factory;Coal Liquefaction Plant;;;;;;;;;;;;;x
synthetic_oil_factory_desc;The main methods of direct conversion of coal to liquids by hydrogenation process is the Bergius process. In this process, the coal is finely ground and dried in a stream of hot gas. The dry product is mixed with heavy oil recycled from the process and a catalyst is typically added to the mixture. Usually, iron sulphides present in the coal may have sufficient catalytic activity for the process. The mixture is then pumped into a reactor and the reaction occurs between 400 to 500 °C and 20 to 70 MPa hydrogen pressure. The reaction produces heavy oils, middle oils, gasoline, and gases.;;;;;;;;;;;;;x
synthetic_sulphur_factory;Nitrate Factory;Usine de téléphones;Telefonfabrik;;;;;;;;;;;x
synthetic_sulphur_factory_desc;Ammonia was first manufactured using the Haber process on an industrial scale in 1913 in BASF’s Oppau plant in Germany, reaching 20 tonnes per day the following year. During World War I, the production of munitions required large amounts of nitrate. The Allies had access to large sodium nitrate deposits in Chile controlled by British companies. Germany had no such resources, so the Haber process proved essential to the German war effort. Synthetic ammonia from the Haber process was used for the production of nitric acid, a precursor to the nitrates used in explosives.;;;;;;;;;;;;;x
