CODE;ENGLISH;FRENCH;GERMAN;POLISH;SPANISH;ITALIAN;SWEDISH;CZECH;HUNGARIAN;DUTCH;PORTUGUESE;RUSSIAN;FINNISH;x
EVTDESC900002;The Turks have said that they would be willing to grant independence to their Libyan territories while allowing us unlimited trading rights within said territories. While this would prevent a possibly long and bloody conflict, it would also stall our goals towards further colonization in Africa.;;;;;;;;;;;;;x
EVTNAME900002;Turks Suggest a Compromise;;;;;;;;;;;;;x
EVTOPTA900002;Fine. We agree.;;;;;;;;;;;;;x
EVTOPTB900002;Is this some kind of joke? We demand full control over Libya!;;;;;;;;;;;;;x
EVTDESC900005;Italy has agreed to allow us to maintain nominal suzerainty over Libya while granting them full trade access within the territories. This is in our best interests for now.;;;;;;;;;;;;;x
EVTNAME900005;The Italians Agree to Our Compromise;;;;;;;;;;;;;x
EVTOPTA900005;Very well.;;;;;;;;;;;;;x
EVTDESC900006;The Italians have refused our suggested compromise and continue to demand full control over Libya. Shall we back down and concede or prove our worth in battle?;;;;;;;;;;;;;x
EVTNAME900006;Italians Refuse Deal;;;;;;;;;;;;;x
EVTOPTA900006;Allah will grant us victory. To battle!;;;;;;;;;;;;;x
EVTOPTB900006;We concede.;;;;;;;;;;;;;x
EVTDESC900007;Turkey has refused our demands once again and threatens to respond militarily if we pursue our interests in Libya. Will we go to war, or will we back down?;;;;;;;;;;;;;x
EVTNAME900007;Turks Refuse!;;;;;;;;;;;;;x
EVTOPTA900007;To arms!;;;;;;;;;;;;;x
EVTOPTB900007;Bide our time.;;;;;;;;;;;;;x
EVTDESC900008;The Turks have backed down and agreed to grant us full control over Libya. Surely our might is great.;;;;;;;;;;;;;x
EVTNAME900008;The Turkish Concession;;;;;;;;;;;;;x
EVTOPTA900008;Great!;;;;;;;;;;;;;x
EVTOPTB900008;Let’s take Rhodes too.;;;;;;;;;;;;;x
EVTDESC900009;Our brave soldiers truly fought with the Lord on their side as the Turks fell to the ground in wave after wave. Libya is now ours. This is truly a glorious day for our nation! \n \n Even more fortunate, the Dodecanese Islands rebelled from their Turkish masters and proclaimed themselves the Federation of the Dodecanese Islands. If we don’t intervene, they will surely be suppressed. By intervening, we can take the islands in the name of peace and stability.;;;;;;;;;;;;;x
EVTNAME900009;Italy Conquers Libya;;;;;;;;;;;;;x
EVTOPTA900009;Let the Turks deal with them.;;;;;;;;;;;;;x
EVTOPTB900009;Onwards to Rhodes!;;;;;;;;;;;;;x
EVTDESC900010;Our glorious armies have defeated the Italians. Truly Allah is on our side.;;;;;;;;;;;;;x
EVTNAME900010;The Ottoman Empire Prevails;;;;;;;;;;;;;x
EVTOPTA900010;Allahu Akbar!;;;;;;;;;;;;;x
EVTDESC900020;While the Qajar dynasty rule over Persia was unanimously seen mediocre, the ascension of Naser al-Din to the Sun Throne became its peak. An early reformer, good diplomat and a capable leader, he kept a firm grip on the absolute power of the monarchy while keeping foreign influence from tearing the country apart. An era of stability, peace and relative prosperity.;;;;;;;;;;;;;x
EVTNAME900020;A Silver Age;;;;;;;;;;;;;x
EVTOPTA900020;Long Live The King!;;;;;;;;;;;;;x
EVTDESC900021;On the cursed morning of $YEAR$, Naser al-Din was assassinated by Mirza Reza Kermani, a follower of Jamal al-Din al-Afghani, when he was visiting and praying in the shrine of Shah-Abdol-Azim. It is said that the revolver used to assassinate him was old and rusty, and had he worn a thicker overcoat, or been shot from a longer range, he would have survived the attempt on his life. Shortly before his death, he is reported to have said ‘I will rule you differently if I survive!’.;;;;;;;;;;;;;x
EVTNAME900021;Assassination of the Shah;;;;;;;;;;;;;x
EVTOPTA900021;Horror!;;;;;;;;;;;;;x
EVTDESC900022;A twenty-four years old merchant from Shiraz, called Siyyid ‘Alí Muhammad Shírází, on May 22, 1844, claimed to be an inspired interpreter of the Qur’an within the Shaykhi school of Twelver Shi’ism. Within five months, eighteen disciples of the Skaykhi school had independently recognized him as a Manifestation of God. These eighteen disciples were later known as the Letters of the Living. In his early writings, Siyyid appears to identify himself as the gate (báb) to the Hidden Twelfth Imam and later he begins to explicitly proclaim his station as that of the Hidden Imam and a new messenger from God. After some time, preaching by the Letters of the Living led to opposition by the Islamic clergy, prompting the Governor of Shiraz to order the Báb’s arrest. The Báb, upon hearing of the arrest order, left Bushehr for Shiraz in $YEAR$ and presented himself to the authorities. But his teachings, which became known as Bábism, were already being spread by his disciples.;;;;;;;;;;;;;x
EVTNAME900022;The Báb;;;;;;;;;;;;;x
EVTOPTA900022;Apostate!;;;;;;;;;;;;;x
EVTDESC900023;The Báb’s growing popularity led to the authorities exiling him. But even in exile his cult increased. He was brought to trial in Tabriz and in $YEAR$ he was sentenced to death for apostasy. The night before his execution, a young Bábí called Anís threw himself at the feet of the Báb and begged to be killed with him. Both were taken to the courtyard of the barracks the next day where thousands of people had gathered to watch the execution. They were suspended on a wall in front of a large squad of Christian soldiers, the order was given to fire and the courtyard was filled with musket smoke. When it cleared, the Báb was no longer in the courtyard and Anís was unharmed: the bullets apparently had not harmed either man, but had cut the ropes. There was a great commotion, many in the crowd believing the Báb had ascended to heaven or simply disappeared. The Báb was subsequently found in another part of the barracks, completely unharmed, giving his final instructions to his secretary.;;;;;;;;;;;;;x
EVTNAME900023;The Báb’s Execution;;;;;;;;;;;;;x
EVTOPTA900023;Fire again and dump their remains outside the gates of the town to be eaten by animals.;;;;;;;;;;;;;x
EVTOPTB900023;Maybe we were misguided in this. Let him go.;;;;;;;;;;;;;x
EVTDESC900500;Our war against Schleswig-Holstein has brought us into conflict with our German allies.;;;;;;;;;;;;;x
EVTNAME900500;The Schleswig-Holstein War;;;;;;;;;;;;;x
EVTOPTA900500;Too late to turn back now.;;;;;;;;;;;;;x
EVTDESC900640;An idea has arisen within the $COUNTRY_ADJ$ government: could we perhaps offer our support to the Ottomans in the upcoming Congress, in exchange for a lease on Cyprus? Our support could make a great deal of difference for them… and the island’s proximity to Suez makes it of strategic importance. The Ottomans could use all the support they can get, after all.;;;;;;;;;;;;;x
EVTNAME900640;The Cyprus Convention;;;;;;;;;;;;;x
EVTOPTA900640;Make the offer.;;;;;;;;;;;;;x
EVTOPTB900640;We have no interest in this.;;;;;;;;;;;;;x
EVTDESC900641;The $FROMCOUNTRY_ADJ$ government has approached us with a proposal: they will lend their support to us in the upcoming Congress, in exchange for Cyprus. The island’s proximity to Suez makes it of strategic importance, after all, and while some might consider the offer an insult there are others who suggest that without this offer it’s just as likely the island will be offered to Greece. $FROMCOUNTRY$ could ensure it isn’t… and we could use all the allies in the Congress we can get.;;;;;;;;;;;;;x
EVTOPTA900641;Agree to the deal.;;;;;;;;;;;;;x
EVTOPTB900641;No. Cyprus is not a bargaining chip.;;;;;;;;;;;;;x
EVTDESC900642;The Ottomans have agreed to the lease of Cyprus. Now we just need to make sure that we do all we can to make sure the Ottomans are kept strong…;;;;;;;;;;;;;x
EVTNAME900642;The Deal is Struck;;;;;;;;;;;;;x
EVTOPTA900642;We shall do our best.;;;;;;;;;;;;;x
EVTDESC900643;The Ottomans have refused our offer. Evidently, they will take their chances.;;;;;;;;;;;;;x
EVTNAME900643;The Ottomans Have Refused;;;;;;;;;;;;;x
EVTOPTA900643;We accept their decision.;;;;;;;;;;;;;x
EVTOPTB900643;Then they shall receive no support from us whatsoever.;;;;;;;;;;;;;x
EVTDESC900645;$COUNTRY$ has a reasonable issue to bring before the upcoming Congress: while it seems beyond question that the Bosnians will be given independence, we could make a case for $COUNTRY_ADJ$ stewardship over Bosnia at the Congress and it seems likely we would be heeded… though it would, without a doubt, upset the Russians.;;;;;;;;;;;;;x
EVTNAME900645;The Bosnian Issue;;;;;;;;;;;;;x
EVTOPTA900645;Make the claim at the Congress.;;;;;;;;;;;;;x
EVTOPTB900645;We have no interest in Bosnia.;;;;;;;;;;;;;x
EVTDESC900646;$COUNTRY$ has a reasonable issue to bring before the upcoming Congress: while it seems beyond question that the Croatians will be given independence, we could make a case for $COUNTRY_ADJ$ stewardship over Croatia at the Congress and it seems likely we would be heeded… though it would, without a doubt, upset the Russians.;;;;;;;;;;;;;x
EVTNAME900646;The Croatian Issue;;;;;;;;;;;;;x
EVTOPTA900646;Make the claim at the Congress.;;;;;;;;;;;;;x
EVTOPTB900646;We have no interest in Croatia.;;;;;;;;;;;;;x
EVTDESC900700;We are called upon to live up to our part of the bargain and give up Cyprus.;;;;;;;;;;;;;x
EVTNAME900700;Giving Up Cyprus;;;;;;;;;;;;;x
EVTOPTA900700;We will abide by our agreement.;;;;;;;;;;;;;x
EVTOPTB900700;Their help was worthless! Forget it!;;;;;;;;;;;;;x
EVTDESC900701;$FROMCOUNTRY$ has agreed to live up to its part of the bargain and hand over Cyprus.;;;;;;;;;;;;;x
EVTNAME900701;The Cyprus Lease;;;;;;;;;;;;;x
EVTOPTA900701;Excellent.;;;;;;;;;;;;;x
EVTDESC900702;$FROMCOUNTRY$ has reneged on its deal to give up Cyprus. They claim our aid at the Congress wasn’t worthwhile.;;;;;;;;;;;;;x
EVTNAME900702;$FROMCOUNTRY$ Reneges;;;;;;;;;;;;;x
EVTOPTA900702;Then we shall take it whether they like it or not!;;;;;;;;;;;;;x
EVTOPTB900702;It’s not worth fighting over.;;;;;;;;;;;;;x
EVTDESC900705;The Congress has agreed to our demands regarding Bosnia. They are to be placed under $COUNTRY_ADJ$ control.;;;;;;;;;;;;;x
EVTNAME900705;The Bosnian Stewardship;;;;;;;;;;;;;x
EVTOPTA900705;Excellent!;;;;;;;;;;;;;x
EVTOPTB900705;Never mind.;;;;;;;;;;;;;x
EVTDESC900706;The Congress has agreed to our demands regarding Croatia. They are to be placed under $COUNTRY_ADJ$ control.;;;;;;;;;;;;;x
EVTNAME900706;The Croatian Stewardship;;;;;;;;;;;;;x
EVTDESC900710;$FROMCOUNTRY$ received a great deal of benefit from the recent Congress of great powers, and it was decided that $COUNTRY$ deserves great influence in $FROMCOUNTRY$ as compensation-if we want it.;;;;;;;;;;;;;x
EVTNAME900710;$FROMCOUNTRY_ADJ$ Allies;;;;;;;;;;;;;x
EVTOPTA900710;Absolutely.;;;;;;;;;;;;;x
EVTOPTB900710;We have no interest in influencing $FROMCOUNTRY$.;;;;;;;;;;;;;x
EVTDESC900712;$FROMCOUNTRY$ received a great deal of benefit from the recent Congress of great powers, and it was decided that $COUNTRY$ deserves considerable some small influence in $FROMCOUNTRY$ as compensation-if we want it.;;;;;;;;;;;;;x
EVTNAME900712;Influence in $FROMCOUNTRY$;;;;;;;;;;;;;x
EVTDESC900715;$COUNTRY_ADJ$ delegates were sent to the recent Congress-reasonable considering it was the fate of our country and the entire Balkans that was being decided, or so we thought. As it turns out, the great powers of Europe decided what was to become of $COUNTRY$ without our participation, and while we received some benefit it has come to us at a price.;;;;;;;;;;;;;x
EVTNAME900715;Legacy of the Congress;;;;;;;;;;;;;x
EVTOPTA900715;So be it.;;;;;;;;;;;;;x
EVTDESC911000;American diplomats have arrived in Berlin today with the following proposal: they will pay the German State 8 million pounds in return for control over Cuban affairs. How should we respond?;;;;;;;;;;;;;x
EVTNAME911000;The Americans wish to buy the Kronprinzinsel;;;;;;;;;;;;;x
EVTOPTA911000;Deal!;;;;;;;;;;;;;x
EVTOPTB911000;No Deal!;;;;;;;;;;;;;x
EVTDESC911100;Our reports show that the Americans have attack our colony of Cuba today, without formal declaration of war!;;;;;;;;;;;;;x
EVTNAME911100;An American surprise attack on Cuba!;;;;;;;;;;;;;x
EVTOPTA911100;How dare they!;;;;;;;;;;;;;x
EVTDESC916900;Diplomats have arrived in Berlin today, from the USA, demanding that we hand over complete control over Cuba!;;;;;;;;;;;;;x
EVTNAME916900;The Americans demand the Kronprinzinsel!;;;;;;;;;;;;;x
EVTOPTA916900;We agree, though we want monetary compensation!;;;;;;;;;;;;;x
EVTOPTB916900;We have to submit to the terms.;;;;;;;;;;;;;x
EVTOPTC916900;Come and get it!;;;;;;;;;;;;;x
EVTDESC920001;The Germans have agreed to hand over the colony for the price tag of 9 million pounds. How should we respond?;;;;;;;;;;;;;x
EVTNAME920001;The Germans demand compensation.;;;;;;;;;;;;;x
EVTOPTA920001;Deal!;;;;;;;;;;;;;x
EVTOPTB920001;Enough! To War!;;;;;;;;;;;;;x
EVTDESC922000;The Germans have agreed to our terms! The colony of Cuba will now be handed over!;;;;;;;;;;;;;x
EVTNAME922000;The Germans agree!;;;;;;;;;;;;;x
EVTOPTA922000;Good to hear!;;;;;;;;;;;;;x
EVTDESC922200;The Germans refused our offer!;;;;;;;;;;;;;x
EVTNAME922200;German Resistance!;;;;;;;;;;;;;x
EVTOPTA922200;It’s no use, back down…;;;;;;;;;;;;;x
EVTOPTB922200;So be it!;;;;;;;;;;;;;x
EVTDESC930000;The Americans have agreed to our terms! The colony of Cuba will now be handed over!;;;;;;;;;;;;;x
EVTNAME930000;The Americans agree!;;;;;;;;;;;;;x
EVTOPTA930000;Good to hear!;;;;;;;;;;;;;x
EVTDESC933000;The Americans have dismissed our terms and have declared war to regain Cuba by force!;;;;;;;;;;;;;x
EVTNAME933000;The Americans refuse!;;;;;;;;;;;;;x
EVTOPTA933000;Oh, mein Gott!;;;;;;;;;;;;;x
EVTDESC933300;Seeing no use in risking war with our mighty Empire, the Americans have decided to abandon all claims on Cuba.;;;;;;;;;;;;;x
EVTNAME933300;The Americans backed down!;;;;;;;;;;;;;x
EVTOPTA933300;I knew they would.;;;;;;;;;;;;;x
EVTDESC952500;The Dutch demand that we submit ourselves to their direct control, as a colonial province, so they may bring civilization to our people.;;;;;;;;;;;;;x
EVTNAME952500;The Dutch Demand;;;;;;;;;;;;;x
EVTOPTA952500;We have no choice but to surrender.;;;;;;;;;;;;;x
EVTOPTB952500;We will fight to the last man.;;;;;;;;;;;;;x
EVTDESC952501;The Sultanates of Yogyakarta and Surakarta refused our demand and expelled our diplomats of their courts.;;;;;;;;;;;;;x
EVTNAME952501;The Sultanates Refuse;;;;;;;;;;;;;x
EVTOPTA952501;This requires immediate action.;;;;;;;;;;;;;x
EVTOPTB952501;It’s better to forgive and forget.;;;;;;;;;;;;;x
EVTDESC952502;In the past, minor conflicts with the Dutch (the Indonesian colonial possessions of which are now nationalized as the Dutch East Indies) who were well established in Palembang, meant the Dutch increasingly felt the need to control the actions of Jambi. They coerced Sultan Facharudin to agree to greater Dutch presence in the region and control over trade, although the sultanate remained nominally independent. In $YEAR$ the Dutch, apparently concerned over the risk of competition for control from other foreign powers, started to draw plans to invade Jambi from their other Indonesian colonies.;;;;;;;;;;;;;x
EVTNAME952502;The Jambi Sultanate;;;;;;;;;;;;;x
EVTOPTA952502;The Jambi must be brought into the fold.;;;;;;;;;;;;;x
EVTDESC952503;The Dutch approached us about our protectorate in the Sultanate of Aceh. We long had disputes and issues as who is the rightful protector of the territories occupied by the Sultanate of Aceh and the Sultanate of Siak, as well as other emerging conflicts in Asia. They are willing to trade a colony with us and settle our disputes if we relinquish our protectorate over Aceh and turn a blind eye when they try to conquer it. \n \n §RNOTE: Make sure the Dutch own provinces in the Gold Coast if you select the second option.§W;;;;;;;;;;;;;x
EVTNAME952503;The Dutch Proposal;;;;;;;;;;;;;x
EVTOPTA952503;Let them have it, we don’t need anything in exchange.;;;;;;;;;;;;;x
EVTOPTB952503;Their possessions in the Gold Coast would make a nice deal.;;;;;;;;;;;;;x
EVTOPTC952503;Any colony will do.;;;;;;;;;;;;;x
EVTOPTD952503;Aceh is not for sale.;;;;;;;;;;;;;x
EVTDESC952504;$FROMCOUNTRY_ADJ$ diplomats inform us our request was granted, and that we may attack the Sultanate of Aceh. They didn’t even ask for anything in return.;;;;;;;;;;;;;x
EVTNAME952504;The $FROMCOUNTRY_ADJ$ Have Agreed;;;;;;;;;;;;;x
EVTOPTA952504;Wonderful News! Make the necessary arrangements.;;;;;;;;;;;;;x
EVTOPTB952504;We are not interested in this anymore.;;;;;;;;;;;;;x
EVTDESC952505;$FROMCOUNTRY_ADJ$ diplomats returned with their government demands: they want out possessions in the Gold Coast of Africa, a colony they long claim and covet, in exchange for letting us conquer Aceh without interference. They won’t help us conquering the Sultanate, but at least they will not get in our way and will work so other Great Powers don’t get in your way.;;;;;;;;;;;;;x
EVTNAME952505;The Gold Coast Proposal;;;;;;;;;;;;;x
EVTOPTB952505;These demands are an outrage! We will never agree to this.;;;;;;;;;;;;;x
EVTDESC952506;$FROMCOUNTRY_ADJ$ diplomats returned with their government demands: they want some of our coastal colonies in exchange for letting us conquer Aceh without interference. They won’t help us conquering the Sultanate, but at least they will not get in our way and will work so other Great Powers don’t get in your way.;;;;;;;;;;;;;x
EVTNAME952506;The $FROMCOUNTRY_ADJ$ Proposal;;;;;;;;;;;;;x
EVTDESC952507;$FROMCOUNTRY_ADJ$ diplomats informed us that their government reject our most reasonable offers, and that their protectorate over the Sultanate of Aceh will continue.;;;;;;;;;;;;;x
EVTNAME952507;The $FROMCOUNTRY_ADJ$ Refuse;;;;;;;;;;;;;x
EVTOPTA952507;They will regret this.;;;;;;;;;;;;;x
EVTDESC952508;The Dutch agreed to our demands and are transferring ownership of their colonies in the Gold Coast to us.;;;;;;;;;;;;;x
EVTNAME952508;The Gold Coast Treaty of $YEAR$;;;;;;;;;;;;;x
EVTDESC952509;The Dutch agreed to transfer ownership of some coastal colonies to us. The diplomats made the necessary arrangements and the colonies are already in our power.;;;;;;;;;;;;;x
EVTNAME952509;The $COUNTRY_ADJ$—$FROMCOUNTRY_ADJ$ Treaty of $YEAR$;;;;;;;;;;;;;x
EVTDESC952510;Our negotiations over our colonial disputes regarding the Aceh Sultanate and our colonies in Africa and the Dutch and our colonies in Asia came to a halt as the Dutch government refused all of our offers. Our relation will suffer because of this.;;;;;;;;;;;;;x
EVTNAME952510;Negotiations Break Up;;;;;;;;;;;;;x
EVTOPTA952510;A pity.;;;;;;;;;;;;;x
EVTDESC952511;In the aftermath of our conquest of Aceh, some of the most extremist elements of the Sunni community in Aceh declared a jihad against our government. $COUNTRY_ADJ$ citizens and personnel are targeted by sporadic suicidal attacks by Acehnese patriots influenced by the Hikayat Perang Sabil and other proscribed texts. Acehnese resentment was further stoked by a system of forced corvée labour where subjects were required to work on government roadwork projects for 24 days a year. By $YEAR$, Aceh had reverted to a state of full-scale guerrilla warfare and the necessity of regular troops stationed in former Acehnese territory is vital.;;;;;;;;;;;;;x
EVTNAME952511;The Aceh Jihad;;;;;;;;;;;;;x
EVTOPTA952511;We will quell this rebellion.;;;;;;;;;;;;;x
EVTDESC952512;As $PROVINCENAME$ returns to Islamic hands, the flames of the Jihad start to die down.;;;;;;;;;;;;;x
EVTNAME952512;The Jihad Ends in $PROVINCENAME$;;;;;;;;;;;;;x
EVTOPTA952512;Allah be praised!;;;;;;;;;;;;;x
EVTDESC952513;With the end of the German Confederation as a customs union and the rise of a modern, unified German state, the Duchy of Limburg became an outdated promise. As it is internationally recognized as an integral part of our country, we will end its autonomy. The Germans, however, might try to protest this move.;;;;;;;;;;;;;x
EVTNAME952513;The End of the German Confederation;;;;;;;;;;;;;x
EVTOPTA952513;No Great Power would agree to a German claim.;;;;;;;;;;;;;x
EVTDESC952514;With the union of the German Confederation in a more unified state, an old member of the Confederation, the Duchy of Limburg, which was created to fill the spot of Luxembourg per the London Treaty, had its autonomy revoked and it’s being annexed by the Netherlands. Our claim in the region is tenuous, but it exists and we could push for it. If we decide to do it, we have six months to stall the Netherlands before they annex Limburg, and other great powers might try to intervene, but if we succeed, liberate Limburg and bring them in our sphere, we will be able to annex it.;;;;;;;;;;;;;x
EVTNAME952514;The Duchy of Limburg;;;;;;;;;;;;;x
EVTOPTA952514;Let it go. We recognized the territory as part of the Netherlands.;;;;;;;;;;;;;x
EVTOPTB952514;A state that once was part of the Confederation is a part of our country.;;;;;;;;;;;;;x
EVTOPTC952514;We´ll keep the Venlo fort, the Dutch can have the rest.;;;;;;;;;;;;;x
EVTDESC952515;The $FROMCOUNTRY_ADJ$ are claiming Limburg on the basis of their customs union. They don’t have much time to press their claims, as they are not strong claims. Other great powers might declare their support for us if they try anything. Our advisors expect that any movement to annex Limburg right now is being blocked by $FROMCOUNTRY$, but if we manage to keep Limburg under our vassalage for six months, we will be able to annex Limburg and solve this crisis our way.;;;;;;;;;;;;;x
EVTNAME952515;The $FROMCOUNTRY_ADJ$ Claims;;;;;;;;;;;;;x
EVTOPTA952515;Damn $FROMCOUNTRY_ADJ$.;;;;;;;;;;;;;x
EVTDESC952516;The Limburg question was resolved in our favour and as a result the duchy is now an integral part of our country.;;;;;;;;;;;;;x
EVTNAME952516;The Limburg Question;;;;;;;;;;;;;x
EVTOPTA952516;Glory to $COUNTRY$!;;;;;;;;;;;;;x
EVTDESC952517;The Germans of $FROMCOUNTRY$ are claiming the Duchy of Limburg as part of their territory. This is started because of the Dutch move to annex the territory as the fall of the German customs union created a fear of a German claim in the area. The Dutch will surely fall if they have to fend the Germans by themselves but they only need six months to finish annexing the territory. As Great Power, we need to declare our position on the matter.;;;;;;;;;;;;;x
EVTNAME952517;The Limburg Crisis;;;;;;;;;;;;;x
EVTOPTA952517;German violation of Dutch territory will not be tolerated.;;;;;;;;;;;;;x
EVTOPTB952517;We don’t want to get involved.;;;;;;;;;;;;;x
EVTDESC955177;Egypt has been unstable for some time, and strategists in our countries think this is the time to act. Pursuing a policy of divide and rule, they are keen to reverse the process, started under Muhammad Ali, of uniting the Nile Valley under Egyptian leadership, and sought to frustrate all efforts aimed at further uniting the two countries. This, they argue, would be severely beneficial for our country and eliminate what could be a threat for our interests in the area, making them weaker and more dependent on us. In exchange for their cooperation, we would help our allies with advisors and technology.;;;;;;;;;;;;;x
EVTNAME955177;Hegemony Over the Nile;;;;;;;;;;;;;x
EVTOPTA955177;Sudan needs to be under our direct control.;;;;;;;;;;;;;x
EVTOPTB955177;There’s no need to act.;;;;;;;;;;;;;x
EVTDESC955178;The foreigners of $FROMCOUNTRY$ think our nation is not stable enough, and they offer to stabilize Sudan. In exchange, they would give us advisers and would help us modernize our country. Refusing might lead to them supporting Sudanese rebels in an attempt to divide and conquer.;;;;;;;;;;;;;x
EVTNAME955178;$FROMCOUNTRY$ Demand;;;;;;;;;;;;;x
EVTOPTA955178;We accept.;;;;;;;;;;;;;x
EVTOPTB955178;We don’t need their help.;;;;;;;;;;;;;x
EVTDESC955179;$FROMCOUNTRY$ accepted our proposal and we are now establishing the governmental structures to exert direct control over Sudan.;;;;;;;;;;;;;x
EVTNAME955179;$FROMCOUNTRY$ Accepts;;;;;;;;;;;;;x
EVTOPTA955179;All hail $COUNTRY$!;;;;;;;;;;;;;x
EVTDESC955180;$FROMCOUNTRY$ refuses our demands, leaving no other option but direct military intervention.;;;;;;;;;;;;;x
EVTNAME955180;$FROMCOUNTRY$ Refuses;;;;;;;;;;;;;x
EVTOPTA955180;They will regret this.;;;;;;;;;;;;;x
EVTDESC955181;A dispute arose with $FROMCOUNTRY$ over our colonial borders in Senegal and Guinea. $FROMCOUNTRY_ADJ$ citizens poured through the border and now live in Ziguinchor province. According to the principles of Effective Occupation established in Conference of Berlin, the territory belongs to us. But it has been under rule of another nation for a long time and thus the dispute arose. The $FROMCOUNTRY_ADJ$ government approached us and proposed an exchange—Gabu for Ziguinchor and all the claims would be settled.;;;;;;;;;;;;;x
EVTNAME955181;The Senegal-Guinea Border Treaty;;;;;;;;;;;;;x
EVTOPTA955181;The deal seems fair.;;;;;;;;;;;;;x
EVTOPTB955181;We would never agree to such proposal.;;;;;;;;;;;;;x
EVTDESC955182;$FROMCOUNTRY$ called a conference, in the scope of the Congo Conference, on the future of the resource rich region known as the Congo. The $FROMCOUNTRY_ADJ$ ruler has set up a philanthropic organization—the International African Society and also the International Congo Society—and they are proposing to run the Congo region through it in an effort to bring civilization to the natives, to properly chart, research and explore the region and to improve the lives of the natives. The great powers of Europe have been called to vote and decide on the future of the Congo: if they will concede to $FROMCOUNTRY$’s wishes, if they deny their request or if they wish to abstain from the decision. If we agree, we will be obliged to surrender any territories we currently possess in the region. Any country that owns territory in the Congo will also be asked to respect the decision of the Conference—by force if not peacefully.;;;;;;;;;;;;;x
