CODE;ENGLISH;FRENCH;GERMAN;POLISH;SPANISH;ITALIAN;SWEDISH;CZECH;HUNGARIAN;DUTCH;PORTUGUESE;RUSSIAN;FINNISH;x
EVTDESC1000000;Our mission has proven to be super effective giving us a technological benefit.;;;;;;;;;;;;;x
EVTNAME1000000;Our Iwakura Mission Pays Off;;;;;;;;;;;;;x
EVTDESC1000100;The perspective of our war against Mexico doesn’t look too bright. They outnumber us and our independence is only a matter of time. Maybe we could ask our neighbour for help against the Mexicans?;;;;;;;;;;;;;x
EVTNAME1000100;Should We Ask USA For Help?;;;;;;;;;;;;;x
EVTDESC1000101;A diplomat from Texas has reached us with worrying news. Their rights are being violently taken from them and they have turned to us looking for help. Should we lend our helping hand to our fellow Americans?;;;;;;;;;;;;;x
EVTNAME1000101;Texas Calls for Help;;;;;;;;;;;;;x
EVTDESC1000200;Now that we are powerful enough to hold our own, an important matter rose up regarding our role in the Eastern Christendom. It is a well-known fact that the Byzantine Empire for a long time was the centre of the Orthodox Church and the Eastern Christendom as a whole. Sadly, we’ve lost our authority and power due to numerous wars and raids and our title as the protector was taken by another powerful Orthodox nation known as the Russian Empire. We are glad that they’ve been doing our work for centuries now, but it’s time that we take this title back since it’s supposed to be us that should protect the Eastern Christians.;;;;;;;;;;;;;x
EVTNAME1000200;The New Protector of Eastern Christians;;;;;;;;;;;;;x
EVTDESC1000201;We’ve been notified that the newly restored Byzantine Empire seeks to reclaim its title as the Orthodox Protector. We’ve taken their duty to continue protecting the Eastern Christendom as a powerful nation within it. Should we stand down and give the title back to its original owner, or should we hold onto it?;;;;;;;;;;;;;x
EVTNAME1000201;The Orthodox Question;;;;;;;;;;;;;x
EVTDESC1000202;The fools of The Russian Empire refuted our rightful claim on the title of the Orthodox Protector. The title is ours by definition and they will pay for denying us our claim.;;;;;;;;;;;;;x
EVTNAME1000202;The Russian Empire refused!;;;;;;;;;;;;;x
EVTDESC1000203;As we expected, the Russians complied and offered back the title of Eastern Protectors. This is a joyous day for the mighty Empire!;;;;;;;;;;;;;x
EVTNAME1000203;The Russian Empire accepted!;;;;;;;;;;;;;x
EVTDESC1000204;We have proven in battle that we are truly worth the title we were fighting for. The Russian Empire will have to agree to our demands and our position in the Eastern Christendom will be restored.;;;;;;;;;;;;;x
EVTNAME1000204;The War is Won!;;;;;;;;;;;;;x
EVTDESC1000205;We have lost the war and forever lost the right to call ourselves the Protectors of Eastern Christendom. The new title owners have proven themselves to be more suitable for this role and we’ll have to set our sights elsewhere.;;;;;;;;;;;;;x
EVTNAME1000205;The War is Lost!;;;;;;;;;;;;;x
EVTDESC1000300;With our kingdom united once again suggestions started appearing about changing our capital to better suit the united country. Should we change it to a more suitable place or keep things as they are?;;;;;;;;;;;;;x
EVTNAME1000300;Proposition for a new capital;;;;;;;;;;;;;x
EVTDESC1010011;For years, British committees have looked into the situation in Ireland and predicted disaster: the Irish farmers had become more and more dependent on their potato crop, and if anything were to happen to that crop it would cause not only widespread chaos throughout the Irish economy but famine and worse. Their predictions have come true. A blight has been spreading, leading to failure after failure of the Irish potato harvest. Proponents of laissez-faire economics are adamant that the market will provide food for those affected, and that the government should not interfere in private enterprise. Others claim that no expense is too high to help the Irish, and that failure to act quickly will lead to starvation and resentment… but conservatives are quick to dismiss this as inflammatory nonsense.;;;;;;;;;;;;;x
EVTNAME1010011;The Great Irish Famine;;;;;;;;;;;;;x
EVTOPTA1010011;Do whatever it takes to help them.;;;;;;;;;;;;;x
EVTOPTB1010011;Give them what aid we can.;;;;;;;;;;;;;x
EVTOPTC1010011;We must not interfere in the markets.;;;;;;;;;;;;;x
EVTDESC1010012;The blight affecting the Irish potato crop has spread to $STATENAME$. With the local harvest quickly failing, the effects are already being felt-poor Irish peasants are walking the streets of $PROVINCENAME$, begging for government aid which never arrives, and many are obviously considering making their way to the New World out of desperation.;;;;;;;;;;;;;x
EVTNAME1010012;Irish Famine Spreads;;;;;;;;;;;;;x
EVTOPTA1010012;Our choice has been made.;;;;;;;;;;;;;x
EVTDESC1010013;The blight affecting the Irish potato crop has spread to $STATENAME$. With the local harvest quickly failing, the effects are already being felt-poor Irish peasants are walking the streets of $PROVINCENAME$, barely subsisting on the limited cornmeal handouts offered by the government, and many are obviously considering making their way to the New World out of desperation.;;;;;;;;;;;;;x
EVTDESC1010014;The blight affecting the Irish potato crop has spread to $STATENAME$. With the local harvest quickly failing, the effects are already being felt-in $PROVINCENAME$, the Irish are gathering in large crowds to receive aid sent by the British government. While they are grateful, times are still incredibly difficult and it’s clear many are considering leaving Ireland to take their chances in the New World.;;;;;;;;;;;;;x
EVTDESC1010015;An aborted attempt at an uprising recently took place in the village of Ballingarry, Ireland. A group of Irish nationalists, frustrated by what they call the inept handling of the recent famine by the British government, engaged in a long gunfight with a unit of constabulary until reinforcements arrived and drove the men off. Many of these nationalists have since been captured and tried, but the event has sparked an increase in nationalism across the island.;;;;;;;;;;;;;x
EVTNAME1010015;The Young Irelander Rebellion;;;;;;;;;;;;;x
EVTOPTA1010015;Outrageous!;;;;;;;;;;;;;x
EVTDESC1010016;Not content to wait until the dust of the war has settled, nationalists in Ireland have taken to the streets of $PROVINCENAME$ to call for the end of $COUNTRY_ADJ$ rule. With our forces engaged elsewhere, their calls have quickly swept across all of $STATENAME$.;;;;;;;;;;;;;x
EVTNAME1010016;Ireland’s Opportunity;;;;;;;;;;;;;x
EVTOPTA1010016;When the war is done, there shall be consequences.;;;;;;;;;;;;;x
EVTDESC1010020;The tone among the people in our Irish territories has changed. Many Irish nationalist who emigrated to the United States founded a militant organization called the Fenian Brotherhood there, a group dedicated to freeing Ireland from $COUNTRY_ADJ$ control… and now they have formed a sister organization back home, the Irish Republican Brotherhood. Already they are stirring up trouble, and it seems certain they will continue until some manner of home rule is attained.;;;;;;;;;;;;;x
EVTNAME1010020;The Irish Republican Brotherhood;;;;;;;;;;;;;x
EVTOPTA1010020;Perhaps the time has come to examine the Irish situation.;;;;;;;;;;;;;x
EVTDESC1010021;We’ve received reports that the Irish Republican Brotherhood has been active in $PROVINCENAME$, spreading propaganda and generally stirring up agitation against the $COUNTRY_ADJ$ government. The constabulary in $STATENAME$ has been actively hunting these nationalists down, but considering many within the constabulary are Irish themselves the process has not been simple.;;;;;;;;;;;;;x
EVTNAME1010021;Fenians in $PROVINCENAME$;;;;;;;;;;;;;x
EVTOPTA1010021;This is a serious issue.;;;;;;;;;;;;;x
EVTDESC1010022;The Irish Republican Brotherhood has stirred up local resentment in $PROVINCENAME$, resulting in several riots and a renewed campaign against $COUNTRY_ADJ$ rule in Ireland.;;;;;;;;;;;;;x
EVTNAME1010022;Fenian Revolt in $PROVINCENAME$;;;;;;;;;;;;;x
EVTOPTA1010022;This simply makes things far more difficult.;;;;;;;;;;;;;x
EVTDESC1010023;In an event organized by the Irish Republican Brotherhood, a group of Irish nationalists seized key locations in the city of $PROVINCENAME$ on Easter Monday, kicking off the most significant uprising in Ireland since the rebellion of 1798.;;;;;;;;;;;;;x
EVTNAME1010023;The Easter Rising;;;;;;;;;;;;;x
EVTOPTA1010023;This calls for decisive action.;;;;;;;;;;;;;x
EVTOPTB1010023;Due process must be followed, no matter the cost.;;;;;;;;;;;;;x
EVTDESC1010024;Spurred on by increased public sympathy towards the Irish Republican Brotherhood following the Easter Rising, the Sinn Féin have won a majority of seats in Ireland during the last election. They have gathered in Dublin and declared themselves Dáil Éireann, the parliament of Ireland, and demanded that Ireland be granted immediate full independence. Considering their popularity, refusing would all but certainly trigger a war… but many agree that this is not the way to a peaceful resolution, and that $COUNTRY$ should never submit to such demands.;;;;;;;;;;;;;x
EVTNAME1010024;The Sinn Féin Demand;;;;;;;;;;;;;x
EVTOPTA1010024;We will not be negotiated with at gunpoint.;;;;;;;;;;;;;x
EVTOPTB1010024;Grant them independence.;;;;;;;;;;;;;x
EVTDESC1010025;With Ireland once again under our control, talks have begun in earnest to deal with the Irish situation once and for all… now on our terms, rather than on theirs. The suggestion is that Ireland remain an autonomous Dominion under our control, with any regions that wish to opt out of the new state and remain part of $COUNTRY$ able to do so. Others suggest this is unworkable, and we should either simply release them and keep them as allies or annex them entirely.;;;;;;;;;;;;;x
EVTNAME1010025;The Anglo-Irish Treaty;;;;;;;;;;;;;x
EVTOPTA1010025;They shall become an autonomous Dominion.;;;;;;;;;;;;;x
EVTOPTB1010025;They shall become a free ally.;;;;;;;;;;;;;x
EVTOPTC1010025;They are part of $COUNTRY$. Annex them.;;;;;;;;;;;;;x
EVTDESC1010030;An Anglo-Irish politician by the name of Charles Stewart Parnell has just been elected to Parliament. Some are describing him as a firebrand and nationalist agitator, while others suggest he’s a man of remarkable charisma and organizational talent-able to take on the entirety of the $COUNTRY_ADJ$ political system in order to push his Irish Home Rule agenda and succeed. It’s very possible that this man could single-handedly turn the tide of opinion on the subject of Home Rule.;;;;;;;;;;;;;x
EVTNAME1010030;Charles Stewart Parnell;;;;;;;;;;;;;x
EVTOPTA1010030;Keep him contained. We don’t want trouble.;;;;;;;;;;;;;x
EVTOPTB1010030;Encourage him. He’ll do good work.;;;;;;;;;;;;;x
EVTDESC1010031;With Charles Stewart Parnell putting forward his Home Rule agenda, $COUNTRY_ADJ$ citizens in $PROVINCENAME$ have become increasingly concerned that they might end up in an independent Irish state-one dominated by Irish Catholics in Dublin. They have begun actively campaigning to ensure this doesn’t happen.;;;;;;;;;;;;;x
EVTNAME1010031;The $STATENAME$ Volunteers;;;;;;;;;;;;;x
EVTOPTA1010031;Yet more trouble in Ireland?;;;;;;;;;;;;;x
EVTDESC1010032;Charles Stewart Parnell has been successfully advancing his Home Rule Bill through Parliament, and while it is continually being held up by opposition from the Upper House, there is a sense that the man is managing to convince $COUNTRY_ADJ$ law-makers who-in the not-too-distant past-might have said that Home Rule was unthinkable. \n \n Now we must consider whether his vision will see the light of day: do we grant Ireland the status of an autonomous Dominion under our control, or put this aside and face renewed violence among the Irish? Either way, this man Parnell will not desist, and the question will keep coming before us even if we do not pass the Bill now.;;;;;;;;;;;;;x
EVTNAME1010032;Irish Home Rule;;;;;;;;;;;;;x
EVTOPTA1010032;Pass the bill and give them Home Rule.;;;;;;;;;;;;;x
EVTOPTB1010032;There shall be no independence for Ireland.;;;;;;;;;;;;;x
EVTOPTC1010032;Onward to Ireland! (Play as Ireland);;;;;;;;;;;;;x
EVTDESC1010033;The revelation that Charles Stewart Parnell has been involved with a married woman, one Catherine O’Shea, and indeed is responsible for her subsequent divorce, was the scandal that ended his political career and prevented him from pushing the Home Rule agenda. Without him, it appears unlikely that the Irish Republican movement will gain the political clout it requires to attempt another passing of the Home Rule Bill.;;;;;;;;;;;;;x
EVTNAME1010033;Kitty O’Shea;;;;;;;;;;;;;x
EVTOPTA1010033;Unfortunate. For the Irish, I mean.;;;;;;;;;;;;;x
EVTDESC1010034;Enclosure is the legal process of enclosing a number of small landholdings to create one larger farm. Once enclosed, use of the land became restricted to the owner, and it ceased to be common land for communal use. This results in less land for the people to cultivate. This, coupled with overpopulation in Ireland, contributed much to poverty in the island.;;;;;;;;;;;;;x
EVTNAME1010034;Enclosures;;;;;;;;;;;;;x
EVTOPTA1010034;Ok.;;;;;;;;;;;;;x
EVTDESC1033676;It is obvious to everyone that the United States is a shadow of its former greatness. The states that remain believe the old ideals of Founding Fathers should be abandoned in favour of something new and more appropriate to our current state of affairs. Some say the Great Lakes and Chicago are the new heart of our nation.;;;;;;;;;;;;;x
EVTDESC1100540;The Blackshirts were established as the squadristi in 1919 and consisted of many disgruntled former soldiers. It was given the task of leading fights against their bitter enemies, the Socialists. They may have numbered 200,000 by the time of Mussolini’s March on Rome from 27 to 29 October 1922. In 1922 the squadristi were reorganized into the milizia and formed numerous bandiere, and on 1 February 1923 the Blackshirts became the Voluntary Militia for National Security, which lasted until the 8 September 1943 Armistice of Cassibile.;;;;;;;;;;;;;x
EVTNAME1100540;The appearance of Blackshirts;;;;;;;;;;;;;x
EVTDESC1100541;The fascist Blackshirt groups, which he had organized, were terrorist across the country. On October 3 and 4, 1922, they invade the cities of Genoa, Livorno and Ancona and establish local fascist administrations. There is a turmoil in the country, which provokes a civil war, while the successive governments of Giovanni Giolitti, Ivanoe Bonomi and Luigi Facta are unable to halt the slippage towards anarchy and diversion.;;;;;;;;;;;;;x
EVTNAME1100541;Rise of Blackshirts;;;;;;;;;;;;;x
EVTDESC1100542;In the night between 27 and 28 October 1922, about 30,000 Fascist Blackshirts gathered in Rome to demand the resignation of liberal Prime Minister Luigi Facta and the appointment of a new Fascist government. On the morning of 28 October, King Victor Emmanuel III, who according to the Albertine Statute held the supreme military power, refused the government request to declare martial law, which led to Facta’s resignation. The King then handed over power to Mussolini by asking him to form a new government.;;;;;;;;;;;;;x
EVTNAME1100542;Mussolini at the Gates;;;;;;;;;;;;;x
EVTDESC1225875;The United States has demanded that we join the newly formed Andes Republic. The obvious choice is to refuse as Chile is a sovereign state. But then again, we might not want to anger the American eagle.;;;;;;;;;;;;;x
EVTDESC1234121;The question has arisen regarding what to do with our colony in Alaska, now that Canada has achieved independence.;;;;;;;;;;;;;x
EVTNAME1234121;Status of Alaska;;;;;;;;;;;;;x
EVTOPTA1234121;Allow Alaska to join Canada;;;;;;;;;;;;;x
EVTOPTB1234121;It shall remain a $COUNTRY_ADJ$ colony;;;;;;;;;;;;;x
EVTDESC1234122;The question has arisen regarding what to do with our colony in Washington, now that Canada has achieved independence.;;;;;;;;;;;;;x
EVTNAME1234122;Status of Washington;;;;;;;;;;;;;x
EVTOPTA1234122;Allow Washington to join Canada;;;;;;;;;;;;;x
EVTDESC1234123;The question has arisen regarding what to do with our colony in Oregon, now that Canada has achieved independence.;;;;;;;;;;;;;x
EVTNAME1234123;Status of Oregon;;;;;;;;;;;;;x
EVTOPTA1234123;Allow Oregon to join Canada;;;;;;;;;;;;;x
EVTDESC1234124;The question has arisen regarding what to do with our colony in Idaho, now that Canada has achieved independence.;;;;;;;;;;;;;x
EVTNAME1234124;Status of Idaho;;;;;;;;;;;;;x
EVTOPTA1234124;Allow Idaho to join Canada;;;;;;;;;;;;;x
EVTDESC1234125;The question has arisen regarding what to do with our colony in New England, now that Canada has achieved independence.;;;;;;;;;;;;;x
EVTNAME1234125;Status of New England;;;;;;;;;;;;;x
EVTOPTA1234125;Allow New England to join Canada;;;;;;;;;;;;;x
EVTDESC1234126;The question has arisen regarding what to do with our colony in Montana, now that Canada has achieved independence.;;;;;;;;;;;;;x
EVTNAME1234126;Status of Montana;;;;;;;;;;;;;x
EVTOPTA1234126;Allow Montana to join Canada;;;;;;;;;;;;;x
EVTDESC1234127;A rapid rise in population brings the clearing of all land possible for future Nepali habitation.;;;;;;;;;;;;;x
EVTNAME1234127;Growth of Kathmandu;;;;;;;;;;;;;x
EVTOPTA1234127;Ok;;;;;;;;;;;;;x
EVTNAME1234128;Growth of Jumla;;;;;;;;;;;;;x
EVTDESC1314529;The British have agreed to sell us the Maritimes. Alongside the exchange of considerable amount of money, the British are transferring to us administration of the region on the condition that we respect the rights of Canadians currently residing in the territory. Truly this has been a good day for business in Boston.;;;;;;;;;;;;;x
EVTDESC1316080;The foreign dogs are selling opium in the southern provinces!;;;;;;;;;;;;;x
EVTNAME1316080;Foreigners Peddling Opium!;;;;;;;;;;;;;x
EVTDESC1316081;A drunken riot by a large group of British sailors ashore at Kowloon has resulted in the death of a local man. By rights, the sailors should be tried and executed by the Qing magistrate. The British, however, have demanded extraterritoriality-meaning their citizens would be tried by British judges. This will inevitably lead to their release and the anger of our citizens, but demanding these men executions could lead to war.;;;;;;;;;;;;;x
EVTNAME1316081;The Kowloon Incident;;;;;;;;;;;;;x
EVTOPTA1316081;Demand they be handed over!;;;;;;;;;;;;;x
EVTOPTB1316081;We cannot fight the British.;;;;;;;;;;;;;x
EVTDESC1316082;The war with $FROMCOUNTRY$ is not going well. These damnable foreigners are in our lands and blockading our ports, and to the embarrassment of our government there seems to be little we can do to stop them. $FROMCOUNTRY_ADJ$ diplomats have approached us to negotiate a ‘fair’ settlement. While we could drag the war on and see if the $FROMCOUNTRY_ADJ$ have the wherewithal to finish their assault, it might be in our best interest to give them a concession port and reparations. Indeed, this might even help us in some ways, though the loss to our prestige would be considerable.;;;;;;;;;;;;;x
EVTNAME1316082;The Unequal Treaty;;;;;;;;;;;;;x
EVTOPTA1316082;Give them what they want.;;;;;;;;;;;;;x
EVTOPTB1316082;Never! We shall not submit!;;;;;;;;;;;;;x
EVTDESC1316083;The $FROMCOUNTRY_ADJ$ rulership has signed our peace treaty, granting us a concession port on their coast as well as reparations. This has improved relations between our countries tremendously, and should go a long way to ensuring $COUNTRY_ADJ$ influence in China remains strong.;;;;;;;;;;;;;x
EVTNAME1316083;$FROMCOUNTRY$ Agrees;;;;;;;;;;;;;x
EVTDESC1316084;The $FROMCOUNTRY_ADJ$ have refused to submit. The war must go on.;;;;;;;;;;;;;x
EVTNAME1316084;$FROMCOUNTRY$ has Refused!;;;;;;;;;;;;;x
EVTOPTA1316084;An unfortunate choice.;;;;;;;;;;;;;x
EVTDESC1316085;The war with $FROMCOUNTRY$ is not going well. The damnable Japanese are in our lands and blockading our ports, and to the embarrassment of our government there seems to be little we can do to stop them. $FROMCOUNTRY_ADJ$ diplomats have approached us to negotiate a ‘fair’ settlement-hand over Formosa and pay reparations. While we could drag the war on and see if the $FROMCOUNTRY_ADJ$ have the wherewithal to finish their assault, it might be in our best interest to give them what they want, though the loss to our prestige would be considerable.;;;;;;;;;;;;;x
EVTNAME1316085;The Treaty of Shimonoseki;;;;;;;;;;;;;x
EVTDESC1316086;The $FROMCOUNTRY_ADJ$ rulership has signed our peace treaty, granting us Formosa as well as reparations. This has improved relations between our countries tremendously, and should go a long way to ensuring $COUNTRY_ADJ$ influence in Asia remains strong.;;;;;;;;;;;;;x
EVTNAME1316086;$FROMCOUNTRY$ Agrees;;;;;;;;;;;;;x
EVTDESC1316089;$FROMCOUNTRY$ has won its war against us. Now their generals walk into $CAPITAL$, gloating with their superiority. It seems that, should they force us to the negotiating table to demand yet more concessions, we will have little choice but to comply.;;;;;;;;;;;;;x
EVTNAME1316089;The $FROMCOUNTRY_ADJ$ Victory;;;;;;;;;;;;;x
EVTDESC1316090;We have won a great victory against $FROMCOUNTRY$. Now we must consider-do we negotiate with them, perhaps promising the return of some of their land in exchange for the island of Formosa and reparations? Or do we stay our current course and perhaps alarm the Western nations at our advances into $FROMCOUNTRY_ADJ$ territory?;;;;;;;;;;;;;x
EVTNAME1316090;The Treaty of Shimonoseki;;;;;;;;;;;;;x
EVTOPTA1316090;Make the deal with the $FROMCOUNTRY_ADJ$.;;;;;;;;;;;;;x
EVTOPTB1316090;No. We will keep what we have now.;;;;;;;;;;;;;x
EVTDESC1316091;We have won a great war against $FROMCOUNTRY$. Now we are faced with a dilemma: do we force the $FROMCOUNTRY_ADJ$ government to the negotiating table, perhaps promising the return of some of their land in exchange for a treaty port and reparations? Or do we stay our current course and perhaps alarm the other great powers at our advances into $FROMCOUNTRY_ADJ$ territory?;;;;;;;;;;;;;x
EVTNAME1316091;The Unequal Treaty;;;;;;;;;;;;;x
EVTOPTB1316091;Forget it. We will keep what we have.;;;;;;;;;;;;;x
EVTDESC1316092;As we thought, the $FROMCOUNTRY_ADJ$ infidels have forced a so-called ‘treaty’ upon us, demanding a great deal of reparations and land concession-in return for land they currently possess but have no more right to.;;;;;;;;;;;;;x
EVTNAME1316092;The Unequal Treaty;;;;;;;;;;;;;x
EVTOPTA1316092;Every dog has its day.;;;;;;;;;;;;;x
EVTDESC1316095;Envoys from $FROMCOUNTRY$ have approached us about leasing a port town on the Guangzhou coast in exchange for a substantial sum of money. The port is of no particular consequence and would never be missed, though we might wish to think twice before giving even more foreigners a foothold on our shores. Still, their proposal is respectful and their offer generous.;;;;;;;;;;;;;x
EVTNAME1316095;Leasing a Port?;;;;;;;;;;;;;x
EVTDESC1316096;Our offer has been accepted, and control of the port town has been transferred to us. This will facilitate our trade with China and our Asian possessions.;;;;;;;;;;;;;x
EVTNAME1316096;China Agrees!;;;;;;;;;;;;;x
EVTDESC1316097;Our offer has been turned down, and the Chinese seem offended that we even asked. If we still want a Chinese port, we’ll have to get it the old-fashioned way…;;;;;;;;;;;;;x
EVTNAME1316097;China Refuses!;;;;;;;;;;;;;x
EVTDESC1316175;We have lost all patience with the barbarians who call themselves our ‘masters’. They ignore our laws, our customs, and force themselves upon the generosity of the $COUNTRY_ADJ$ throne at every opportunity. It is time we turned them out, refused them their free reign in our lands and ports and demonstrated the true might of our Emperor.;;;;;;;;;;;;;x
EVTOPTA1316175;The barbarians will learn to bow.;;;;;;;;;;;;;x
EVTOPTB1316175;Avoid angering the barbarians.;;;;;;;;;;;;;x
EVTDESC1316176;Relations have been cool with $FROMCOUNTRY$, laced with bitterness over our nation’s superiority. Lately the situation has reached a boiling point, and we have received a report that the $COUNTRY_ADJ$ envoy to the $FROMCOUNTRY_ADJ$ court has been ejected. Indeed, $COUNTRY_ADJ$ nationals throughout $FROMCOUNTRY$ are reporting harassment and outright violence. $COUNTRY_ADJ$ are being refused berth at Chinese harbours. This is a systematic campaign by the $FROMCOUNTRY_ADJ$ emperor to reduce our influence.;;;;;;;;;;;;;x
EVTNAME1316176;$COUNTRY_ADJ$ Envoy Ejected;;;;;;;;;;;;;x
EVTOPTA1316176;Is this emperor a madman?;;;;;;;;;;;;;x
EVTOPTB1316176;We cannot afford a war at the moment.;;;;;;;;;;;;;x
EVTDESC1316180;China has no need for, nor interest in, foreigners and their gifts no matter how ingenious they may be. It is only due to the emperor’s generosity that foreigners are allowed to trade at all, and all such trade must take place at our will. The yi barbarians should tremble as they obey us and show no negligence! Barbarians shall bow down before the Chinese emperor in the manner customary for tributary envoys.;;;;;;;;;;;;;x
EVTNAME1316180;Empire of the Great Qing;;;;;;;;;;;;;x
EVTOPTA1316180;They shall receive a chilly reception in our court.;;;;;;;;;;;;;x
EVTOPTB1316180;This is not the time to provoke them.;;;;;;;;;;;;;x
EVTDESC1316181;$COUNTRY_ADJ$ officials recently boarded the Arrow, a Chinese-owned ship (a lorcha) that was suspected of piracy and smuggling. Twelve Chinese crew members were arrested on suspicion of piracy by the $COUNTRY_ADJ$ authorities. British officials have demanded the release of the sailors, however, claiming that because the ship had recently been British-registered, it was under their protection. They also demand reparations. The Imperial court has been enraged by this claim, suggesting that agreeing to British demands would give smugglers free reign throughout China.;;;;;;;;;;;;;x
