CODE;ENGLISH;FRENCH;GERMAN;POLISH;SPANISH;ITALIAN;SWEDISH;CZECH;HUNGARIAN;DUTCH;PORTUGUESE;RUSSIAN;FINNISH;x
EVTDESC600018;The Third International or The Communist International, was an association of national communist parties founded in 1919 by Lenin. Though its stated purpose was the promotion of world revolution, the Comintern functioned chiefly as an organ of Soviet control over the international communist movement. The Comintern emerged from the three-way split in the socialist Second International. A majority of socialist parties, comprising the International’s ‘right’ wing, chose to support the war efforts of their respective national governments against exterior enemies. The ‘centre’ faction of the International decried the nationalism of the right and sought the reunification of the Second International under the banner of world peace. The ‘left’ group, led by Vladimir Lenin, rejected both nationalism and pacifism, urging instead a socialist drive to transform the war of nations into a transnational class war.;;;;;;;;;;;;;x
EVTDESC600019;In November 1917, following the October Revolution, the first government of the independent Transcaucasia was created in Tbilisi. The Transcaucasian Commissariat (Sejm) existed for a couple of months following the Bolshevik seizure of power. Later, the Sejm proclaimed the ‘Transcaucasian Democratic Federative Republic’ and a peace conference was held between the Ottoman Empire and a delegation of the Sejm. The mood prevailing in Tbilisi was very different. Tbilisi acknowledged a state of war between itself and the Ottoman Empire. A new peace conference opened at Batum and at this conference the Ottomans extended their demands. The Armenian and Georgian members of the Republic’s delegation began to stall. Beginning on May 21, the Ottoman army moved ahead once again. The conflict led to a series of battles and on May 26, 1918, Georgia declared independence;two days later, Armenia and Azerbaijan followed suit, dissolving the federation.;;;;;;;;;;;;x
EVTDESC600020;With the Bolshevik taking the power in Russia, they are pressuring us to change our government to be more aligned with theirs! They demand a proletariat government in our country! What should we do?;;;;;;;;;;;;;x
EVTDESC600021;The October Revolution of 1917 turned Finnish politics upside down. Now, the new non-Socialist majority of the Parliament desired total independence, and the Socialists came gradually to view Soviet Russia as an example to follow. On November 15, 1917, the Bolsheviks declared a general right of self-determination, including the right of complete secession, ‘for the Peoples of Russia’. On the same day the Finnish Parliament issued a declaration by which it temporarily took power in Finland. Worried by the development in Russia, and Finland, the non-Socialist Senate proposed that Parliament declare Finland’s independence, which was agreed on in the Parliament on December 6, 1917. On December 18 the Soviet government issued a Decree, recognizing Finland’s independence, and on December 22 it was approved by the highest Soviet executive body—VTsIK. Germany and the Scandinavian countries followed without delay.;;;;;;;;;;;;;x
EVTDESC600022;Historically, with the outbreak of the World War I, the Russian Empire fell into revolution and civil war. As a part of this larger conflict, the Estonians declared independence from Russia and won their freedom during the Estonian War of Independence. As a symbol of Estonian independence, Yuryev/Dorpat was officially given back its Estonian name, Tartu. The new Communist Russian government acknowledged Estonia’s freedom in the 1920 Treaty of Tartu. The Estonians are offering us a peace treaty, what should we do?;;;;;;;;;;;;;x
EVTDESC600023;Historically, after the Russian Empire lost the Crimean war and was weakened economically and politically, an unrest started in the former Polish-Lithuanian Commonwealth. In Vilnius alone 116 demonstrations were held in 1861. In August 1861, manifestations in Vilnius ended in clashes with the Imperial Russian Army. In spite of Russian police and Cossack interference, a symbolic meeting of hymn-singing Poles and Lithuanians took place on the bridge across Niemen River. After a series of patriotic riots, the Russian Namestnik of Tsar Alexander II, General Karl Lambert, introduced martial law in Poland on 14 October 1861. Public gatherings were banned and some public leaders made outlaws. Now, with the hardships of the Crimean War, the poles, the Lithuanians and the Ukrainians are rising to make patriotic demonstrations. What should we do?;;;;;;;;;;;;;x
EVTDESC600024;The January Uprising was an uprising in the former Polish-Lithuanian Commonwealth (present-day Poland, Lithuania, Belarus, Latvia, parts of Ukraine, western Russia) against the Russian Empire. It began on 22 January 1863 and lasted until the last insurgents were captured in 1865. The uprising began as a spontaneous protest by young Poles against conscription into the Imperial Russian Army, and was soon joined by high-ranking Polish-Lithuanian officers and various politicians. The rebels set up a provisional government in Congress Poland and are stirring other poles, Ukrainians and Lithuanians to rise against us!;;;;;;;;;;;;;x
EVTDESC600025;The Polish demonstrations have grown into a mass rebellion! Lithuanians and Latvians joined the poles and seceded from Russia!;;;;;;;;;;;;;x
EVTDESC600050;When a Polish insurrection broke out in Galicia (Austrian Poland) early in 1846, Austria held that Cracow’s independent status provided the stimulus as well as a forum for the planning of Polish revolts and obtained the consent of Russia and Prussia to suppress the Republic of Cracow. After a brief resistance, Cracow was occupied by Austrian troops (March 1846) and attached to Galicia.;;;;;;;;;;;;;x
EVTNAME600050;Polish Insurrection in Galicia!;;;;;;;;;;;;;x
EVTOPTA600050;Dispatch diplomats to begin the talks.;;;;;;;;;;;;;x
EVTOPTB600050;We don’t care about Prussia and Russia consent on this matter, we must act now.;;;;;;;;;;;;;x
EVTOPTC600050;Ignore the rebellion. They are harmless.;;;;;;;;;;;;;x
EVTDESC600051;The Kraków Uprising of February 1846 was an attempt, led by Edward Dembowski, to incite a Polish fight for national independence. Most of the uprising was limited to the Free City of Kraków, where Jagiellonian University philosophy professor Michal Wiszniewski acted as its chief for a day, to be followed by Rector Jan Tyssowski. Teofil Wisniowski, the President of the Uprising Tribunal in the Austrian province of Galizien, led a short-lived uprising in Eastern Galicia, which saw a battle at Narajów involving Austrian hussars.;;;;;;;;;;;;;x
EVTNAME600051;The Kraków Uprising!;;;;;;;;;;;;;x
EVTOPTA600051;Let the revolutionaries take the city. Unite Poland!;;;;;;;;;;;;;x
EVTOPTB600051;Suppress the revolutionaries or the Austrians might retaliate.;;;;;;;;;;;;;x
EVTDESC600052;A Polish revolution began on Kraków and it threatens to spread like wildfire in our great nation. Austria is asking our consent to suppress Kraków, arguing the free city is the focus of the Polish nationality and insurgency and that suppressing the city can end future Polish rebellions. Our diplomats are worried that this rebellion may grow if we don’t support the Austrians. What do we tell the Austrian envoy?;;;;;;;;;;;;;x
EVTNAME600052;The Polish Question;;;;;;;;;;;;;x
EVTOPTA600052;Let the Austrians know that they have our support on this matter.;;;;;;;;;;;;;x
EVTOPTB600052;The Treaty of Vienna needs to be upheld. We do not support the Austrians.;;;;;;;;;;;;;x
EVTDESC600054;Russia and Prussia agreed to our proposed solution. With the consent of the three nations, our troops are ready for deployment and to put down the polish rebellion.;;;;;;;;;;;;;x
EVTNAME600054;The Fate of Kraków;;;;;;;;;;;;;x
EVTOPTA600054;To Kraków! For the Kaiser!;;;;;;;;;;;;;x
EVTOPTB600054;On second thought, we can’t afford a war right now.;;;;;;;;;;;;;x
EVTDESC600055;One or more powers disagrees with our solution for the Polish rebels. Acting now might anger them, but not acting might make the Poles even bolder.;;;;;;;;;;;;;x
EVTNAME600055;The Fate of Kraków;;;;;;;;;;;;;x
EVTOPTA600055;We don’t need their approval! We will march on Kraków.;;;;;;;;;;;;;x
EVTOPTB600055;Maybe it’s wiser to let this matter go.;;;;;;;;;;;;;x
EVTDESC600056;With the success of the Kraków Revolution, the city is being used as a base of operations to disrupt our activities in what they consider Polish territory and to incite Polish citizens to rebel. Our diplomats say this will only end when the city falls.;;;;;;;;;;;;;x
EVTNAME600056;Polish Nationality;;;;;;;;;;;;;x
EVTOPTA600056;Curses!;;;;;;;;;;;;;x
EVTDESC600057;Colorado Rebels took the government and forced president Oribe to step down. Fructuoso Rivera, once exiled in Brazil, returned and now assumes the country as interim president until the next election. Manuel Oribe, the former Blanco President, was forced to flee the country in exile to Buenos Aires. Rivera dissolved the parliament, called for an election and installed pro-Colorado politicians in the upper house while the Colorado Caudillos are laying down their arms and donating what they can to help the Colorado government. France and the United Kingdom, seeking the downfall of Rosas, are also sending help.;;;;;;;;;;;;;x
EVTNAME600057;Colorado Victory;;;;;;;;;;;;;x
EVTOPTA600057;Long Live Fructuoso Rivera!;;;;;;;;;;;;;x
EVTDESC600058;President Manuel Oribe from Uruguay was deposed by the Colorado Party and fled the country to Buenos Aires. Governor of Buenos Aires and president of the Argentine Confederation, Juan Manuel de Rosas, received him as the constitutional president and soon offered him the command of the armies of the Argentine Confederation. Rivera, the interim president of Uruguay and leader of the Colorados, is extremely hostile to Rosas and to the Confederation thanks to the fact that Rosas and other Federalist Argentines backed Oribe in the past as well due to ideological differences. Rivera now harbour Argentine exiles that might cause problems in the future.;;;;;;;;;;;;;x
EVTNAME600058;Oribe’s Exile;;;;;;;;;;;;;x
EVTOPTA600058;Argentina will never recognize Rivera as President.;;;;;;;;;;;;;x
EVTOPTB600058;It’s better to not risk a conflict.;;;;;;;;;;;;;x
EVTDESC600059;The political scene in Uruguay during the 1830s became split between two parties, the conservative Blancos (‘Whites’) and the liberal Colorados (literally ‘coloureds’, more usually ‘Reds’). The Colorados were led by Fructuoso Rivera and represented the business interests of Montevideo. The Blancos were headed by Manuel Oribe, who looked after the agricultural interests of the countryside and promoted protectionism. The two groups took their names from the colour of the armbands that they wore. Initially, the Colorados wore blue, but when it faded in the sun, they replaced it with red. \n \n The Uruguayan Constitution of 1830 didn’t anticipate the sharing of political power between parties, which forced the minorities to resort to revolution.;;;;;;;;;;;;;x
EVTNAME600059;The Rise of the Colorados;;;;;;;;;;;;;x
EVTOPTA600059;Troublemakers, the lot of them.;;;;;;;;;;;;;x
EVTDESC600060;With the destruction of our army, Oribe took the opportunity to seize the countryside. Now, they are moving in to take the capital.;;;;;;;;;;;;;x
EVTNAME600060;Oribe’s Army;;;;;;;;;;;;;x
EVTOPTA600060;That can’t end well for us.;;;;;;;;;;;;;x
EVTOPTB600061;Let it go, Rosas surely will not interfere in Uruguay anymore.;;;;;;;;;;;;;x
EVTDESC600062;For a long time, two projects of country divided Argentina. Unitarianists or Unitarians were the proponents of the concept of a Unitary state (centralized government) in Buenos Aires and they were led by Juan Lavalle. They were opposed to the Argentine Federalists, who wanted a federation of independent provinces, led by Juan Manuel de Rosas. The Unitarians, sympathetic to our government, fled Argentina in exile after being defeated in 1831. Rosas, the so-called Restorer of the Laws, controlled the Argentine Confederation for too long under his despotic rule. Now, our friends in Uruguay defeated the Blancos and promise to support us if we were to fight the Federalists to end Rosas despotic ruler.;;;;;;;;;;;;;x
EVTNAME600062;The Argentine Federalists;;;;;;;;;;;;;x
EVTOPTA600062;Tell them we are ready for war when they are.;;;;;;;;;;;;;x
EVTDESC600063;Genaro Berón de Astrada, governor of Corrientes, pledged to support us in our struggle against Rosas. The moment has arrived to rid the world of the tyrant. If we back down now, our government might look weak. France and the United Kingdom, that long had an attrition with Rosas, will surely help us in our struggle.;;;;;;;;;;;;;x
EVTNAME600063;The Big War;;;;;;;;;;;;;x
EVTOPTA600063;Call the Caudillos. Mobilize the troops. Rosas will fall.;;;;;;;;;;;;;x
EVTOPTB600063;This is a dangerous move. Let the Blancos and Rosas in peace.;;;;;;;;;;;;;x
EVTOPTC600063;Bide our time.;;;;;;;;;;;;;x
EVTDESC600064;The Uruguayan President backed down from the war with Rosas, but Rosas knows of the plan. This, combined with previous attrition with him, will surely lead to a war against him.;;;;;;;;;;;;;x
EVTNAME600064;Rivera backs down;;;;;;;;;;;;;x
EVTOPTA600064;Fight to the last man!;;;;;;;;;;;;;x
EVTOPTB600064;It’s time to step down.;;;;;;;;;;;;;x
EVTDESC600065;Rivera, the Uruguayan president, convinced governor Genaro Berón de Astrada to support him and Corrientes in a rebellion against Buenos Aires. Uruguay is preparing for war against us and they seek to depose Rosas.;;;;;;;;;;;;;x
EVTNAME600065;The Uruguayan Aggression;;;;;;;;;;;;;x
EVTOPTA600065;The fools!;;;;;;;;;;;;;x
EVTDESC600066;Giuseppe Garibaldi moved in with his wife and has been living in Montevideo for a time already. A sworn fighter against tyranny, he now has offered his help in setting up the defences of Montevideo against Oribe and Rosas and has offered to lead an Italian Legion made of foreign soldiers that will help us in the struggle against the tyranny of Rosas. Furthermore, it has been recommended that we do as the Blancos are planning to do and abolish slavery in Uruguay so we can have more soldiers for the war.;;;;;;;;;;;;;x
EVTNAME600066;The Italian Legion;;;;;;;;;;;;;x
EVTOPTA600066;We welcome him and his soldiers.;;;;;;;;;;;;;x
EVTOPTB600066;We don’t need any help.;;;;;;;;;;;;;x
EVTDESC600067;The Italian Legion of Garibaldi has finished the construction of a fort and barricades throughout the city. This will, without a doubt, help us in the war.;;;;;;;;;;;;;x
EVTNAME600067;The Defences of Montevideo;;;;;;;;;;;;;x
EVTOPTA600067;Wonderful!;;;;;;;;;;;;;x
EVTDESC600068;The Italian Legion has defeated the enemy in a province and seized it back, returning it for us.;;;;;;;;;;;;;x
EVTNAME600068;Garibaldi seizes a province;;;;;;;;;;;;;x
EVTOPTA600068;Splendid!;;;;;;;;;;;;;x
EVTDESC600069;After years of struggle, the Blancos are losing their strength. Our country, once torn by civil war, is beginning to unite and the flames of revolutions are dying.;;;;;;;;;;;;;x
EVTNAME600069;The Fall of the Blancos;;;;;;;;;;;;;x
EVTOPTA600069;Finally.;;;;;;;;;;;;;x
EVTDESC600070;The war with Argentina and the Blancos costed too much already and our people want peace, internally and externally. The Brazilians are showing some interest in the conflict, and our country, and they would help us much in the struggle against Rosas and Oribe. Our diplomats began the talks and the conditions the Brazilians are asking are the free navigation of the Uruguay river, taxes and trade benefits, renouncement of our claims on the border with Rio Grande do Sul and the recognition of Brazil’s right to interfere with our internal affairs. \n \n Getting Brazilian help would undoubtedly tip the war in our favour and it is better than to risk another Blanco government.;;;;;;;;;;;;;x
EVTNAME600070;Brazilian Intervention;;;;;;;;;;;;;x
EVTOPTA600070;I’m sure there will be no problems. Ask for their help.;;;;;;;;;;;;;x
EVTOPTB600070;We can take care of this war by ourselves.;;;;;;;;;;;;;x
EVTDESC600071;For a long time, Uruguay has been plunged into turmoil. It fights the Blancos, which aren’t too fond of us, and the Argentine, which aren’t too fond of us either. But the war isn’t going very well for them, and they are asking for our help. In exchange for our help, they are proposing several benefits for our country, such as treaties for the free navigation of the Uruguay river, taxes and trade benefits, renouncement of their claims on the border with Rio Grande do Sul and the recognition of Brazil’s right to interfere with Uruguay internal affairs. This would undoubtedly bring our countries close together and can serve as the start of Brazilian hegemony in the south of the continent;;;;;;;;;;;;;x
EVTNAME600071;Uruguay asks for our help;;;;;;;;;;;;;x
EVTOPTA600071;Agree to these terms.;;;;;;;;;;;;;x
EVTOPTB600071;We can’t afford to help them right now.;;;;;;;;;;;;;x
EVTDESC600072;After years of struggle for power, both the Colorados and the Blancos were weary of the chaos. In $YEAR$, they came to an agreement to define spheres of influence: the Colorados would control Montevideo and the coastal region, the Blancos would rule the hinterland with its agricultural estates. In addition, the Blancos were paid a lump sum of money to compensate them for the loss of their stake in Montevideo.;;;;;;;;;;;;;x
EVTNAME600072;Spheres of Influence;;;;;;;;;;;;;x
EVTOPTA600072;Finally, we can have some peace.;;;;;;;;;;;;;x
EVTOPTB600072;Unnecessary. Our current government will always have power.;;;;;;;;;;;;;x
EVTDESC600073;Blancos and Colorados finally learned to share political power. This will severely reduce rebellion and aggressions between the parties.;;;;;;;;;;;;;x
EVTNAME600073;Spheres of Influence;;;;;;;;;;;;;x
EVTOPTA600073;Uruguay can rest;;;;;;;;;;;;;x
EVTDESC600074;President Rivera lost the war he started and we are now in a position to install Oribe, the true President, in the government of Uruguay.;;;;;;;;;;;;;x
EVTNAME600074;Uruguay Is Defeated;;;;;;;;;;;;;x
EVTOPTA600074;Install Oribe as President but interfere no more.;;;;;;;;;;;;;x
EVTOPTB600074;Install Oribe as President and make sure he stays there.;;;;;;;;;;;;;x
EVTOPTC600074;Install Oribe as President and take steps to control Uruguay.;;;;;;;;;;;;;x
EVTOPTD600074;Don’t interfere in Uruguay.;;;;;;;;;;;;;x
EVTDESC600075;Rosas is defeated and fled Argentina to the United Kingdom. Oribe lost all claims on the presidency and also fled the country, but that will not stop trouble with the Blanco party.;;;;;;;;;;;;;x
EVTNAME600075;Rosas Is Defeated;;;;;;;;;;;;;x
EVTOPTA600075;Help the unitarians organize Argentina.;;;;;;;;;;;;;x
EVTOPTB600075;Don’t interfere anymore.;;;;;;;;;;;;;x
EVTDESC600076;Uruguay and Argentina agreed to an armistice and peace talks led to the maintenance of the status quo. Our war to oust Rosas wasn’t successful.;;;;;;;;;;;;;x
EVTNAME600076;The Armistice of $YEAR$;;;;;;;;;;;;;x
EVTOPTA600076;Damn.;;;;;;;;;;;;;x
EVTDESC600401;The system of elections in $COUNTRY$ has been abolished.;;;;;;;;;;;;;x
EVTNAME600401;Abolishment of Elections in $COUNTRY$;;;;;;;;;;;;;x
EVTOPT600401;Very well.;;;;;;;;;;;;;x
EVTDESC600402;Sweeping reforms in $COUNTRY$ have allowed for the first elections, bringing us one step closer towards self-determination.;;;;;;;;;;;;;x
EVTNAME600402;Elections in $COUNTRY$;;;;;;;;;;;;;x
EVTOPT600402;Rejoice!;;;;;;;;;;;;;x
EVTNAME604206;German Invitation to the Reichspakt;;;;;;;;;;;;;x
EVTDESC604206;The Germans have decided to invite us their economic union. We now have the decision to accept or decline.;;;;;;;;;;;;;x
EVTOPTA604206;We accept their invitation.;;;;;;;;;;;;;x
EVTOPTB604206;This does not suit our interests.;;;;;;;;;;;;;x
EVTNAME614206;German Invitation to the Reichspakt;;;;;;;;;;;;;x
EVTDESC614206;The Germans have decided to invite us their economic union. We now have the decision to accept or decline.;;;;;;;;;;;;;x
EVTOPTA614206;We accept their invitation.;;;;;;;;;;;;;x
EVTOPTB614206;This does not suit our interests.;;;;;;;;;;;;;x
EVTNAME624206;German Invitation to the Reichspakt;;;;;;;;;;;;;x
EVTDESC624206;The Germans have decided to invite us their economic union. We now have the decision to accept or decline.;;;;;;;;;;;;;x
EVTOPTA624206;We accept their invitation.;;;;;;;;;;;;;x
EVTOPTB624206;This does not suit our interests.;;;;;;;;;;;;;x
EVTNAME634206;German Invitation to the Reichspakt;;;;;;;;;;;;;x
EVTDESC634206;The Germans have decided to invite us their economic union. We now have the decision to accept or decline.;;;;;;;;;;;;;x
EVTOPTA634206;We accept their invitation.;;;;;;;;;;;;;x
EVTOPTB634206;This does not suit our interests.;;;;;;;;;;;;;x
EVTNAME644206;German Invitation to the Reichspakt;;;;;;;;;;;;;x
EVTDESC644206;The Germans have decided to invite us their economic union. We now have the decision to accept or decline.;;;;;;;;;;;;;x
EVTOPTA644206;We accept their invitation.;;;;;;;;;;;;;x
EVTOPTB644206;This does not suit our interests.;;;;;;;;;;;;;x
EVTDESC650010;The U.S. Congress has enacted the Indian Removal Act, which authorises the U.S. President to enter into negotiations with us to swap our territory east of the Mississippi for new lands west of the river.\n \n They have now come to force us of our land, and we dear not refuse.;;;;;;;;;;;;;x
EVTNAME650010;The Trail of Tears;;;;;;;;;;;;;x
EVTDESC650011;In the whole scene there was an air of ruin and destruction, something which betrayed a final and irrevocable adieu. … I asked one why they were leaving their country. ‘To be free,’ he answered, could never get any other reason out of him. We… watched the expulsion… of one of the most celebrated and ancient American peoples.’-Alexander de Tocqueville, Democracy in America.\n \n Under the terms of the Indian Removal Act, we have agreed to a land swap with the Choctaw Nation. They are now marching West, to settle in a new home, away from the bones of their ancestors.;;;;;;;;;;;;;x
EVTNAME650011;Treaty of Dancing Rabbit Creek;;;;;;;;;;;;;x
EVTDESC650012;Your Father has provided a country large enough for all of you, and he advises you to remove to it. There your white brothers will not trouble you: They will have no claim to the land, and you can live upon it you and all your children, as long as the grass grows or the water runs, in peace and plenty. It will be yours forever.’-President Andrew Jackson\n \n Under the terms of the Indian Removal Act, we have agreed to a land swap with the Creek Nation. They are now marching West, to settle in a new home, away from the bones of their ancestors.;;;;;;;;;;;;;x
EVTNAME650012;Treaty of Cusseta;;;;;;;;;;;;;x
EVTDESC650013;I saw the helpless Cherokees arrested and dragged from their homes, driven at the bayonet point into the stockade. In the chill of a drizzling rain, I saw them loaded like cattle or sheep into wagons and started toward the west… We encountered a terrific sleet and snow storm with freezing temperatures, from that day until we reach the end of the fateful journey, the sufferings of Cherokees were awful. The trail of the exiles was a trail of death. They had to sleep in the wagons and on the ground without fire. And I’ve known as many as twenty-two of them to die in one night of pneumonia due to ill treatment, cold and exposure…’-Private John G. Burnett\n \n Under the terms of the Indian Removal Act, we have agreed to a land swap with the Cherokee Nation. They are now marching West, to settle in a new home, away from the bones of their ancestors.;;;;;;;;;;;;;x
EVTNAME650013;Treaty of New Echota;;;;;;;;;;;;;x
EVTDESC650015;Under the terms of the Indian Removal Act, we have agreed to a land swap with the Seminole Nation. However, they claim-not completely unjustified-that the treaty was signed under duress and the new lands unsuitable for their needs. They are therefore refusing to go.;;;;;;;;;;;;;x
EVTNAME650015;Treaty of Payne’s Landing;;;;;;;;;;;;;x
EVTDESC650020;Gold! Gold! I have found Gold! A mountain of Gold! To the White Man, gold is the object of ultimate desire. And in their pursuit of it, nothing is sacred to them. Forests, mountains, settlements, treaties, all that stands between the White Man and his gold will be destroyed. Now the news of gold in our territory is spreading into White Man’s lands, and this is sure to cause many to come to our lands in search of it.;;;;;;;;;;;;;x
EVTNAME650020;The Great Intrusion;;;;;;;;;;;;;x
EVTDESC650021;A man returned to $PROVINCENAME$ from the North Georgia mountains today, carrying with him a rock with a distinctive hue, a very distinctive hue. It does not take long for it to be confirmed what the man already knew…\n \n It seem that, this year, it isn’t just the trees turning golden in Georgia.;;;;;;;;;;;;;x
EVTNAME650021;Golden Georgia;;;;;;;;;;;;;x
EVTDESC650022;A dried-up old traveller has returned from the mountains. When given a whiskey he says with a hoarse voice ‘Gold! I have found Gold! A mountain of Gold!’\n \n Hoping to pay his tap with a nugget, the barkeep informs him that what he thought of as gold is in fact worthless pyrite: fool’s gold…;;;;;;;;;;;;;x
EVTNAME650022;Golden Georgia!;;;;;;;;;;;;;x
