CODE;ENGLISH;FRENCH;GERMAN;POLISH;SPANISH;ITALIAN;SWEDISH;CZECH;HUNGARIAN;DUTCH;PORTUGUESE;RUSSIAN;FINNISH;x
EVTDESC6051288;After returning from London, the Confederate ambassador to the United Kingdom published a collection of essays titled ‘An Imperial Confederacy.’ Throughout his writings, he described the regality and honour of the English royal family. As an avid convert to monarchism, the former ambassador argued for the establishment of a chivalrous monarchy that the good people of South may look up to for inspiration and guidance. His essays have become extremely popular with the more conservative elements of the Confederacy, and a group of Senators in $CAPITAL$ have proposed a bill that would amend the constitution to allow for a constitutional monarchy. Some believe a monarchy could help further develop a Confederate cultural identity that is unique from our Yankee neighbours. Nevertheless, many believe that the South does not need a king and a Confederate monarchy would disgrace the memory of great Southerners like George Washington and Jefferson Davis who fought against such tyrants.;;;;;;;;;;;;;x
EVTDESC6165914;The British have refused to sell us the Maritimes. It seems money cannot get New England everything. What a disastrous day for business in Boston.;;;;;;;;;;;;;x
EVTDESC6200001;For some years now, the Boers have left our South African colonies and formed states of their own. We regard these ‘Boer Republics’ as being in our sphere of influence and control. The Boer populations however have a fierce streak of independence and resist all foreign attempts to influence them. Lingering issues over the treatment and political rights of non-Boer whites in these republics is a perennial source of tension between the Administration in Cape Town and the Boer leaders.;;;;;;;;;;;;;x
EVTNAME6200001;Anglo-Boer Tensions;;;;;;;;;;;;;x
EVTOPTA6200001;Trouble in South Africa!;;;;;;;;;;;;;x
EVTDESC6200003;Trouble with the Zulus has arisen again. Issues of border demarcation, Zulu raids, and encroachment onto Zulu lands by white settlers are frequent causes of discord between London and the administration in Cape Town. This leads to a strain on relations and a lessening of influence by London vis a vis the Zulu King.;;;;;;;;;;;;;x
EVTNAME6200003;Anglo-Zulu Tensions;;;;;;;;;;;;;x
EVTDESC6200010;In PUIR, Colonisation is enabled in two phases. Phase One unlocks with the ‘Colonial Negotiations’ invention in 1875. Phase two unlocks with the ‘Indigenous Garrisoning’ invention in 1885. Phase 1 allows all provinces with a life rating of 20 or higher to be colonized. Phase two allows all provinces with a life rating of 10 or higher to be colonized.;;;;;;;;;;;;;x
EVTNAME6200010;Colonisation Dates Reminder;;;;;;;;;;;;;x
EVTOPTA6200010;Now I cannot claim to be ignorant!;;;;;;;;;;;;;x
EVTDESC6200012;This event supplements POP growth in the Ukrainian provinces owned by Russia. The extra population growth modifiers fix a 20 million disparity relative to history that maximizing life ratings for growth cannot.;;;;;;;;;;;;;x
EVTNAME6200012;Ukrainian Growth Boost;;;;;;;;;;;;;x
EVTOPTA6200012;Good;;;;;;;;;;;;;x
EVTDESC6261783;Order has been restored to South America, and the ideals of $COUNTRY$ have been preserved for another generation. The tyrannical grip that existed over South America has been broken, and independence and liberty has returned to the continent. The nations of the New World will no longer have to live in fear.;;;;;;;;;;;;;x
EVTDESC6500060;Traditionally, Switzerland avoids alliances that might entail military, political, or direct economic action and has been neutral since the end of its expansion in 1515. Its policy of neutrality was internationally recognised at the Congress of Vienna in 1815.;;;;;;;;;;;;;x
EVTNAME6500060;Neutrality of Switzerland;;;;;;;;;;;;;x
EVTDESC6542984;For quite some time, there has been a cooling of relations between $COUNTRY$ and $FROMCOUNTRY$, and in a surprising turn of events, the Germans have requested to negotiate over the hotly contested land of Alsace-Lorraine. In return for recognizing German rule over the provinces of Colmar and Strasbourg, they are willing to return Metz back to French control. Some say this treaty will finally bring peace to the west, others say it would be a stab in the back of the people of France.;;;;;;;;;;;;;x
EVTDESC6595090;After the Cusco Congress, autonomy for the Spanish speaking regions of South America was guaranteed. We must honour our promises to the Spaniards and return any cores that belong to them. If this is what it takes to guarantee peace, then so be it.;;;;;;;;;;;;;x
EVTDESC7078003;Our demands to the Brazilian Empire have been met with a harsh rebuttal. US-Brazilian relations are at a low, and the more aggressive Congressmen have been calling for war. Should we respect Brazilian sovereignty or guarantee democracy?;;;;;;;;;;;;;x
EVTDESC7110082;Diplomacy is the art and practice of conducting negotiations between representatives of states. It usually refers to the conduct of international relations through the intercession of professional diplomats with regard to a full range of topical issues. Diplomacy entails influencing the decisions and conduct of foreign governments and officials through dialogue, negotiation, and other nonviolent means.;;;;;;;;;;;;;x
EVTNAME7110082;Crises in 20th Century;;;;;;;;;;;;;x
EVTOPTA7110082;Diplomacy will solve many global matters!;;;;;;;;;;;;;x
EVTDESC7110083;The United Nations (UN) is an intergovernmental organization tasked with maintaining international peace and security, developing friendly relations among nations, achieving international co-operation, and being a centre for harmonizing the actions of nations. It was established after World War II, with the aim of preventing future wars, and succeeded the ineffective League of Nations. Its headquarters, which are subject to extraterritoriality, are in Manhattan, New York City, and it has other main offices in Geneva, Nairobi, Vienna and The Hague.;;;;;;;;;;;;;x
EVTNAME7110083;Foundation of United Nations;;;;;;;;;;;;;x
EVTOPTA7110083;Great!;;;;;;;;;;;;;x
EVTDESC7110088;The War of Independence ended with the Anglo-Irish Treaty, signed on 6 December 1921 and narrowly approved by Dail Eireann on 7 January 1922. A Provisional Government was set up under the terms of the treaty, but the Irish Republic nominally remained in existence until 6 December 1922, when 26 of the island’s 32 counties became a self-governing British Dominion called the Irish Free State. The island had been partitioned by the Government of Ireland Act 1920, and the six counties of Northern Ireland, which had been partitioned artificially so as to create and ensure a unionist majority, exercised their right under the Treaty to opt out of the Free State, and remain in the United Kingdom.;;;;;;;;;;;;;x
EVTNAME7110088;Anglo-Irish Treaty of $YEAR$;;;;;;;;;;;;;x
EVTOPTA7110088;We recognize Ireland Free State but we will keep North Ireland.;;;;;;;;;;;;;x
EVTOPTB7110088;We fully recognize the independence of Ireland!;;;;;;;;;;;;;x
EVTOPTC7110088;No! We will still fight.;;;;;;;;;;;;;x
EVTDESC7142973;$COUNTRY_ADJ$ Red Guards have seized the city of Monaco and unleashed a terrifying storm of red terror upon the local populace. Looting and violence occurred across Monaco with the bulk of the communist rage being directed towards the Monte Carlo district, home of the famed Monte Carlo Casino. Once glamorous and magnificent villas now lay in ruins as $COUNTRY_ADJ$ soldiers were seen exiting them with hands full of pillaged treasures. Any suspected capitalists or members of the local aristocracy who had failed to flee the city were quickly tried by ad-hoc tribunals and ceremoniously executed. The destruction of Monaco culminated in burning of the Monte Carlo Casino, a symbol of the lavish excesses of the bourgeoisie class. It is unlikely that the grandeur of Monaco will return anytime soon.;;;;;;;;;;;;;x
EVTDESC7184127;France has refused to negotiate and will not compromise for the sake of peace. The recent diplomatic progress has been squandered, and war is once again the status quo. Anger has swept across the land as the German people realize French militarism cannot be bargained with.;;;;;;;;;;;;;x
EVTDESC7281959;Due to the collapse of American hegemony, $COUNTRY$ is at a cross roads. Should we end the union created under American supervision, or enact emergency measures to ensure the future of $COUNTRY$. Choosing the latter will lead to an era of civil unrest as we struggle to establish our legitimacy without the backing of our American overlords.;;;;;;;;;;;;;x
EVTDESC7391609;The recent invasion of the Mexican Empire by the United States has alarmed many here in Brazil. There are rumours in the royal court that it will be only a matter of time before the United States strikes south and attempts to oust Brazilian monarchy. None this is helped by the fact that liberals and other pro-republic factions have been inspired by the United States recent revolutionary fervour. It might be for the best if the Brazilian royal family were to slip away to safety in Europe.;;;;;;;;;;;;;x
EVTDESC7493599;While most of upstate New York has welcomed New England as liberators and cultural brothers, the bustling metropolis of New York City has rejected any attempts at integration. Rivalry between New York City and Boston can be traced back to times before the American War for Independence, and the recent annexation has resulted in an eruption of riots across the dirty and overcrowded streets of the Empire City. For now, New England rule has been thoroughly rejected and it will take time to integrate the five boroughs.;;;;;;;;;;;;;x
EVTDESC7597306;The foreign imperialists are gone, but what about the empires that remain? Are they saboteurs disguised as heads of states? Can democracy ever truly be guaranteed if an unelected man holds the highest office? Questions like these are abound in Washington as the issue what should be done about the Mexican Empire. Can a royal family exist in this New World of liberty the United States is attempting to build?;;;;;;;;;;;;;x
EVTDESC7680756;Due to war, civil unrest, and the overall loss of democratic morals and republican values, the United States of America is no longer the shining light of liberty that it once was. The collapse of American institutions and decline of American power means the United States is no longer able to manage its hegemonic grip over the New World. Uncertainty strikes the Americas and the future of the democratic states we have created remains unstable without American backing. Once again, the New World will be open to exploitation by foreign tyrants. Perhaps one day the United States will be able to recover its dignity, but that day is a long way off.;;;;;;;;;;;;;x
EVTDESC7686768;While the notion of Germany choosing diplomacy over Prussian militarism was surprising, the willingness of France to compromise in face of revanchism was even more shocking. The lands of Alsace-Lorraine have been partitioned between the two states in a bid for peace. Celebration has erupted across the streets of Paris and $CAPITAL$ to mark this new period of peace.;;;;;;;;;;;;;x
EVTDESC7790001;Due to the Seven Years War, the Haitian Revolt, and the sale of Louisiana by Napoleon Bonaparte, France no longer possesses its lands in Hispaniola or New France. As the age of Imperialism begins and we look to expand our influence, the question is whether we should make a return to any of our former American colonies. Though reclaiming Haiti would be a bloody campaign, it is relatively defenceless and without allies. However, if we were to reclaim New France itself, we will certainly risk war with The United Kingdom, and will be guaranteed war with the United States. While we may be able to regain some land through negotiations, much of these lands must be regained via war, something that will cause much internal unrest and international tension. If we are successful, restoring French America would be a major source of pride for both ourselves and our Empire, however the cost of war may be far more than the colonies are worth.;;;;;;;;;;;;;x
EVTNAME7790001;France’s American Colonies?;;;;;;;;;;;;;x
EVTOPTA7790001;We are but one soul separated by the sea.;;;;;;;;;;;;;x
EVTOPTB7790001;We will not shed French blood over a few acres of snow.;;;;;;;;;;;;;x
EVTDESC7790003;Now that we have restored French control over Canada, we must decide on what to do with the English Settlers. Few wish to accept out rule, any some have even begun to leave Canada to resettle elsewhere. We could mandate an expulsion program to evict the settlers, however it will be costly and will earn us the ire of the United Kingdom.;;;;;;;;;;;;;x
EVTNAME7790003;$FROMCOUNTRY$ Demands Quebec;;;;;;;;;;;;;x
EVTDESC7790004;The United Kingdom has denied our generous offer, making the peaceful acquisition of French Canada all but impossible, we could declare war on the British right now, or we could abandon the dream of reuniting the French Canadiens and avoid a costly war.;;;;;;;;;;;;;x
EVTNAME7790004;$FROMCOUNTRY$ has ignored our demands!;;;;;;;;;;;;;x
EVTOPTA7790004;War is our only option for reclaiming New France!;;;;;;;;;;;;;x
EVTOPTB7790004;Reuniting the French Canadians was a noble dream, but it isn’t worth it.;;;;;;;;;;;;;x
EVTDESC7790005;The United Kingdom has agreed to our demands, and they have offered to handover the French-speaking parts of Canada in return for a hefty sum of money. While perhaps more than what French Canada is worth, it is far lower than the cost of a drawn-out war with the UK.;;;;;;;;;;;;;x
EVTNAME7790005;$FROMCOUNTRY$ has agreed!;;;;;;;;;;;;;x
EVTOPTA7790005;We are united once more.;;;;;;;;;;;;;x
EVTDESC7790006;Despite our best efforts, the unthinkable has happened: $CAPITAL$ has fallen. It seems there is little choice but to surrender to the French and allow them to dictate terms. If they are kind, the peace treaty may be lenient…;;;;;;;;;;;;;x
EVTNAME7790006;The Fall of $CAPITAL$;;;;;;;;;;;;;x
EVTOPTA7790006;We have no choice, we must surrender.;;;;;;;;;;;;;x
EVTOPTB7790006;"We will fight on; we must not let the French make us a puppet once more!";;;;;;;;;;;;;x
EVTDESC7790007;The French Army has consolidated their control over Madrid and proven their superiority in the war, and thus the Spanish government has little choice but to accept any terms we dictate. The European powers are pushing for peace and conciliation-they wish to see that France only receives minor concessions-though if we dare risk their wrath, we could certainly wrest territorial considerations, both Overseas and in Iberia itself.;;;;;;;;;;;;;x
EVTNAME7790007;The Treaty of Madrid ($YEAR$);;;;;;;;;;;;;x
EVTOPTA7790007;"We have achieved enough; Iberian lands have no actual Value to us.";;;;;;;;;;;;;x
EVTOPTB7790007;"Iberia has no actual value to us; however, we can demand her Colonies.";;;;;;;;;;;;;x
EVTOPTC7790007;We must restore French control over Catalonia!;;;;;;;;;;;;;x
EVTOPTD7790007;We will demand Catalonia as well as the Spanish Colonies!;;;;;;;;;;;;;x
EVTDESC7790008;Despite our best efforts, French armies once again occupy much of Spain. It seems there is little choice but to surrender to the French and allow them to dictate terms. If they are kind, they will simply force us to admit defeat, or possibly annex some of our colonial possessions. If they are unkind, they may force us to give up territory in our homeland-though doing so will surely bring about the wrath of the European powers.;;;;;;;;;;;;;x
EVTDESC7790009;The French Army has consolidated their control over Madrid and proven their superiority in the war, and thus the Spanish government has little choice but to accept any terms we dictate. The European powers are pushing for peace and conciliation-they wish to see that France only receives minor concessions-though if we dare risk their wrath, we could certainly wrest territorial considerations, both Overseas and in Iberia itself.;;;;;;;;;;;;;x
EVTDESC7790010;The institution of a revolutionary regime in France in led most of the European monarchies to form coalitions against it. However, the military successes of the armies of the First Republic resulted in a considerable expansion of the national territory all the way to the left bank of the Rhine. While Napoleon Bonaparte would continue French conquests, His eventual defeat would lead France to be stripped of its new territory by the Congress of Vienna in 1815. The prospect of reclaiming France’s natural borders, however, remained popular to many people both within the government and France itself. Despite its cost in French blood and iron, we have finally reclaimed France’s Natural Borders. While German Nationalism and the rebellious Flemish and Dutch may upset the fragile peace, for now France has proven itself to be the True master of Europe!;;;;;;;;;;;;;x
EVTNAME7790010;France’s Natural Borders;;;;;;;;;;;;;x
EVTOPT7790010;Vive la France !;;;;;;;;;;;;;x
EVTDESC7790011;In 1838 Jean François Langlois, commander of the whaling ship Cachalot, embarked on a grandiose scheme for a French colony at Akaroa. After a dubious land purchase from Maori he established the Nanto-Bordelaise Company in France to carry out the project, and in 1839, King Louis-Philippe agreed to provide assistance. The French representative for the settlement, Captain Charles François Lavaud, sailed for New Zealand in April 1840. A month later, the ship Comte de Paris set off for Akaroa carrying 53 emigrants. The French scheme sparked debate in England and France, and bowing to pressure to colonise the country, the British government sent out William Hobson in 1839. He signed the Treaty of Waitangi on 6 February 1840, and claimed sovereignty over the South Island on 17 June.;;;;;;;;;;;;;x
EVTNAME7790011;The Treaty of Waitangi;;;;;;;;;;;;;x
EVTOPTA7790011;We shall recognize the British claims.;;;;;;;;;;;;;x
EVTOPTB7790011;The UK must negotiate with us directly if they want us to drop our claims.;;;;;;;;;;;;;x
EVTDESC7790012;The French government has refused to recognize the Treaty of Waitangi. Rumours of planned French colonization attempts are spreading and our government is currently debating the best course of action to take.;;;;;;;;;;;;;x
EVTDESC7790013;The United Kingdom has ignored our complaints, and maintain that the Treaty of Waitangi is valid.;;;;;;;;;;;;;x
EVTDESC7790014;The United Kingdom has backed down, leaving New Zealand open to French colonization.;;;;;;;;;;;;;x
EVTDESC7790015;The United Kingdom maintains that the Treaty of Waitangi is valid, however they have offered to sell the islands of Australasia to us for a hefty sum.;;;;;;;;;;;;;x
EVTDESC7790100;With the Rhineland back under French control, the question has been raised as to what to do with the new ‘French’ subjects. Despite the German nature of the West Bank, The Rhinelanders had not been enemies of Revolutionary France, unlike the Spaniards or Portuguese. Prussia, even after their incorporation of the Rhineland and Westphalia in 1815, were regarded by the Rhinelanders with more suspicion, due to their Francophile feeling. The incorporation of such a large number of non-French citizens has also brought up France’s cultural diversity in other areas of the Empire, such as in Algeria or Flanders. Some of the more conservative politicians call for a purely French state, united in one language and culture. The Liberals, however, call for granting the Rhinelanders autonomy similar to that of the Walloons. While Autonomy will seriously hinder our assimilation efforts, it may reduce unrest in the Rhineland and prevent giving the Germans reason to intervene.;;;;;;;;;;;;;x
EVTDESC7790101;French rule over the Rhineland has been firmly cemented in the last 15 years. The Rhenish autonomy laws, as well as the cultural exchange between the Rhineland and the rest of France, has finally earned the loyalty of the Rhenish people. As elements of French culture are merged with that of German culture, the Rhineland, while far more diverse than the rest of European France, is slowly but surely becoming an integral part of our nation.;;;;;;;;;;;;;x
EVTDESC7859305;Chile has refused to join the Andes Republic on the principle of sovereignty and what not. For the good of the New World and for the stability of South America, the obvious choice is to send a democratic expedition to Chile. Although there are many who would see this as gross violation of Chilean rights, everything the United States does is for the greater good.;;;;;;;;;;;;;x
EVTDESC7999997;Due to improvement of our steam engines consumption in our country has started growing. I’ve got a soul: don’t tell me I haven’t. Cut me up and you can’t find it. Cut up a steam engine and you can’t find the steam. But, by George, it makes the engine go.—George Bernard Shaw;;;;;;;;;;;;;x
EVTNAME7999997;Growing Consumption!;;;;;;;;;;;;;x
EVTDESC8001160;It seems our policy of allowing the newspapers to speak as they wish is now coming to haunt us. Recently, a prominent newspaper in one of our provinces has published a high-profile article criticising the $COUNTRY_ADJ$ monarchy. If we do nothing, this talk will spread. Yet our only other option is to restrict the freedom of the press entirely.;;;;;;;;;;;;;x
EVTNAME8001160;Newspaper Articles Criticize Monarchy;;;;;;;;;;;;;x
EVTDESC8003006;Final years of Allende’s presidency were marred by political scandals, mainly revolving around the allegations that Allende—surrounded by KGB advisors—had turned Chile into a centre for Soviet operations in Latin America. The nationalization of U.S. and other foreign-owned companies led to increased tensions with the United States. As a result, the Richard Nixon administration organized and inserted secret operatives and exercised economic pressure in Chile, in order to quickly destabilize Allende’s government. By 1972, the economic progress of Allende’s first year had been reversed, and the economy was in crisis.;;;;;;;;;;;;;x
EVTNAME8003006;Regime of Augusto Pinochet;;;;;;;;;;;;;x
EVTDESC8003008;In 1982-1983 Chile witnessed a severe economic crises with a surge in unemployment and a meltdown of the financial sector. 16 out of 50 financial institutions faced bankruptcy. In 1982 the two biggest banks were nationalized to prevent an even worse credit crunch. In 1983 another five banks were nationalized and two banks had to be put under government supervision. The central bank took over foreign debts. Critics ridiculed the economic policy of the Chicago Boys as ‘Chicago way to socialism’.;;;;;;;;;;;;;x
EVTNAME8003008;Pinochet economics;;;;;;;;;;;;;x
EVTDESC8003009;Chile’s constitution established that in 1988 there would be another plebiscite in which the voters would accept or reject a single candidate proposed by the Military Junta. Pinochet was, as expected, the candidate proposed, but historically was denied a second 8-year term by 54.5 percent of the vote.;;;;;;;;;;;;;x
EVTNAME8003009;Chilean transition to democracy;;;;;;;;;;;;;x
EVTDESC8006217;After Francisco Franco’s death, the road to democracy is open! We have a great opportunity to establish a constitutional government now.;;;;;;;;;;;;;x
EVTDESC8006218;The Royal decree demands to return to Constitutionalism.;;;;;;;;;;;;;x
EVTDESC8006219;The National Schism was a series of disagreements between King Constantine I and Prime Minister Eleftherios Venizelos regarding the foreign policy of Greece in the period of 1910-1922 of which the tipping point was whether Greece should enter World War I. Venizelos was in support of the Allies and wanted Greece to join the war on their side, while the pro-German King wanted Greece to remain neutral, which would favour the plans of the Central Powers.;;;;;;;;;;;;;x
EVTNAME8006219;The National Schism still exists.;;;;;;;;;;;;;x
EVTDESC8006220;On 2 October 1920, Alexander was injured while walking through the grounds of the Tatoi estate. A domestic Barbary macaque belonging to the steward of the palace’s grapevines attacked or was attacked by the king’s German Shepherd Dog, Fritz, and Alexander attempted to separate the two animals. As he did so, another monkey attacked Alexander and bit him deeply on the leg and torso. Eventually servants arrived and chased away the monkeys, and the king’s wounds were promptly cleaned and dressed but not cauterized. He did not consider the incident serious and asked that it not be publicized. That evening, his wounds became infected-he suffered a strong fever and sepsis set in. His doctors considered amputating his leg, but none wished to take responsibility for so drastic an act. On 19 October, he became delirious and called out for his mother, but the Greek government refused to allow her to re-enter the country from exile in Switzerland, despite her own protestations. Finally, the queen dowager, Olga, George I’s widow and Alexander’s grandmother, was allowed to return alone to Athens to tend to the king. She was delayed by rough waters, however, and by the time she arrived, Alexander had already died of sepsis twelve hours previously at a little after 4 p.m. on 25 October 1920.;;;;;;;;;;;;;x
EVTNAME8006220;The unexpected death of King Alexander;;;;;;;;;;;;;x
EVTDESC8006221;Prime Minister Eleftherios Venizelos announced elections, however, after the unexpected death of King Alexander, who had assumed the throne after the exile of his father, King Constantine I, the elections were postponed until 1 November.;;;;;;;;;;;;;x
EVTNAME8006221;Eleftherios Venizelos announced elections;;;;;;;;;;;;;x
EVTDESC8006222;Constantine returned as king. This caused great dissatisfaction not only to the newly liberated populations in Asia Minor, but also to the British and even more the French, who opposed the return of Constantine.;;;;;;;;;;;;;x
EVTNAME8006222;King Constantine I returned.;;;;;;;;;;;;;x
