CODE;ENGLISH;FRENCH;GERMAN;POLISH;SPANISH;ITALIAN;SWEDISH;CZECH;HUNGARIAN;DUTCH;PORTUGUESE;RUSSIAN;FINNISH;x
EVTDESC44132210;Our planning and funding have proven to be fruitful as a small slave revolt has erupted in $FROMCOUNTRY$. We should act quickly to intervene on behalf of New Africa in their fight for independence.;;;;;;;;;;;;;x
EVTDESC44132211;A small slave revolt has erupted in a province in the southern states. The insurgency is likely to spread to nearby plantations in neighbouring provinces, and we should act quickly to put down the uprising before it does too much damage to our economy. Furthermore, the Free States of America has officially recognized the burgeoning government formed by the rebellious slaves, and there exists the possibility that they might intervene.;;;;;;;;;;;;;x
EVTDESC44132212;Our planning and funding have proven to be fruitful as a massive slave revolt has erupted in $FROMCOUNTRY$. We should act quickly to intervene on behalf of New Africa in their fight for independence.;;;;;;;;;;;;;x
EVTDESC44132213;The slave revolt is quickly spreading from plantation to plantation. Soon, nearby provinces will join us in our fight for independence.;;;;;;;;;;;;;x
EVTDESC44132214;The recent slave revolt has spread to $PROVINCENAME$. There are reports of roaming bands of slaves setting plantations aflame and massacring entire communities.;;;;;;;;;;;;;x
EVTDESC44132215;We have received our supplies from the Free States of America. We will immediately begin distributing weapons and mobilizing our forces into a proper fighting force.;;;;;;;;;;;;;x
EVTDESC44132216;We have received our supplies from the Free States of America. We will immediately begin distributing weapons and mobilizing our forces into a proper fighting force.;;;;;;;;;;;;;x
EVTDESC44132217;We have received our supplies from the Free States of America. We will immediately begin distributing weapons and mobilizing our forces into a proper fighting force.;;;;;;;;;;;;;x
EVTDESC44132218;Several candidate cities would serve as suitable locations for the new capital of New Africa. Located in the along the Louisiana coast, New Orleans has long been the cultural capital of the country. Montgomery’s central location would make it an appropriate city for the capital to be seated, and its small size allows for some room to develop. Lastly, Atlanta is one of the largest cities in New Africa and is the economic heart of the country.;;;;;;;;;;;;;x
EVTDESC44132219;In 1831, Nat Turner led a slave rebellion in Virginia that was composed of more than 70 slaves and resulted in the death of 60 white people, including women and children. After Nat Turner was captured and the rebellion ended, over a hundred slaves were massacred in retaliation. For many in New Africa, Nat Turner represents the heroism and determination needed to fight such a brutal system like slavery. However, whites in the country perceive Nat Turner as a violent murderer. With the 100th Anniversary of the rebellion closely approaching, there is mounting pressure on the government on how to remember such a cataclysmic event and such a complicated man.;;;;;;;;;;;;;x
EVTDESC44132220;New Africa is currently experiencing a cultural renaissance emanating out of $CAPITAL$. Across the country, new works of literature are being published, new music genres are being defined, and new plays for the theatre are being written. Innovations are also occurring in the philosophical and academic fields leading to an explosion in fresh perspectives and new knowledge. Artists and intellectuals from across the world have taken notice of this reawakening of the New Africa spirit.;;;;;;;;;;;;;x
EVTDESC44132223;Soon after its establishment, the New African government founded the National Underground Railroad Institute. While its official public function is to assist with the settlement of escaped slaves into New Africa, the Institute, as suggested by its less than subtle name, secretly works with abolitionists to help slaves escape bondage from the American South and flee to New Africa. There are also rumours that the Institute funds and organizes slave revolts;however, the Institute denies such accusations.;;;;;;;;;;;;x
EVTDESC44132224;With slavery no longer the menace it once was, The National Underground Railroad Institute no longer has a purpose and as such as has been officially closed. The headquarters of the Institute will be converted into a museum so future generations may learn of the courageous actions Institute conductors undertook in the name of liberty.;;;;;;;;;;;;;x
EVTDESC44132225;New Africa is a nation of free people who once endured systematic violence and forced servitude. Now that the racial hierarchy of power has inverted, those that once sat at the top are resentful of their current low standing. As such, racial tensions are high in provinces that lack a black majority.;;;;;;;;;;;;;x
EVTDESC44132226;Due to the lack of a black majority, $PROVINCENAME$ is experiencing significant racial tensions that will only subside as more African Americans and other accepted cultures settle in the area. This unrest will most likely spread throughout White majority provinces.;;;;;;;;;;;;;x
EVTDESC44132227;As racial demographics shift in $PROVINCENAME$, once notable and disruptive racial tensions have faded into the background. Other provinces that have experienced similar population changes should also calm down.;;;;;;;;;;;;;x
EVTDESC44132228;A man of both African and Indian heritage, John Horse fought alongside Seminole tribes against the United States Army during the Second Seminole War. He garnered a reputation as a skilled scout and talented negotiator, and Horse soon became a prominent leader among the Seminole people. After New Africa passed the Seminole Act, which integrated Indian tribes in Florida, John Horse offered his service and expertise to the army of New Africa.;;;;;;;;;;;;;x
EVTDESC44132229;In $YEAR$ onboard the brig Creole, Madison Washington, an enslaved cook, led his fellow slaves in a revolt against their captors who were transporting them to an American slave market. After killing the ship’s captain, they seized control of the vessel. Although they were initially planning to sail for Nassau, they have instead arrived at a New African port. The most apparent course of action is to welcome Washington and the other slaves as heroes. However, doing so will undoubtedly enrage the United States, which would accuse New Africa of harbouring criminals.;;;;;;;;;;;;;x
EVTDESC44132230;Uncle Remus: His Songs and His Sayings is a collection of African American folktales that author Joel Chandler Harris recalled from his childhood on his family’s plantation in Georgia. Although New Africa has since liberated Georgia, many Southern whites, like Harris, still hold on dearly to their memories during the time of slavery, and as such, Harris’s book has quickly become a best-seller and favourite among the white community in New Africa. However, the character of Uncle Remus has received a very mixed reaction from black New Africans. While it is impossible to ignore the rich collection of folklore Harris has been able to compile, there are many, especially among the intellectual class, who are critical of what they believe to be a romanticizing of slavery and accuse Harris of cultural theft. The New African government can either curtail the distribution of Harris’s work or allow it circulate openly.;;;;;;;;;;;;;x
EVTDESC44132231;Born into bondage in 1818, Fredrick Douglass escaped slavery at a young age and fled from Maryland to New Africa. He has quickly gained notoriety for his skill as an orator and controversy for his staunch support of racial and gender equality. While most in New Africa view him as the country’s most important statesman, few entirely embrace his radical proposal for the greater social and political integration of whites in New Africa. However, his most recent publication, A Narrative of New Africa, has enticed many New Africans into his Equality Party and led to an increased acceptance of the notion for greater equality among the races.;;;;;;;;;;;;;x
EVTDESC44132232;The legend of John Henry is the tale of one man with raw strength and incredible endurance beating a steam-powered machine in a competition to drill a tunnel through a mountain. Although where precisely this competition occurred and whether if such a man even existed is debatable, there is no denying that John Henry has become an inspiring symbol of the industrial New African man. Additionally, his hammer-wielding image has become closely associated with socialist parties and trade unions, especially those composed of railway workers.;;;;;;;;;;;;;x
EVTDESC44132233;Prominent academic and founder of the Tuskegee Institute Booker T. Washington has always been known as a moderate voice in New African politics, and he frequently opposes war waged at the expense of various domestic reforms, especially those related to education. Washington recently gave a speech to a large crowd in $CAPITAL$. In the speech, he called for the development of greater respect and the reduction of tensions between whites and blacks in New Africa. Furthermore, Washington argued for better relations between New Africa and the United States and proposed a compromise in which New Africa would cease territorial expansion into the American South in return for an increase in trade and protection from the United States.;;;;;;;;;;;;;x
EVTDESC44132234;Before beginning to plan, we must decide how much money and supplies to devote to the revolt. The more funds we commit, the more likely of a large revolt erupting. If we only invest a small amount, then there is a lower chance of a successful revolt.;;;;;;;;;;;;;x
EVTDESC44132235;Now that slavery has been abolished in the Confederacy, it is unnecessary for us to plan and organize a slave revolt.;;;;;;;;;;;;;x
EVTDESC44132236;Now that slavery has been abolished in the United States, it is unnecessary for us to plan and organize a slave revolt.;;;;;;;;;;;;;x
EVTDESC44132237;We have discovered a conspiracy to organize a slave revolt in the South. After intense interrogation, those involved in the conspiracy admitted that the Free States of America is behind the funding of the plot. While we have stopped the revolt from occurring, tensions are at an all-time high across the country.;;;;;;;;;;;;;x
EVTDESC44132238;$FROMCOUNTRY$ has discovered our plot to organize a slave revolt in its country. They may go to war with us over this, and the entire situation is proving to be quite the diplomatic disaster.;;;;;;;;;;;;;x
EVTDESC46610100;Ever since our declaration of independence, our borders with the neighbouring Brazilians have not been delineated through any treaty. The resident minister of Brazil in $COUNTRY$, Enéas Martins, is on a special mission in $CAPITAL$, to meet with the Minister of Foreign Affairs, Alfredo Vásquez Cobo, to delineate a treaty to settle the border issue. The treaty would establish the border from the Rio Negro north-westward along the Amazon River-Orinoco watershed divide, then generally southward along various river courses and straight-line segments to the mouth of the Apaporis River. This would effectively mean the Marabitanas province will end up part of Brazil, though signing the treaty can positively affect our image internationally.;;;;;;;;;;;;;x
EVTNAME46610100;The García Ortiz-Mangabeira Treaty;;;;;;;;;;;;;x
EVTOPTA46610100;Let this be a sign of friendship and cooperation between our countries.;;;;;;;;;;;;;x
EVTOPTB46610100;We will never cede an inch of $COUNTRY_ADJ$ territory.;;;;;;;;;;;;;x
EVTDESC46610101;The $FROMCOUNTRY_ADJ$ government is holding talks in the Brazilian city of Petrópolis to end tensions over the territory known as Acre. Claimed by multiple countries and without a clear border demarcation, several incursions of foreigners from neighbouring countries searching for rubber sparked a few incidents and the de facto owner of the territory, $COUNTRY$, is now offering us monetary compensation, a friendship treaty as well as the possibility of funding a railway construction in our country in exchange for us dropping any claims we have over the area.;;;;;;;;;;;;;x
EVTNAME46610101;The Treaty of Petrópolis;;;;;;;;;;;;;x
EVTOPTA46610101;Sounds like a good deal, we agree.;;;;;;;;;;;;;x
EVTOPTB46610101;No, Acre is a rightful part of $COUNTRY$.;;;;;;;;;;;;;x
EVTDESC146610102;When Bolivia became independent from Spain on 1825, it took possession of the territories that corresponded to its colonial administration in accordance with the uti possidetis juris of 1810. Bolivia claimed the maritime territory westward from the Andes to the Pacific Ocean between the Rio Salado on the south and the Rio Loa on the north, which included part of the Atacama Desert. Later in the mid-19th century, Chile made claims to the desert area following the discovery and exploitation of nitrate deposits and the move en masse of its population to work in the new found richness in Antofagasta. Because of that, the following decades were witness to much bloodshed on the borders of Bolivia, Peru and Chile. $FROMCOUNTRY$ has put a proposal, with international approval, to solve this problem amicably and set terms for new borders, paying indemnities for all involved. Regional powers set their eyes on us, expecting our reaction and the consequences for the future of the region of Antofagasta.;;;;;;;;;;;;;x
EVTDESC746610102;By 1895 $COUNTRY$ had had a dispute with a neighbour about the territory of Guayana Esequiba for over half a century. The territorial claims were originally those of the Spanish Empire (inherited by $COUNTRY$ after its independence in 1830) and of the Dutch Empire (with the acquisition of the Dutch territories of Essequibo, Demerara and Berbice in 1814), having remained unsettled over previous centuries. The basis of the dispute is the advocacy of a particular division of the territory deriving from a mid-nineteenth-century survey commissioned by the country that owns Guyana. This division is known as the ‘Schomburgk Line ‘, after the German naturalist who surveyed the territory. In October 1886 they declared the Line to be the provisional frontier of Guiana with $COUNTRY$, and in February 1887 $COUNTRY$ severed diplomatic relations. The discovery of gold in El Callao in $COUNTRY$ heated up the dispute, with several foreigners crossing the frontier to find gold. The situation changed after we obtained the services of William L. Scruggs, former US Ambassador to Colombia and Venezuela. We can use him as a lobbyist to try and get the US to intervene on our behalf in this dispute and put the disputer for international arbitration.;;;;;;;;;;;;;x
EVTDESC46610102;In the aftermath of the War of the Pacific, Peru was defeated and forced to sign the Treaty of Ancón. In this Treaty, Tarapacá was annexed to Chile. However, the fate of both Tacna and Arica was to be decided by a plebiscite to be held in 1893. Due to different points of view, both countries were not able to agree on the conditions of this plebiscite and so it was not held. Chile began then to colonize the two territories and Peru answered with a break of diplomatic relations. In $YEAR$, Chile and Peru agreed to arbitrate the dispute with the $MONARCHTITLE$ of $COUNTRY$. The commission on the issue of who Tacna belongs to was formed and now the only thing that remains is their final decision.;;;;;;;;;;;;;x
EVTNAME146610102;The $YEAR$ Treaty of $CAPITAL$;;;;;;;;;;;;;x
EVTNAME746610102;The $COUNTRY_ADJ$ Crisis of $YEAR$;;;;;;;;;;;;;x
EVTNAME46610102;The Tacna-Arica Arbitration;;;;;;;;;;;;;x
EVTOPTA146610102;We agree. Let’s put our differences behind.;;;;;;;;;;;;;x
EVTOPTA746610102;Remind the Americans of the Monroe Doctrine.;;;;;;;;;;;;;x
EVTOPTA46610102;Tacna belongs to Peru.;;;;;;;;;;;;;x
EVTOPTB146610102;We will never negotiate with these thieves.;;;;;;;;;;;;;x
EVTOPTB746610102;We can settle this peacefully.;;;;;;;;;;;;;x
EVTOPTB46610102;Tacna belongs to Chile.;;;;;;;;;;;;;x
EVTDESC46610103;In the aftermath of the War of the Pacific, Peru was defeated and forced to sign the Treaty of Ancón. In this Treaty, Tarapacá was annexed to Chile. However, the fate of both Tacna and Arica was to be decided by a plebiscite to be held in 1893. Due to different points of view, both countries were not able to agree on the conditions of this plebiscite and so it was not held. Chile began then to colonize the two territories and Peru answered with a break of diplomatic relations. In $YEAR$, Chile and Peru agreed to arbitrate the dispute with the $MONARCHTITLE$ of $COUNTRY$. The commission on the issue of who Tacna belongs to was formed and now the only thing that remains is their final decision.;;;;;;;;;;;;;x
EVTNAME46610103;The Tacna-Arica Arbitration;;;;;;;;;;;;;x
EVTOPTA46610103;Tacna belongs to Peru.;;;;;;;;;;;;;x
EVTOPTB46610103;Tacna belongs to Chile.;;;;;;;;;;;;;x
EVTDESC60055557;One of the main reasons that led to the Kraków Uprising spreading to our polish lands is the serfdom question. Modern nations already abolished this medieval institution that persists in our country, and many in our country advise that it’s now the time to modernize $COUNTRY$, and the first step is the abolition of serfdom. The question remains, however, to who belongs the lands the serfs worked on. The aristocracy claims the land is theirs and the serfs should find their own lands, while the serfs argue that the land is theirs by the right of use.;;;;;;;;;;;;;x
EVTNAME60055557;The Serfdom Question;;;;;;;;;;;;;x
EVTOPTA60055557;Give the lands to the freed serfs.;;;;;;;;;;;;;x
EVTOPTB60055557;The land belongs to the aristocracy.;;;;;;;;;;;;;x
EVTOPTC60055557;Distribute the lands to the serfs, but pay a compensation to the nobility.;;;;;;;;;;;;;x
EVTOPTD60055557;This is not the time to abolish serfdom.;;;;;;;;;;;;;x
EVTDESC60055558;The Austro-Hungarian Compromise brought other consequences regarding to the legal status of the sovereignty of the Crown of St. Stephen over other crown lands. An agreement was reached between the Parliament of Hungary on the one hand and the Parliament of Croatia on the other hand, with regard to composing by a joint enactment the constitutional questions at issue between them. Following the Settlement, the Croatian kingdom was referred to using the name Kingdom of Croatia-Slavonia and article 66 of the settlement specified lands of the Kingdom of Croatia-Slavonia, including Dalmatia in the list.;;;;;;;;;;;;;x
EVTNAME60055558;The Croatian-Hungarian Settlement;;;;;;;;;;;;;x
EVTOPTA60055558;At least this issue is settled.;;;;;;;;;;;;;x
EVTDESC60055559;Diplomats of $FROMCOUNTRY$ approached us with a friendship and border treaty to settle outstanding issues between the perceived territory of our two countries. The treaty would include population exchanges, border delimitation and a treaty of friendship. If we sign this deal it will also show the world our will to settle issues diplomatically and our government respect of the will of the people.;;;;;;;;;;;;;x
EVTNAME60055559;The $COUNTRY_ADJ$—$FROMCOUNTRY_ADJ$ Border Treaty;;;;;;;;;;;;;x
EVTOPTA60055559;This sounds like a good idea.;;;;;;;;;;;;;x
EVTOPTB60055559;No deal.;;;;;;;;;;;;;x
EVTDESC60168004;Bullets whistled as the morning came in $PROVINCENAME$. Enemy soldiers engaged our troops in the roads, their drums roaring in the distance. Our local fort was spearheading the defence, soldiers taking turns crouching to reload and standing up to fire at the enemies. A group of enemy saboteurs snuck in one of the fort walls and managed to blew it up with explosives, severely damaging the fort’s structure.;;;;;;;;;;;;;x
EVTNAME60168004;$PROVINCENAME$ Fort Damaged;;;;;;;;;;;;;x
EVTOPTA60168004;We shall rebuild.;;;;;;;;;;;;;x
EVTDESC60168005;A locomotive hurriedly passed by the $PROVINCENAME$ railroad during dusk while human silhouettes snuck out of the railroad. They hit the wooden keys used to hold the rails in chairs with a hammer, diverting the train to a more sinuous track while forward other figures moved objects in the rail. The train was wrecked by putting objects on the high rail at a curve, and contained tons of supplies for our troops fighting in the province. Later that night, one of our railroad bridges in $PROVINCENAME$ was burned to the ground, with no culprits found. These actions are believed to be the work of the enemy and severely crippled our railroad network.;;;;;;;;;;;;;x
EVTNAME60168005;Sabotage in $PROVINCENAME$;;;;;;;;;;;;;x
EVTOPTA60168005;A minor setback.;;;;;;;;;;;;;x
EVTDESC60168006;Reports came in today that street lights and lines in $PROVINCENAME$ have been badly damaged during the skirmishes that happened with enemy troops. Lines and poles have been hit by artillery fire, damaged by bullets or had the supply purposely cut, the poles dug and knocked down in an attempt to turn the fight in their favour and hide their position.;;;;;;;;;;;;;x
EVTNAME60168006;$PROVINCENAME$ Goes Dark;;;;;;;;;;;;;x
EVTOPTA60168006;Define a rebuilding plan.;;;;;;;;;;;;;x
EVTDESC65000000;An envoy of the Ottoman Sublime Porte arrived in $CAPITAL$ today with the Turkish demands to repel the Sretenje or Candlemas constitution, drafted in 1835 but never de facto adopted, and the draft of a new constitution, moulded within the whims and wishes of the Ottoman Empire. This new constitution, dubbed ‘The Turkish Constitution’, would repel civil liberties and has the backing of Serbia’s guarantor, Russia, and of Austria. Bowing to the Sublime Porte wishes means the abdication of the current Serbian Prince, currently under pressure to implement the 1835 constitution, and the confirmation of Turkish sovereignty over Serbia. Defying their commands might spell a difficult war.;;;;;;;;;;;;;x
EVTDESC71429731;$FROMCOUNTRY_ADJ$ Red Guards have seized the city of Monaco and unleashed a terrifying storm of red terror upon the local populace. Looting and violence occurred across Monaco with the bulk of the communist rage being directed towards the Monte Carlo district, home of the famed Monte Carlo Casino. It is unlikely that the grandeur of Monaco will return anytime soon. $FROMCOUNTRY$ has refused to apologize for the actions of its army.;;;;;;;;;;;;;x
EVTDESC71429732;The region of Transylvania is intensely disputed between Hungary and Romania. With our influence over both countries, we could attempt to propose a treaty that could help solve, or at least ease, the tensions resulting from the dispute.;;;;;;;;;;;;;x
EVTDESC71429733;We could attempt to solve the Transylvania troubles in several ways. Hungary has been the traditional owner of the land, and as such, we could reassert Hungarian claims to the region. However, Romanians are the majority population of much of Transylvania, and therefore, we could support Romanian self-determination. It is unlikely either of these proposals would be warmly welcomed by the losing party. Therefore, we could also suggest a partitioning of Transylvania.;;;;;;;;;;;;;x
EVTDESC71429734;$FROMCOUNTRY$ is attempting to draft a substantive border treaty that will resolve the territorial disputes over Transylvania. We are still waiting to see in what direction they will take the treaty and who it will favour.;;;;;;;;;;;;;x
EVTDESC71429735;$FROMCOUNTRY$ has declared its support for Hungarian claims in Transylvania and has pressured Romania to withdraw its control and claim on any land in the region.;;;;;;;;;;;;;x
EVTDESC71429736;$FROMCOUNTRY$ has declared its support for Hungarian claims in Transylvania and has pressured Romania to withdraw its control and claim on any land in the region.;;;;;;;;;;;;;x
EVTDESC71429737;$FROMCOUNTRY$ has declared its support for Romanian claims in Transylvania and has pressured Hungary to withdraw its control and claim on any land in the region.;;;;;;;;;;;;;x
EVTDESC71429738;$FROMCOUNTRY$ has declared its support for Romanian claims in Transylvania and has pressured Hungary to withdraw its control and claim on any land in the region.;;;;;;;;;;;;;x
EVTDESC71429739;In an attempt to solve the territorial disputes in Transylvania, $FROMCOUNTRY$ has proposed that the region be partitioned between Romania and Hungary.;;;;;;;;;;;;;x
EVTDESC71429741;In response to our support for Hungarian claims, Romania has withdrawn from the negotiations and is refusing to acknowledge the authority of any treaty on the governance of Transylvania.;;;;;;;;;;;;;x
EVTDESC71429742;In response to the treaty’s support for Hungarian claims, Romania has withdrawn from the negotiations and is refusing to acknowledge the authority of any treaty on the governance of Transylvania.;;;;;;;;;;;;;x
EVTDESC71429743;In response to our support for Hungarian claims, Romania has agreed to support the treaty in exchange for substantial monetary compensation.;;;;;;;;;;;;;x
EVTDESC71429745;Today the Transylvania Treaty has been signed by the $COUNTRY_ADJ$, the Romanian, and the Hungarian governments. The treaty asserts Hungarian authority over Transylvania and dismisses Romanian claims to the region.;;;;;;;;;;;;;x
EVTDESC71429746;Today the Transylvania Treaty has been signed by the Romanian and the Hungarian governments. The treaty asserts Hungarian authority over Transylvania and dismisses Romanian claims to the region.;;;;;;;;;;;;;x
EVTDESC71429747;$FROMCOUNTRY$ has accepted our demand for monetary compensation as a condition for our signing of the treaty.;;;;;;;;;;;;;x
EVTDESC71429748;$FROMCOUNTRY$ has refused to provide Romania with monetary compensation and expects Romania to sign the treaty regardless.;;;;;;;;;;;;;x
EVTDESC81002212;We have been pulled into an outside war, despite our dedication to neutrality.;;;;;;;;;;;;;x
EVTNAME81002212;$COUNTRY_ADJ$ Neutrality;;;;;;;;;;;;;x
EVTOPTA81002212;We must remain Neutral!;;;;;;;;;;;;;x
EVTOPTB81002212;We must discard our Neutrality.;;;;;;;;;;;;;x
