CODE;ENGLISH;FRENCH;GERMAN;POLISH;SPANISH;ITALIAN;SWEDISH;CZECH;HUNGARIAN;DUTCH;PORTUGUESE;RUSSIAN;FINNISH;x
EVTDESC3036215;A corporation was founded in 1891 by 11 breweries in Copenhagen. In 1894 it merged with Tuborg and began a close cooperation with Carlsberg in 1903, forming a very strong and large brewing industry in Denmark. United Breweries and Carlsberg merged in 1969.;Une corporation a été fondée en 1891 avec 11 brasseries de Copenhague. En 1894, elle a fusionné avec Tuborg et a entamé une étroite collaboration avec Carlsberg en 1903, formant une industrie brassicole forte et vaste au Danemark. Brasseries unifiées et Carlsberg ont fusionné en 1969.;1891 wurde in Kopenhagen eine Gesellschaft gegründet, in der sich 11 Brauereien vereinigten. 1894 wurde Tuborg aufgenommen, 1903 begann die Gesellschaft eine enge Zusammenarbeit mit Carlsberg und schuf dadurch eine äußerst starke und große dänische Brauerei-Industrie. 1969 schließlich verbanden sich die Brauereivereinigung United Breweries und Carlsberg.;;;;;;;;;;;x
EVTNAME3036215;United Breweries;Brasseries unifiées;Brauereivereinigung;;;;;;;;;;;x
EVTOPTA3036215;Mm mm… beer!;Mmmm… la bière !;Mmmh … Bier!;;;;;;;;;;;x
EVTDESC3038506;Oman has been lost to us for years, at this point we have no choice but to renounce our claim to the title.;;;;;;;;;;;;;x
EVTNAME3038506;The Loss of Oman;;;;;;;;;;;;;x
EVTDESC3132540;Persia lost sovereignty over the Azeri Khanates to Russia by the Treaty of Gulistan in 1813. In 1826, encouraged by British advisors, a belligerent faction in the Persian government unilaterally arrested the Russian ambassador and announced its intent to fight for control of the Khanates of the Caucasus, beginning a new Russo-Persian War.;;;;;;;;;;;;;x
EVTNAME3132540;A new Russo-Persian War;;;;;;;;;;;;;x
EVTDESC3132541;With the defeat of Persia’s armies in the Caucasus, Russia forced a humiliating peace upon the Shah. Persia conceded control of all of its Caucasian lands to Russia, as well as formally renouncing its claims to Armenia and Azerbaijan.;;;;;;;;;;;;;x
EVTNAME3132541;The Treaty of Turkmenchay;;;;;;;;;;;;;x
EVTDESC3132542;We have wrested the Azeri khanates from Russia’s control and can re-establish Persian rule in the southern Caucasus. This is a proud day for Persia!;;;;;;;;;;;;;x
EVTNAME3132542;Victory over Russia;;;;;;;;;;;;;x
EVTDESC3132545;The Kurds, an Iranian people living in our north-western provinces, have long been a part of mainstream Persian society. In recent years, however, Persia’s declining influence and prestige relative to our neighbours has led some Kurds to consider whether they might be better off seeking an independent state for themselves. This nascent Kurdish nationalist movement is not yet a serious threat to the integrity of our state, but it appears that the Kurds increasingly view themselves (and are viewed by others) as a separate nation under Persian rule.;;;;;;;;;;;;;x
EVTNAME3132545;Kurdish Nationalism;;;;;;;;;;;;;x
EVTDESC3136990;The vast territories of Australia promise to form the foundation of a mighty Pacific empire for Britain. We must solidify our hold on this continent before another power can challenge us.;;;;;;;;;;;;;x
EVTNAME3136990;Claiming Australia;;;;;;;;;;;;;x
EVTDESC3136995;British fur traders with the Hudson Bay Company have worked in these lands for a century. We should extend our political control into the west, before our neighbours beat us to it.;;;;;;;;;;;;;x
EVTNAME3136995;Claiming Rupert’s Land;;;;;;;;;;;;;x
EVTDESC3137240;In 1824 King Louis XVIII died without child, and his brother Charles inherited the French crown as Charles X. Charles was an outspoken absolutist, and he soon made clear that he expected Parliament to rubber-stamp his dictates and keep its opinions to itself. He quickly rolled back freedom of religion, restoring the pre-eminence of the Catholic Church, and ordered a massive indemnity paid to nobility displaced by the Revolution.\n Meaningful political debate was curtailed, and liberals throughout France grumbled that the constitution was being undermined.;;;;;;;;;;;;;x
EVTNAME3137240;The Accession of Charles X;;;;;;;;;;;;;x
EVTDESC3137242;In the 1830 session of parliament a bill was introduced demanding that the government ministers be chosen by parliament, rather than the king’s whim. King Charles in turn pronounced the chamber dissolved and declared a state of emergency, followed by new decrees censoring the press and altering the electoral system to ensure parliament’s loyalty.\n Liberal newspapers cried that the legal government had been undone and the regime no longer deserved the people’s obedience. Unrest boiled in the cities.;;;;;;;;;;;;;x
EVTNAME3137242;The Constitution Suspended;;;;;;;;;;;;;x
EVTDESC3144122;Apparently possessing no shame of any kind, the American government has approached us about purchasing a strip of desert in our northwest to facilitate rail links between Alto California and the Atlantic coast. In fact, they are willing to offer a considerably larger sum if we agree to concede Baja California, as well.\n We could use the money, and the empty deserts of Sonora are of little tangible value to us. If our pride doesn’t forbid it, making this sale would go some way toward restoring good relations between our nations.;;;;;;;;;;;;;x
EVTNAME3144122;A Northern Purchase?;;;;;;;;;;;;;x
EVTDESC3144123;Recognizing the inevitability of our expansion, the Mexican government has agreed to concede a piece of the Sonora desert, along with all of Lower California. This will considerably simplify travel between California and the Southeast. From sea to shining sea, indeed!;;;;;;;;;;;;;x
EVTNAME3144123;Lower California;;;;;;;;;;;;;x
EVTDESC3144124;Recognizing the inevitability of our expansion, the Mexican government has agreed to concede a piece of the Sonora desert. This will considerably simplify travel between California and the Southeast.;;;;;;;;;;;;;x
EVTNAME3144124;The Gadsden Strip;;;;;;;;;;;;;x
EVTDESC3144125;Refusing to recognize the inevitability of our expansion, the Mexican government has refused to part with the otherwise worthless desert we so reasonably offered to purchase. Other methods may have to be considered…;;;;;;;;;;;;;x
EVTNAME3144125;An Offer Rebuffed;;;;;;;;;;;;;x
EVTDESC3146305;The deep Amazonian jungle is not yet firmly controlled by any civilized power. Brazil should make an effort to stake a claim to this land before our neighbours do.;;;;;;;;;;;;;x
EVTNAME3146305;Claiming the Jungle;;;;;;;;;;;;;x
EVTDESC3146306;Escaped slaves in this province have formed Quilombos, settlements of ex-slaves in hard-to-reach places. It might be some time before we can root them out.;;;;;;;;;;;;;x
EVTNAME3146306;Escaped Slaves;;;;;;;;;;;;;x
EVTDESC3149510;Now that Schleswig-Holstein has become a $COUNTRY_ADJ$ dependency, we must decide what place the two duchies have in $COUNTRY$. At the least we should welcome our brother Danes in Schleswig into the nation, and we could plausibly extend our claims all the way to Lauenburg. Whatever we do will upset our German neighbours, but any attempt to integrate Holstein would virtually guarantee war, since Holstein is legally a member of the German Confederation.;;;;;;;;;;;;;x
EVTNAME3149510;The Schleswig-Holstein Question;;;;;;;;;;;;;x
EVTDESC3237227;Abd al-Qadir is the preeminent Algerian warlord and de facto leader of Algeria. From his strongholds and hideouts in Algeria and Morocco, al-Qadir has launched another harassing raid into French Algeria!;;;;;;;;;;;;;x
EVTNAME3237227;Abd al-Qadir launches Raid!;;;;;;;;;;;;;x
EVTOPTA3237227;Annoying!;;;;;;;;;;;;;x
EVTDESC3290037;The Senussites are a Muslim order emphasizing ijtihad-independent reasoning-over dogmatism, and simplicity and hard work over splendour and dependence. Founded earlier this century by a man called Muhammad ibn Ali as-Senussi as a reaction to the decline of the Islamic thought, spirituality and political strength. The movement, while popular, has been strongly opposed by orthodox ulama, which, over the years, has caused them to relocate numerous times. Now they settled deep in the Libyan desert where, away from $COUNTRY_ADJ$, they can pursue an independent existence.;;;;;;;;;;;;;x
EVTNAME3290037;The Rise of the Senussi;;;;;;;;;;;;;x
EVTDESC3297553;With rebels rampant in the south, it has become next to impossible for the government to maintain order in El Salvador. Government authorities have withdrawn as locals have overtaken the capital in San Salvador.;;;;;;;;;;;;;x
EVTNAME3297553;El Salvador Declares Independence;;;;;;;;;;;;;x
EVTDESC3297554;With rebels rampant in the south, it has become next to impossible for the government to maintain order in Honduras. Government authorities have withdrawn as locals have overtaken the capital in Comayagua.;;;;;;;;;;;;;x
EVTNAME3297554;Honduras Declares Independence;;;;;;;;;;;;;x
EVTDESC3297555;With rebels rampant in the south, it has become next to impossible for the government to maintain order in Panama. Government authorities have withdrawn as locals have overtaken the capital in Panama City.;;;;;;;;;;;;;x
EVTNAME3297555;Panama Declares Independence;;;;;;;;;;;;;x
EVTDESC3297570;Once again, conflict with the native Xhosa has flared into violence in our Cape Colony. A band of Xhosa warriors spilled across the border, stealing cattle and burning down a host of British farmsteads. Colonial citizens are demanding that the governor take action.;;;;;;;;;;;;;x
EVTNAME3297570;Conflict with the Xhosa;;;;;;;;;;;;;x
EVTDESC3403075;Relations between the United States and South America continue to sour. When the South Americans strengthened control over Central America, capitalist across the nation were outraged when their companies were expelled from the region. Mexico seems to be next on South America’s list and politicians in Mexico City have petitioned us for assistance.;;;;;;;;;;;;;x
EVTDESC3498620;With the Ottoman government having indicated its willingness to provide reforms, an intellectual class known as the Young Ottomans has arisen-men influenced by the ideals of the French Revolution who are advocating the assumption of secular rather than religious laws as well as the provision of rights to ethnic minorities. This, they say, will help stem the tide of decay in the Empire. Most recently they have suggested embracing the Empire’s Bulgarian minorities, maintaining that such a gesture would indicate a willingness to embrace European values. Mashriqi citizens have gotten wind of this, demanding that they as Muslims should receive preferential treatment. Reactionary officials have agreed, suggesting a move towards accepting the Empire’s role as an Islamic power rather than away from it.;;;;;;;;;;;;;x
EVTNAME3498620;The Young Ottomans;;;;;;;;;;;;;x
EVTDESC3550003;On March 6, 1845, the people of Guayaquil, Ecuador, revolted against the government of the General Juan José Flores under the leadership of General António Elizalde and Lieutenant-Colonel Fernándo Ayarza. Flores surrendered on his plantation, La Elvira, near Babahoyo and accepted a negotiation-which had terms including his leaving power and the declaration of all his decrees, laws, and acts as void and null, ending fifteen years of foreign domination in Ecuador. Flores received 20,000 pesos for his property and immediately left the country for Spain. The country was then governed by the triumvirate composed of José Joaquín de Olmedo, Vicente Ramón Roca and Diego Noboa.;;;;;;;;;;;;;x
EVTNAME3550003;The Marxist Revolution;;;;;;;;;;;;;x
EVTDESC3552310;Although Panama is technically under the jurisdiction of the Colombians, there are many on the isthmus who would rather join the Federal Republic in Central America. The United States is in a position to peacefully resolve the issue to prevent conflict from erupting and settle for good who rules Panama. Panama can either join the FRCA, stay under the control of Gran Colombia, or perhaps dividing the isthmus between the two is a suitable compromise.;;;;;;;;;;;;;x
EVTDESC3591929;At the turn of the 19th century, Simon Bolivar dreamed of a united Latin America that could defend itself against invasion and exploitation by the United States, European powers, or any force that would threaten the freedom of South America. Now, after a constant struggle from enemies both foreign and national, South America stands triumphant. The master of its own destiny and guardian of other Latin American people. The future looks bright for the New World in this new age of fraternity and liberty.;;;;;;;;;;;;;x
EVTDESC3697000;During the rebuilding of the Palace of Westminster in the wake of the fire of 1834, the parliament determined that the new buildings should incorporate an impressive clock tower and passed a bill to that end in $YEAR$. This clock tower will take years to be built but it will be a massive accomplishment for our country. The only thing left for the building to start is to define the budget.;;;;;;;;;;;;;x
EVTNAME3697000;The Construction of the Clock Tower;;;;;;;;;;;;;x
EVTDESC3697001;The completion of the Clock Tower marks the end of the reconstruction of the Palace of Westminster. The clock tower was constructed on the northern extremity of the new Houses of Parliament that were built next to Westminster Hall. The commission for the clock itself demanded a high level of accuracy, the specifications drafted by the Royal Astronomer required that ‘the first stroke of the hour bell should register the time, correct to within one second per day, and furthermore that it should telegraph its performance twice a day to Greenwich Observatory, where a record would be kept.’ The second and final version of the hour bell was the largest ever cast in the UK. It was so colossal that a team of 16 horses was needed to pull the wagon upon which it rested from the foundry to the Tower. The transportation took on the character of a parade, with enthusiastic crowds lining the streets as the caravan made its way through London. The bell and tower got nicknamed ‘Big Ben’.;;;;;;;;;;;;;x
EVTNAME3697001;The Clock Tower Is Finished;;;;;;;;;;;;;x
EVTOPTA3697001;A proud day for the $COUNTRY_ADJ$.;;;;;;;;;;;;;x
EVTDESC3697002;The Germans have been making more and more frequent expeditions to west Africa near Cape Colony. Each passing day, they found cities and name places. If we are to forestall German ambitions in the region and to ensure safe passage of British ships around the Cape, we need to secure Ezorongondo.;;;;;;;;;;;;;x
EVTNAME3697002;German Ambitions in Africa;;;;;;;;;;;;;x
EVTOPTA3697002;It’s for the best.;;;;;;;;;;;;;x
EVTOPTA3697003;We need to protect our interests.;;;;;;;;;;;;;x
EVTDESC3697005;With other nations bordering the territory we claim in Canada, the safer course is to control the empty bordering provinces so we can be sure the territorial integrity of Canada will not be violated.;;;;;;;;;;;;;x
EVTNAME3697005;The Canadian Border;;;;;;;;;;;;;x
EVTDESC3697006;The Pioneer Column was a force raised by Cecil Rhodes and his British South Africa Company in $YEAR$ and used in his efforts to annex the territory of Mashonaland. Rhodes was anxious to secure Matabeleland and Mashonaland before the Germans, Portuguese or Boers did. His first step was to persuade the Matabele King Lobengula to sign a treaty giving him rights to mining and administration (but not settlement as such) in the area of Mashonaland which was ruled by the King by use of coercion and murderous raids involved tribute-taking and abduction of young men and women. Using his Concession between Rhodes’ British South Africa Company and Lobengula, he then sought and obtained a charter from the British government allowing him to act. The column crossed the river Tuli into Matabeleland and halted at a naturally flat and marshy meadow bounded by a steep rocky hill, raising the British union flag.;;;;;;;;;;;;;x
EVTNAME3697006;The Pioneer Column;;;;;;;;;;;;;x
EVTOPTA3697006;For $COUNTRY$!;;;;;;;;;;;;;x
EVTOPTB3697006;To our pioneers!;;;;;;;;;;;;;x
EVTDESC3697007;The Americans lost Columbia to us and with the approval of home rule to the Canadians, the issue has been raised about its status. Canadians are pushing for it to be annexed to their territory, as a part of Columbia it is also a part of Canada.;;;;;;;;;;;;;x
EVTNAME3697007;British Columbia;;;;;;;;;;;;;x
EVTOPTA3697007;So be it.;;;;;;;;;;;;;x
EVTOPTB3697007;We have other plans for it.;;;;;;;;;;;;;x
EVTDESC3697008;Now that we have a firm grasp on Alaska and with the approval of home rule to the Canadians, the issue has been raised about Alaska’s status. Canadians are pushing for it to be annex to their territory, as holding these territories so far away from the British Isles would only result in inefficiency in administration.;;;;;;;;;;;;;x
EVTNAME3697008;British Alaska;;;;;;;;;;;;;x
EVTDESC3697009;A wealthy Maharajah, Gulab Singh, reputed to be the richest Raja north of the Sutlej River, has approached us with the intent of buying Kashmir and establishing a princely state there. He would still be subject to our rule and selling the land will help us as we lack the resources to properly occupy such a large region immediately after annexing Punjab.;;;;;;;;;;;;;x
EVTNAME3697009;Gulab Singh’s Proposal;;;;;;;;;;;;;x
EVTOPTA3697009;It’s a nice proposal, we accept.;;;;;;;;;;;;;x
EVTOPTB3697009;We will try our hand at administrating it anyway.;;;;;;;;;;;;;x
EVTDESC3697010;Our claims in India is a constant source of conflict with the Indian Princes and occasionally even the British government itself. In $YEAR$, Mortimer Durand was dispatched to Kabul by the government of British India to sign an agreement with Amir Abdur Rahman Khan for fixing the limits of their respective spheres of influence as well as improving diplomatic relations and trade. Signing this agreement means relinquishing our claims in India, but it also means normalizing relations with the British.;;;;;;;;;;;;;x
EVTNAME3697010;The Afghan-British Settlement of $YEAR$;;;;;;;;;;;;;x
EVTOPTA3697010;We agree.;;;;;;;;;;;;;x
EVTOPTB3697010;We won’t give up our claims.;;;;;;;;;;;;;x
EVTDESC3697011;In $YEAR$, two $COUNTRY_ADJ$ physicians, one being in charge of relations between the $COUNTRY_ADJ$ and Sikkimese governments, ventured into the mountains of Sikkim unannounced and unauthorized. The doctors were detained by the Sikkimese government, and now high-ranking officials are demanding that we outfit a punitive expedition to punish the Sikkimese government.;;;;;;;;;;;;;x
EVTNAME3697011;The $YEAR$ Sikkim Incident;;;;;;;;;;;;;x
EVTOPTA3697011;Outfit a punitive expedition.;;;;;;;;;;;;;x
EVTOPTB3697011;Bide our time.;;;;;;;;;;;;;x
EVTDESC3697012;The traitorous house of bin Thani in Qatar, our vassals, are declaring independence over rebellions that broke out in their territory. Doha and the peninsula rightfully belong to us and the house of Al Khalifa won’t stand for this.;;;;;;;;;;;;;x
EVTNAME3697012;The Bahrain-Qatar War;;;;;;;;;;;;;x
EVTOPTA3697012;Unite the tribes and march for Doha!;;;;;;;;;;;;;x
EVTDESC3697013;A war has broken out between the rulers of Bahrain and Qatar, in violation with several treaties we had with the house Al Khalifa from Bahrain. Qatar dignitaries came to our country to ask for help and governors of regions nearby are strongly in favour of a $COUNTRY_ADJ$ intervention.;;;;;;;;;;;;;x
EVTOPTA3697013;Intervention is necessary.;;;;;;;;;;;;;x
EVTOPTB3697013;Outfit an expedition right now.;;;;;;;;;;;;;x
EVTOPTC3697013;Don’t intervene.;;;;;;;;;;;;;x
EVTDESC3697014;Our prominent position in Arabia brought us a unique opportunity: we can establish embassies and support the various independent states in the peninsula, greatly increasing our relation with them.;;;;;;;;;;;;;x
EVTNAME3697014;The Rulers of Arabia;;;;;;;;;;;;;x
EVTOPTA3697014;We should have good relations with our neighbours.;;;;;;;;;;;;;x
EVTOPTB3697014;There’s no need for this.;;;;;;;;;;;;;x
EVTDESC3697120;Our lands in the Indian Raj have been overrun, our enemies among the Indians having successfully driven us off the subcontinent. We have been forced to consider whether we should retreat from India altogether. There are those in the $COUNTRY_ADJ$ government who say the time has come: clearly the Indians wish us gone. Others say we must not submit to what amounts to a temporary setback. The Indians can be forced to submit, if we focus our efforts on the matter.;;;;;;;;;;;;;x
EVTNAME3697120;Retreat From India?;;;;;;;;;;;;;x
EVTDESC3697121;The war with $FROMCOUNTRY$ has come to an abrupt end. With most of $FROMCOUNTRY_ADJ$ India either occupied or in disarray, the $FROMCOUNTRY_ADJ$ government has decided to retreat from the subcontinent completely. Governors have been spotted fleeing, leaving colonial mansions completely emptied. While this does leave the nation in a state of relative chaos, a great $COUNTRY_ADJ$ victory has been achieved! India is at last freed!;;;;;;;;;;;;;x
EVTNAME3697121;$FROMCOUNTRY$ Retreats From India!;;;;;;;;;;;;;x
EVTDESC3755286;The great war between the Americas is over, and $COUNTRY$ has suffered a great and humiliating defeat at the hands of the South Americans. All lands taken by the United States during the Mexican-American war are to be surrendered to back to Mexico, and several states are being organized into independent republics. It is unlikely the United States will ever recover from this defeat. One thing that is certain is the New World belongs to the South Americans.;;;;;;;;;;;;;x
EVTDESC3795501;A conference has been held in $FROMCOUNTRY$, attended by all colonial powers, to discuss the regulation of colonization and trade in India. A general agreement has been reached, formalizing the scramble for the Indian continent. After this point, any civilized country will largely be seen as justified in aggression towards uncivilized Indian nations.;;;;;;;;;;;;;x
EVTNAME3795501;The Scramble for India;;;;;;;;;;;;;x
EVTDESC3795502;Word has reached $COUNTRY$ of a great meeting of colonial powers in Europe, wherein it was decided that Indian nations would be divided up amongst them-as if our people were little more than children’s toys discarded and left waiting to be picked up. This has caused a great deal of concern among those of our people with the knowledge to understand what this means. For others it has brought little more than resentment, as well as vows to fight for our independence when the day comes.;;;;;;;;;;;;;x
EVTDESC3886062;Brazil’s transition into a republic has not been as stable as some have hoped. There are frequent clashes in the streets between conservatives and liberals which end in large amount of bloodshed by both sides. Something must be done, and those on the right are demanding the military step in to secure order and centralize the state. This might grant some stability, but it would be a betrayal to the ideas of democracy.;;;;;;;;;;;;;x
EVTDESC4102182;Any question regarding the supremacy of South America has been answered by the thunderous sounds of South American boots marching through the Yankee capital. The great war is won, and the United States is over. Their reign of terror in the Caribbean and the Americas has finally come to an end. Latin America is in control of its own destiny, and the imperialist of the world quake in fear as the sons and daughters of Simon Bolivar stand strong in the New World.;;;;;;;;;;;;;x
EVTDESC4115722;Seeing the benefits of solidarity with their southern brethren, the Mexicans have submitted to our demands and our now firmly under our control. While we can celebrate for now, South America must prepare itself to a possible conflict with the United States. Our actions in Mexico have angered many in the country, and although Washington has yet to issue a statement, we can predict it will most likely be one of condemnation.;;;;;;;;;;;;;x
EVTDESC4408766;Due to the collapse of American hegemony, $COUNTRY$ is at a cross roads. Should we end the union created under American supervision, or enact emergency measures to ensure the future of $COUNTRY$. Choosing the latter will lead to an era of civil unrest as we struggle to establish our legitimacy without the backing of our American overlords.;;;;;;;;;;;;;x
EVTDESC4413218;It is no secret that America has a troubled history regarding the enslavement of Africans. There are those who would argue that only through providing African Americans with their own autonomous region will the wrongs of the country’s past be corrected. However, others assert that doing so would only isolate African Americans and fail to properly address their problems.;;;;;;;;;;;;;x
EVTDESC4413220;In the names of anti-imperialism, communism, and self-determination, the People’s Union of New Africa has been formally established. Time will tell how the new nation will fare.;;;;;;;;;;;;;x
EVTDESC4413221;In the recent years, New Africa has become a great power and one that, many argue, should expand. Plans have been drafted for liberation of workers of the rich sugar plantations dotted across the islands of the Caribbean. Although perhaps the destiny of New Africa rests in the lands of the American South where our enslaved ancestors once toiled.;;;;;;;;;;;;;x
EVTDESC4413222;A recent effort has been made in New Africa to integrate the black and white population. Although there is a disagreement as to what extent integration should be attempted. While it is agreeable to most for the extension of rights to Northern immigrants or so-called Yankees, there is a great deal of discomfort at the thought of extending rights to Southerners that once practiced slavery. No matter the choice, the far-right elements are bound to protest.;;;;;;;;;;;;;x
